keyword,title,publication
android_issue,An end-to-end pollution analysis and detection system using artificial intelligence and object detection algorithms,Decision Analytics Journal
android_issue,Developing a mobile app for remote access to and data analysis of spectra,Vibrational Spectroscopy
android_issue,A smartphone sensors-based personalized human activity recognition system for sustainable smart cities,Sustainable Cities and Society
android_issue,Parallel Speech Collection for Under-resourced Language Studies Using the Lig-Aikuma Mobile Device App,Procedia Computer Science
android_issue,Development of a mobile computing framework to aid decision-making on organic fertilizer management using a crop growth model,Computers and Electronics in Agriculture
android_issue,MidHDC: Advanced Topics on Middleware Services for Heterogeneous Distributed Computing. Part 1,Future Generation Computer Systems
android_issue,Mobile application for the evaluation and planning of nursing workload in the intensive care unit,International Journal of Medical Informatics
android_issue,Development of Urine Hydration System Based on Urine Color and Support Vector Machine,Procedia Computer Science
android_issue,Efficient feature extraction model for validation performance improvement of duplicate bug report detection in software bug triage systems,Information and Software Technology
android_issue,Social networking sites and the legal profession: Balancing benefits with navigating minefields,Computer Law & Security Review
android_issue,Machine learning based approach to analyze file meta data for smart phone file triage,Forensic Science International: Digital Investigation
android_issue,iviz: A ROS visualization app for mobile devices,Software Impacts
android_issue,Designing a smartphone app to teach English (L2) vocabulary,Computers & Education
android_issue,A software development for medical with a multiple decision taking functionalities,Advances in Engineering Software
android_issue,Optimizing power consumption in multicore smartphones,Journal of Parallel and Distributed Computing
android_issue,NCVCS: Network-coding-based video conference system for mobile devices in multicast networks,Ad Hoc Networks
android_issue,Development of cognitive behavior therapy apps application on depression management in patients of diabetes mellitus type II,Enfermería Clínica
android_issue,Experiment and enabled flow for GPGPU-Sim simulators with fixed-point instructions,Journal of Systems Architecture
android_issue,Situation-based privacy autonomous management for mobile social networks,Computer Communications
android_issue,A middleware for opportunistic content distribution,Computer Networks
android_issue,Educational apps from the Android Google Play for Greek preschoolers: A systematic review,Computers & Education
android_issue,Chapter 2: Forensics Analysis of Android Mobile VoIP Apps,Contemporary Digital Forensic Investigations of Cloud and Mobile Applications
android_issue,A revised open source usability defect classification taxonomy,Information and Software Technology
android_issue,Chapter 12: Sugarcane leaf disease detection through deep learning,Deep Learning for Sustainable Agriculture
android_issue,Obésité et syndrome métabolique : une épidémie pour le nouveau siècle,Bulletin de l'Académie Nationale de Médecine
android_issue,Chapter 9: Pulse oximeter-based machine learning models for sleep apnea detection in heavy vehicle drivers,Autonomous and Connected Heavy Vehicle Technology
android_issue,C5.0: Advanced Decision Tree (ADT) classification model for agricultural data analysis on cloud,Computers and Electronics in Agriculture
android_issue,MobileFBP: Designing portable reconfigurable applications for heterogeneous systems,Journal of Systems Architecture
android_issue,Mobile applications in oncology: A systematic review of health science databases,International Journal of Medical Informatics
android_issue,Blockchain for secure location verification,Journal of Parallel and Distributed Computing
android_issue,Transfer learning approach for classification and noise reduction on noisy web data,Expert Systems with Applications
android_issue,Quadratic polynomial guided fuzzy C-means and dual attention mechanism for medical image segmentation,Displays
android_issue,Peer-assisted video on-demand streaming system in practical WiFi-based mobile opportunistic networks,Journal of Network and Computer Applications
android_issue,Acquiring vulnerability indicators to geo-hydrological hazards: An example of mobile phone-based data collection,International Journal of Disaster Risk Reduction
android_issue,CRIMP: Here crisis mapping goes offline,Journal of Network and Computer Applications
android_issue,Smartwatch games: Encouraging privacy-protective behaviour in a longitudinal study,Computers in Human Behavior
android_issue,Where is my feature and what is it about? A case study on recovering feature facets,Journal of Systems and Software
android_issue,Systematic review of smartphone-based passive sensing for health and wellbeing,Journal of Biomedical Informatics
android_issue,Collaborative noise data collected from smartphones,Data in Brief
android_issue,MagicSox: An E-textile IoT system to quantify gait abnormalities,Smart Health
android_issue,Binary search tree based hierarchical placement algorithm for IoT based smart parking applications,Internet of Things
android_issue,Research on de-motion blur image processing based on deep learning,Journal of Visual Communication and Image Representation
android_issue,Evaluating the effect of gamification on the deployment of digital cultural probes for children,International Journal of Human-Computer Studies
android_issue,AnaDroid: Malware Analysis of Android with User-supplied Predicates,Electronic Notes in Theoretical Computer Science
android_issue,A personalized mobile patient guide system for a patient-centered smart hospital: Lessons learned from a usability test and satisfaction survey in a tertiary university hospital,International Journal of Medical Informatics
android_issue,Application-aware end-to-end delay and message loss estimation in Internet of Things (IoT) — MQTT-SN protocols,Future Generation Computer Systems
android_issue,Re-usable electrochemical glucose sensors integrated into a smartphone platform,Biosensors and Bioelectronics
android_issue,Clinicians' perceptions of PTSD Coach Australia,Internet Interventions
android_issue,Output-oriented power saving mode for mobile devices,Future Generation Computer Systems
android_issue,Automatic security verification of mobile app configurations,Future Generation Computer Systems
android_issue,Chapter 25: Security Management Systems,Computer and Information Security Handbook (Third Edition)
android_issue,A comparison of mobile form controls for different tasks,Computer Standards & Interfaces
android_issue,The ANDROID Case Study; Venice and its Territory: Vulnerability and Resilience in Multi-hazard Scenarios,Procedia Economics and Finance
android_issue,Chapter 2: Security Management Systems,Managing Information Security (Second Edition)
android_issue,Eavesdrop with PoKeMon: Position free keystroke monitoring using acoustic data,Future Generation Computer Systems
android_issue,Offline computer-aided diagnosis for Glaucoma detection using fundus images targeted at mobile devices,Computer Methods and Programs in Biomedicine
android_issue,Chapter 22: Security Management Systems,Computer and Information Security Handbook (Second Edition)
android_issue,"A smart mobile, self-configuring, context-aware architecture for personal health monitoring",Engineering Applications of Artificial Intelligence
android_issue,A privacy-preserving smart parking system using an IoT elliptic curve based security platform,Computer Communications
android_issue,Achieving Disaster Resilience through the Sri Lankan Early Warning System: Good practises of Disaster Risk Reduction and Management,Procedia Economics and Finance
android_issue,Evaluation of user satisfaction and usability of a mobile app for smoking cessation,Computer Methods and Programs in Biomedicine
android_issue,Bi-directional Long Short-Term Memory model to analyze psychological effects on gamers,Applied Soft Computing
android_issue,Development of a smartphone-based balance assessment system for subjects with chronic stroke,Annals of Physical and Rehabilitation Medicine
android_issue,SSCLS: A Smartphone-Supported Collaborative Learning System,Telematics and Informatics
android_issue,Pilot Study of Home Vitals and Activity Monitoring for Allogeneic Hematopoietic Cell Transplant Recipients,Biology of Blood and Marrow Transplantation
android_issue,"Vitamin D status, body composition and hypertensive target organ damage in primary hypertension",The Journal of Steroid Biochemistry and Molecular Biology
android_issue,Running an Online Radiology Teaching Conference: Why It’s a Great Idea and How to Do It Successfully,Academic Radiology
android_issue,T-Res : le futur de l’évaluation des internes en urologie ?,Progrès en Urologie
android_issue,2345: Developing Conflict Analysis as a Surrogate Safety Measure Using an Expert Survey,Journal of Transport & Health
android_issue,No internet? No problem! Creative approaches to cost-effective e-learning delivery in resource-constrained settings,The Lancet Global Health
android_issue,"Hip fractures: incidence, risk factors, energy absorption, and prevention",Bone
android_issue,Enhancing Adherence to Prescribed Opioids Using a Mobile-Based App: A Feasibility Study in Non-Cancer Pain,Blood
