keyword,title,publication
mobile_latency,Functional condition of the mandible: physical structures of free mandibular movement,Annals of Anatomy - Anatomischer Anzeiger
mobile_latency,Incremental route inference from low-sampling GPS data: An opportunistic approach to online map matching,Information Sciences
mobile_latency,Scenes: Abstracting interaction in immersive sensor networks,Pervasive and Mobile Computing
mobile_latency,Architecture and performance evaluation of distributed computation offloading in edge computing,Simulation Modelling Practice and Theory
mobile_latency,A taxonomy of AI techniques for 6G communication networks,Computer Communications
mobile_latency,LORD: Tracking mobile clients in a real mesh,Ad Hoc Networks
mobile_latency,Gray code clustering of wireless data for partial match queries,Journal of Systems Architecture
mobile_latency,Fuzzy-TOPSIS based Cluster Head selection in mobile wireless sensor networks,Journal of Electrical Systems and Information Technology
mobile_latency,FPGA-accelerated SmartNIC for supporting 5G virtualized Radio Access Network,Computer Networks
mobile_latency,A Lightweight Deep Learning Model for Human Activity Recognition on Edge Devices,Procedia Computer Science
mobile_latency,Cost-aware automatic scaling and workload-aware replica management for edge-cloud environment,Journal of Network and Computer Applications
mobile_latency,Q-learning based collaborative cache allocation in mobile edge computing,Future Generation Computer Systems
mobile_latency,DNNShifter: An efficient DNN pruning system for edge computing,Future Generation Computer Systems
mobile_latency,A networked-based MPC architecture for constrained LPV systems,IFAC-PapersOnLine
mobile_latency,Security and privacy vulnerabilities of 5G/6G and WiFi 6: Survey and research directions from a coexistence perspective,Computer Networks
mobile_latency,Energy efficient zone based routing protocol for MANETs,Ad Hoc Networks
mobile_latency,EdgeDrone: QoS aware MQTT middleware for mobile edge computing in opportunistic Internet of Drone Things,Computer Communications
mobile_latency,STRATEGIC CONTROL OF MOBILE ROBOTS,IFAC Proceedings Volumes
mobile_latency,Intelligent Real-Time IoT Traffic Steering in 5G Edge Networks,CMES - Computer Modeling in Engineering and Sciences
mobile_latency,QoE-aware user allocation in edge computing systems with dynamic QoS,Future Generation Computer Systems
mobile_latency,Introduction to the Special Issue on edge intelligence: Neurocomputing meets edge computing,Neurocomputing
mobile_latency,Architecture selection for 5G-radio access network using type-2 neutrosophic numbers based decision making model,Expert Systems with Applications
mobile_latency,Chapter 16: Dynamic Uncertainty-Based Analytics for Caching Performance Improvements in Mobile Broadband Wireless Networks,Big Data
mobile_latency,Trade-off analysis between delay and throughput of RAN slicing for smart grid,Computer Communications
mobile_latency,User interface-level QoE analysis for Android application tuning,Pervasive and Mobile Computing
mobile_latency,A QoS-aware routing protocol with adaptive feedback scheme for video streaming for mobile networks,Computer Communications
mobile_latency,A new routing protocol for energy efficient mobile applications for ad hoc networks,Computers & Electrical Engineering
mobile_latency,D3M: Multicast listener mobility support mechanisms over distributed mobility anchoring architectures,Journal of Network and Computer Applications
mobile_latency,Selecting representative affective dimensions using Procrustes analysis: An application to mobile phone design,Applied Ergonomics
mobile_latency,Anticoagulant and signaling functions of antithrombin,Journal of Thrombosis and Haemostasis
mobile_latency,DATALET: An approach to manage big volume of data in cyber foraged environment,Journal of Parallel and Distributed Computing
mobile_latency,Perspectives for short-term thermal energy storage using salt hydrates for building heating,Energy
mobile_latency,Recent research in cloud radio access network (C-RAN) for 5G cellular systems - A survey,Journal of Network and Computer Applications
mobile_latency,Implementation of Behavior Change Techniques in Mobile Applications for Physical Activity,American Journal of Preventive Medicine
mobile_latency,Development and Experimental Verification of a Mobile Client-Centric Networked Controlled System,European Journal of Control
mobile_latency,Speech-controlled cloud-based wheelchair platform for disabled persons,Microprocessors and Microsystems
mobile_latency,An efficient broadcast data clustering method for multipoint queries in wireless information systems,Journal of Systems and Software
mobile_latency,A Trust-based Uncoordinated Checkpointing Algorithm in Mobile Ad Hoc Networks (MANETs),Procedia Computer Science
mobile_latency,Fuzzy Dissimilarity based Multidimensional Scaling and its Application to Collaborative Learning Data,Procedia Computer Science
mobile_latency,Self-attention convolutional neural network optimized with season optimization algorithm Espoused Chronic Kidney Diseases Diagnosis in Big Data System,Biomedical Signal Processing and Control
mobile_latency,A self-organized backpressure routing scheme for dynamic small cell deployments,Ad Hoc Networks
mobile_latency,Discovering long lifetime routes in mobile ad hoc networks,Ad Hoc Networks
mobile_latency,Treatment seeking as a mechanism of change in a randomized controlled trial of a mobile health intervention to support recovery from alcohol use disorders,Journal of Substance Abuse Treatment
mobile_latency,Delay-aware content distribution via cell clustering and content placement for multiple tenants,Journal of Network and Computer Applications
mobile_latency,5G Virtualized Multi-access Edge Computing Platform for IoT Applications,Journal of Network and Computer Applications
mobile_latency,Robust soft sensor systems for industry: Evaluated through real-time case study,Measurement: Sensors
mobile_latency,The counterintuitive self-regulated learning behaviours of healthcare providers from low-income settings,Computers & Education
mobile_latency,Osmotic computing-based service migration and resource scheduling in Mobile Augmented Reality Networks (MARN),Future Generation Computer Systems
mobile_latency,Optimized RNN-based performance prediction of IoT and WSN-oriented smart city application using improved honey badger algorithm,Measurement
mobile_latency,On building human-aware opportunistic communication strategies for cost-effective content delivery,Computer Communications
mobile_latency,DroneCOCoNet: Learning-based edge computation offloading and control networking for drone video analytics,Future Generation Computer Systems
mobile_latency,Imperfect ImaGANation: Implications of GANs exacerbating biases on facial data augmentation and snapchat face lenses,Artificial Intelligence
mobile_latency,Trust-aware location recommendation in location-based social networks: A graph-based approach,Expert Systems with Applications
mobile_latency,An efficient location management scheme based on replication strategy for intersystem roaming in mobile wireless networks,Computer Communications
mobile_latency,Mobile object layer: a runtime substrate for parallel adaptive and irregular computations,Advances in Engineering Software
mobile_latency,"Pervasive intelligent endogenous 6G wireless systems: Prospects, theories and key technologies",Digital Communications and Networks
mobile_latency,Ad hoc cooperative vertical handover for next-generation heterogeneous networks,AEU - International Journal of Electronics and Communications
mobile_latency,Dynamic anchor points selection for mobility management in Software Defined Networks,Journal of Network and Computer Applications
mobile_latency,Blockchain based integrated security measure for reliable service delegation in 6G communication environment,Computer Communications
mobile_latency,An Enhanced Secure Mobility Management Scheme for Building IoT Applications,Procedia Computer Science
mobile_latency,A Green Converged TWDM-PON and 5G HetNet Catering Applications Demanding Low Latency,Optical Fiber Technology
mobile_latency,SGMA: Semi-granted multiple access for non-orthogonal multiple access (NOMA) in 5G networking,Journal of Network and Computer Applications
mobile_latency,Multimedia call admission control in mobile networks: a dynamical reservation-pool approach,Computer Networks
mobile_latency,Game theory-based attack and defense analysis in virtual wireless networks with jammers and eavesdroppers,Digital Communications and Networks
mobile_latency,The aging brain shows less flexible reallocation of cognitive resources during dual-task walking: A mobile brain/body imaging (MoBI) study,NeuroImage
mobile_latency,Intelligent and situation-aware pervasive system to support debris-flow disaster prediction and alerting in Taiwan,Journal of Network and Computer Applications
mobile_latency,Improving consumer satisfaction in smart cities using edge computing and caching: A case study of date fruits classification,Future Generation Computer Systems
mobile_latency,A Secure IPv6-based Urban Wireless Mesh Network (SUMNv6),Computer Communications
mobile_latency,Smartphone and Tablet Application (App) Life Cycle Characterization via Apple App Store Rank,Data and Information Management
mobile_latency,Chapter 6: Artificial intelligence technology in the Internet of things,Intelligent Sensing and Communications for Internet of Everything
mobile_latency,Cooling of mobile electronic devices using phase change materials,Applied Thermal Engineering
mobile_latency,User association and resource allocation in 5G (AURA-5G): A joint optimization framework,Computer Networks
mobile_latency,A simulation study on the performance of hierarchical mobile IPv6,Teletraffic Science and Engineering
mobile_latency,CFMCRS: Calibration fuzzy- metaheuristic clustering routing scheme simultaneous in on-demand WRSNs for sustainable smart city,Expert Systems with Applications
mobile_latency,Analysis of Handover Key Management schemes under IETF perspective,Computer Standards & Interfaces
mobile_latency,Investigating the impact of Sense of Place on site visit frequency with non-motorized travel modes,Journal of Transport Geography
mobile_latency,Disturbed sleep as a clinical marker of wish to die: A smartphone monitoring study over three months of observation,Journal of Affective Disorders
mobile_latency,Navigation-driven handoff minimization in wireless networks,Journal of Network and Computer Applications
mobile_latency,MOVE: A mobile personalized virtual computing environment,Future Generation Computer Systems
mobile_latency,An Administrative Cluster-based Cooperative Caching (ACCC) strategy for Mobile Ad Hoc Networks,Journal of Network and Computer Applications
mobile_latency,WSN in cyber physical systems: Enhanced energy management routing approach using software agents,Future Generation Computer Systems
mobile_latency,Power-aware data retrieval protocols for indexed broadcast parallel channels,Pervasive and Mobile Computing
mobile_latency,Chapter 4 The Emerging Landscape of Computer Performance Evaluation,Advances in Computers
mobile_latency,Remote access of ISO 11783 process data by using OPC Unified Architecture technology,Computers and Electronics in Agriculture
mobile_latency,ARBAT: A flexible network architecture for QoE-aware communications in 5G systems,Computer Networks
mobile_latency,Chapter 16: Choice of IoT technology,Cellular Internet of Things (Second Edition)
mobile_latency,An Efficient Broadcasting Scheme in Mobile Ad-Hoc Networks,Procedia Computer Science
mobile_latency,Genetic Algorithm based feature selection and Naïve Bayes for anomaly detection in fog computing environment,Machine Learning with Applications
mobile_latency,Can subjective sleep problems detect latent sleep disorders among commercial drivers?,Accident Analysis & Prevention
mobile_latency,"Cyberslacking, engagement, and personality in distributed work environments",Computers in Human Behavior
mobile_latency,Asociación entre las radiaciones de teléfonos móviles y el riesgo tumoral en personas adultas,Gaceta Sanitaria
mobile_latency,Utilizing mHealth methods to identify patterns of high risk illicit drug use,Drug and Alcohol Dependence
mobile_latency,End-to-end congestion control approaches for high throughput and low delay in 4G/5G cellular networks,Computer Networks
mobile_latency,A H-QoS-demand personalized home physiological monitoring system over a wireless multi-hop relay network for mobile home healthcare applications,Journal of Network and Computer Applications
mobile_latency,A protocol for data availability in Mobile Ad-Hoc Networks in the presence of insider attacks,Ad Hoc Networks
mobile_latency,Middle latency auditory-evoked potential index for predicting the degree of consciousness of comatose patients in EDs,The American Journal of Emergency Medicine
mobile_latency,5: Broadcasting in vehicular networks,Vehicular Communications and Networks
mobile_latency,Effects of Viral Mutation on Cellular Dynamics in a Monte Carlo Simulation of HIV Immune Response Model in Three Dimensions,Theory in Biosciences
mobile_latency,Principal component analysis of the P600 waveform: RF and gender effects,Neuroscience Letters
mobile_latency,Thermodynamic analysis and prediction of reservoir temperature distribution for steam stimulation,Journal of Petroleum Science and Engineering
mobile_latency,Graphene-enhanced hybrid phase change materials for thermal management of Li-ion batteries,Journal of Power Sources
mobile_latency,Data locality optimization based on data migration and hotspots prediction in geo-distributed cloud environment,Knowledge-Based Systems
mobile_latency,Low latency handoff mechanisms and their implementation in an IEEE 802.11 network,Teletraffic Science and Engineering
mobile_latency,An efficient and robust name resolution protocol for dynamic MANETs,Ad Hoc Networks
mobile_latency,The importance of spatio-temporal infrastructure assessment: Evidence for 5G from the Oxford–Cambridge Arc,"Computers, Environment and Urban Systems"
mobile_latency,Effects of a cannabis use disorder text message–delivered treatment on young adult alcohol misuse: Differential effects by gender,Journal of Substance Abuse Treatment
mobile_latency,Software-defined networking in cyber-physical systems: A survey,Computers & Electrical Engineering
mobile_latency,Case study on handoff strategies for wireless overlay networks,Computer Standards & Interfaces
mobile_latency,Predicting food choices based on eye-tracking data: Comparisons between real-life and virtual tasks,Appetite
mobile_latency,Energy-efficient forwarding mechanism for wireless opportunistic networks in emergency scenarios,Computer Communications
mobile_latency,Chapter 4: EC-GSM-IoT Performance,Cellular Internet of Things
mobile_latency,HealthCloud: A system for monitoring health status of heart patients using machine learning and cloud computing,Internet of Things
mobile_latency,A hybrid handover scheme for integrated networks,Computer Communications
mobile_latency,Efficient detection of motion-trend predicates in wireless sensor networks,Computer Communications
mobile_latency,Digital transformation of technological IP portfolio analysis for complex domain of satellite communication innovations,Advanced Engineering Informatics
mobile_latency,A privacy-preserving encrypted OSN with stateless server interaction: The Snake design,Computers & Security
mobile_latency,Multi-constraints link stable multicast routing protocol in MANETs,Ad Hoc Networks
mobile_latency,Leveraging heterogeneous device connectivity in a converged 5G-IoT ecosystem,Computer Networks
mobile_latency,Processing data where it makes sense: Enabling in-memory computation,Microprocessors and Microsystems
mobile_latency,QoS-aware multicast routing protocol for Ad hoc networks,Journal of Systems Engineering and Electronics
mobile_latency,Chapter 1: The Internet of Things,Cellular Internet of Things (Second Edition)
mobile_latency,Chapter 2: Distributed impedance control of latency-prone robotic systems with series elastic actuation,"Stability, Control and Application of Time-delay Systems"
mobile_latency,Understanding urban mobility patterns with a probabilistic tensor factorization framework,Transportation Research Part B: Methodological
mobile_latency,Disaster exposure and patterns of disaster preparedness: A multilevel social vulnerability and engagement perspective,Journal of Environmental Management
mobile_latency,IP multicast group management for point-to-point local distribution,Computer Communications
mobile_latency,"Routing, power control and rate adaptation: A Q-learning-based cross-layer design",Computer Networks
mobile_latency,Fuzzy logic weighted multi-criteria of dynamic route lifetime for reliable multicast routing in ad hoc networks,Expert Systems with Applications
mobile_latency,Ultrafast fabrication of thermally stable protein-coated silver iodide nanoparticles for solid-state superionic conductors,Colloids and Surfaces B: Biointerfaces
mobile_latency,Chapter 5: Visual Pattern Mining,Learning-Based Local Visual Representation and Indexing
mobile_latency,Unsupervised domain adaptation for mobile semantic segmentation based on cycle consistency and feature alignment,Image and Vision Computing
mobile_latency,Balancing message delivery latency and network lifetime through an integrated model for clustering and routing in Wireless Sensor Networks,Computer Networks
mobile_latency,Design of optimal short OFDM-type windows,Signal Processing
mobile_latency,On-chip implementation of a low-latency bit-accurate reciprocal square root unit,Integration
mobile_latency,Routing protocol based on social characteristics for opportunistic networks,The Journal of China Universities of Posts and Telecommunications
mobile_latency,Application-aware resource allocation and data management for MEC-assisted IoT service providers,Journal of Network and Computer Applications
mobile_latency,Energy-efficient mobile target detection in Wireless Sensor Networks with random node deployment and partial coverage,Pervasive and Mobile Computing
mobile_latency,Eye-hand coordination strategies during active video game playing: An eye-tracking study,Computers in Human Behavior
mobile_latency,Reducing WWW latency and bandwidth requirements by real-time distillation,Computer Networks and ISDN Systems
mobile_latency,Chapter 11: The fifth generation fixed network (F5G),Optical Communications in the 5G Era
mobile_latency,NOMA and 5G emerging technologies: A survey on issues and solution techniques,Computer Networks
mobile_latency,Latency- and capacity-aware placement of chained Virtual Network Functions in FMC metro networks,Optical Switching and Networking
mobile_latency,"Real-time, speech-in-speech hiding scheme based on least significant bit substitution and adaptive key",Computers & Electrical Engineering
mobile_latency,Caching hit probability and Compressive Sensing perspective for mobile cellular networks,Simulation Modelling Practice and Theory
mobile_latency,Towards secure 5G networks: A Survey,Computer Networks
mobile_latency,A latent class analysis on adolescents media use and associations with health related quality of life,Computers in Human Behavior
mobile_latency,Part-whole dissemination of large multimedia contents in opportunistic networks,Computer Communications
mobile_latency,Mobile computing and communications-driven fog-assisted disaster evacuation techniques for context-aware guidance support: A survey,Computer Communications
mobile_latency,Servicing delay sensitive pervasive communication through adaptable width channelization for supporting mobile edge computing,Computer Communications
mobile_latency,Epoxy composites with high cross-plane thermal conductivity by constructing all-carbon multidimensional carbon fiber/graphite networks,Composites Science and Technology
mobile_latency,Scalability study of cache access mechanisms in multiple-cell wireless networks,Computer Networks
mobile_latency,When edges become centered: The ceramic social geography of early pottery communities of the American Southeast,Journal of Anthropological Archaeology
mobile_latency,Place Concept Learning by hMLDA Based on Position and Vision Information,IFAC-PapersOnLine
mobile_latency,Efficient Buffer Management Protocol for Multicast Streaming in MANET,Procedia Computer Science
mobile_latency,A fair QoS-aware dynamic LTE scheduler for machine-to-machine communication,Computer Communications
mobile_latency,Chapter 5: UMC: Current Market Solution Overview,Fixed/Mobile Convergence and Beyond
mobile_latency,Chapter 6: LTE-M performance,Cellular Internet of Things (Second Edition)
mobile_latency,Synchronous and asynchronous video observed therapy (VOT) for tuberculosis treatment adherence monitoring and support,Journal of Clinical Tuberculosis and Other Mycobacterial Diseases
mobile_latency,Seamless multicast mobility support using fast MIPv6 extensions,Computer Communications
mobile_latency,PainRhythms: Machine learning prediction of chronic pain from circadian dysregulation using actigraph data — a preliminary study,Smart Health
mobile_latency,MSOCKS+: an architecture for transport layer mobility,Computer Networks
mobile_latency,An Effective Method for Habitual Behavior Extraction from the Internet,Procedia Computer Science
mobile_latency,Comparison of text messaging and paper-and-pencil for ecological momentary assessment of food craving and intake,Appetite
mobile_latency,Connecting the dots: understanding how human mobility shapes TB epidemics,Trends in Microbiology
mobile_latency,Cache-miss-initiated prefetch in mobile environments,Computer Communications
mobile_latency,Accelerated collection of sensor data by mobility-enabled topology ranks,Journal of Systems and Software
mobile_latency,On the expressivity of time-varying graphs,Theoretical Computer Science
mobile_latency,Federated IoT services leveraging 5G technologies at the edge,Ad Hoc Networks
mobile_latency,Lattice-based Spatio-temporal Ensemble Prediction,Procedia Computer Science
mobile_latency,A single night of moderate at-home sleep restriction increases hunger and food intake in overweight young adults,Nutrition
mobile_latency,Privacy-preserving and energy efficient task offloading for collaborative mobile computing in IoT: An ADMM approach,Computers & Security
mobile_latency,Edge computing optimization for efficient RRH-BBU assignment in cloud radio access networks,Computer Networks
mobile_latency,A novel network mobility management scheme supporting seamless handover for high-speed trains,Computer Communications
mobile_latency,Vehicular networks using the IEEE 802.11p standard: An experimental analysis,Vehicular Communications
mobile_latency,Transitioning EEG experiments away from the laboratory using a Raspberry Pi 2,Journal of Neuroscience Methods
mobile_latency,Low-cost itineraries for multi-hop agents designed for scalable monitoring of multiple subnets,Computer Networks
mobile_latency,Data broadcasting for dependent information using multiple channels in wireless broadcast environments,Journal of Parallel and Distributed Computing
mobile_latency,A mobility management scheme for wireless mesh networks based on a hybrid routing protocol,Computer Networks
mobile_latency,Client/server messaging protocols in serverless environments,Journal of Network and Computer Applications
mobile_latency,Measurement of intention to travel: Considering the effect of telecommunications on trips,Transportation Research Part C: Emerging Technologies
mobile_latency,Spastic movement disorder: impaired reflex function and altered muscle mechanics,The Lancet Neurology
mobile_latency,Resources and spatial analysis at actual Nenets campsites: Ethnoarchaeological implications,Journal of Anthropological Archaeology
mobile_latency,Trajectories of traumatic stress symptoms during conflict: A latent class growth analysis,Journal of Affective Disorders
mobile_latency,Quality-of-service aware routing for static and mobile IPv6-based low-power and lossy sensor networks using RPL,Ad Hoc Networks
mobile_latency,A novel all-frequency spherical harmonic lighting technique for 5G networks,Computers & Electrical Engineering
mobile_latency,Co-operative Traffic Solutions for Hybrid Communication Environments,Transportation Research Procedia
mobile_latency,"AI-empowered, blockchain and SDN integrated security architecture for IoT network of cyber physical systems",Computer Communications
mobile_latency,"DevCom: Device communities for user-friendly and trustworthy communication, sharing, and collaboration",Computer Communications
mobile_latency,The extent of reliability for vehicle-to-vehicle communication in safety critical applications: an experimental study,Journal of Intelligent Transportation Systems
mobile_latency,Ubiquitous Distributed Deep Reinforcement Learning at the Edge: Analyzing Byzantine Agents in Discrete Action Spaces,Procedia Computer Science
mobile_latency,Can digital health technologies exacerbate the health gap? A clustering analysis of mothers’ opinions toward digitizing the maternal and child health handbook,SSM - Population Health
mobile_latency,CoMP clustering and backhaul limitations in cooperative cellular mobile access networks,Pervasive and Mobile Computing
mobile_latency,Energy-aware and adaptive fog storage mechanism with data replication ruled by spatio-temporal content popularity,Journal of Network and Computer Applications
mobile_latency,FPGA-based adaptive space–time compression towards 5G MIMO fronthaul,Optics Communications
mobile_latency,Chapter 4: New Radio Access Physical Layer Aspects (Part 2),5G NR
mobile_latency,Chapter 3: New Radio Access Physical Layer Aspects (Part 1),5G NR
