keyword,title,publication
mobile_cpu,REACT: A solidarity-based elastic service resource reallocation strategy for Multi-access Edge Computing,Physical Communication
mobile_cpu,Analyzing mobile offshore bases using accelerated boundary-element methods,Marine Structures
mobile_cpu,Portable Resource Control in Java: Application to Mobile Agent Security,Electronic Notes in Theoretical Computer Science
mobile_cpu,A Multi-objective Time-dependent Route Planner: A Real World Application to Milano City,Transportation Research Procedia
mobile_cpu,A security framework for mHealth apps on Android platform,Computers & Security
mobile_cpu,Chapter 6: Domain 6: Security Architecture and Design,Eleventh Hour CISSP (Second Edition)
mobile_cpu,The LHCb VErtex LOcator,"Nuclear Instruments and Methods in Physics Research Section A: Accelerators, Spectrometers, Detectors and Associated Equipment"
mobile_cpu,Energy efficient streaming for smartphone by video adaptation and backlight control,Computer Networks
mobile_cpu,HW/SW co-design for public-key cryptosystems on the 8051 micro-controller,Computers & Electrical Engineering
mobile_cpu,Cloud-based Activity-aaService cyber–physical framework for human activity monitoring in mobility,Future Generation Computer Systems
mobile_cpu,A scalable VideoGIS system for GPS-guided vehicles,Signal Processing: Image Communication
mobile_cpu,A robust dynamic programming algorithm to extract skyline in images for navigation,Pattern Recognition Letters
mobile_cpu,Development of a new automatic gamma control system for mobile LCD applications,Displays
mobile_cpu,Anomaly detection for smartphone data streams,Pervasive and Mobile Computing
mobile_cpu,Stereo vision during adverse weather — Using priors to increase robustness in real-time stereo vision,Image and Vision Computing
mobile_cpu,Low-latency handoff inter-WLAN IP mobility with broadband network control,Computer Communications
mobile_cpu,"Current reliability issues and future technologies for systems on silicon – processes, circuits, chip architecture, and design",Microelectronics Reliability
mobile_cpu,GPU accelerated initialization of local maximum-entropy meshfree methods for vibrational and acoustic problems,Computer Methods in Applied Mechanics and Engineering
mobile_cpu,A New Design Methodology for Composing Complex Digital Systems,Journal of Applied Research and Technology
mobile_cpu,SEAD: secure efficient distance vector routing for mobile wireless ad hoc networks,Ad Hoc Networks
mobile_cpu,Parallel random matrix particle swarm optimization scheduling algorithms with budget constraints on cloud computing systems,Applied Soft Computing
mobile_cpu,GPU based real-time SLAM of six-legged robot,Microprocessors and Microsystems
mobile_cpu,An ad hoc multicast protocol based on passive data acknowledgement,Computer Communications
mobile_cpu,Performance optimization of cell-free massive MIMO system with power control approach,AEU - International Journal of Electronics and Communications
mobile_cpu,Respiratory monitoring system using Bluetooth Low Energy,Sensors and Actuators A: Physical
mobile_cpu,A massively parallel architecture for distributed genetic algorithms,Parallel Computing
mobile_cpu,Real Time Implementation of an Embedded Microcontroller System Working in Time-Constrained Environment,IFAC Proceedings Volumes
mobile_cpu,Low-power content addressable memory (CAM) array for mobile devices,Microelectronics Journal
mobile_cpu,Fansmitter: Acoustic data exfiltration from air-Gapped computers via fans noise,Computers & Security
mobile_cpu,Lightweight convolutional neural network for vehicle recognition in thermal infrared images,Infrared Physics & Technology
mobile_cpu,Comparing vertical and horizontal SIMD vector processor architectures for accelerated image feature extraction,Journal of Systems Architecture
mobile_cpu,An innovative hybrid hydrometallurgical approach for precious metals recovery from secondary resources,Journal of Environmental Management
mobile_cpu,Statistical data mining of streaming motion data for activity and fall recognition in assistive environments,Neurocomputing
mobile_cpu,Modified Poisson solver for the simulation of the silicon–oxide interface in semiconductor detectors,"Nuclear Instruments and Methods in Physics Research Section A: Accelerators, Spectrometers, Detectors and Associated Equipment"
mobile_cpu,Certain investigations in achieving low power dissipation for SRAM cell,Microprocessors and Microsystems
mobile_cpu,Automatic region-growing system for the segmentation of large point clouds,Automation in Construction
mobile_cpu,A survey on routing protocols supported by the Contiki Internet of things operating system,Future Generation Computer Systems
mobile_cpu,Effect of a chronic GSM 900MHz exposure on glia in the rat brain,Biomedicine & Pharmacotherapy
mobile_cpu,Energy-efficient task scheduling for multi-core platforms with per-core DVFS,Journal of Parallel and Distributed Computing
mobile_cpu,Determination of diflubenzuron and its main metabolites in forestry matrices by liquid chromatography with on-line diode-array and electrochemical detection,Analytica Chimica Acta
mobile_cpu,Do users care about ad’s performance costs? Exploring the effects of the performance costs of in-app ads on user experience,Information and Software Technology
mobile_cpu,Experimental study on the thermal performance of micro-heat pipe with cross-section of polygon,Microelectronics Reliability
mobile_cpu,Solving hyperbolic conservation laws with active counteraction against numerical errors: Isothermal fixed-bed adsorption,Chemical Engineering Science
mobile_cpu,"π-Hub: Large-scale video learning, storage, and retrieval on heterogeneous hardware platforms",Future Generation Computer Systems
mobile_cpu,Accessible web-based collaborative tools and wireless personal PACS: feasibility of group work for radiologists,International Congress Series
mobile_cpu,Automatic coarse-to-fine joint detection and segmentation of underwater non-structural live crabs for precise feeding,Computers and Electronics in Agriculture
mobile_cpu,Internet of Things as a Service (iTaaS): Challenges and solutions for management of sensor data on the cloud and the fog,Internet of Things
mobile_cpu,SPM-SLAM: Simultaneous localization and mapping with squared planar markers,Pattern Recognition
mobile_cpu,"The Industrial Internet of Things as an enabler for a Circular Economy Hy-LP: A novel IIoT protocol, evaluated on a wind park’s SDN/NFV-enabled 5G industrial network",Computer Communications
mobile_cpu,Chapter 6: Gaming Consoles,The Digital Consumer Technology Handbook
mobile_cpu,Chapter 4: Energy Optimized Software,Power Management in Mobile Devices
mobile_cpu,Weekly scheduling models for traveling therapists,Socio-Economic Planning Sciences
mobile_cpu,Nature Inspired Power Optimization in smartphones,Swarm and Evolutionary Computation
mobile_cpu,New threats this year,Computer Fraud & Security
mobile_cpu,EClass: An execution classification approach to improving the energy-efficiency of software via machine learning,Journal of Systems and Software
mobile_cpu,Using explicit platform descriptions to support programming of heterogeneous many-core systems,Parallel Computing
mobile_cpu,"The D-Day, V-Day, and bleak days of a disruptive technology: A new model for ex-ante evaluation of the timing of technology disruption",European Journal of Operational Research
mobile_cpu,Chapter 7: Compute Unified Device Architecture,Parallel Programming
mobile_cpu,Optimal electronic waste combination for maximal recovery of Cu-Ni-Fe by Acidithiobacillus ferrooxidans,Journal of Cleaner Production
mobile_cpu,IEEE 802.11 DoS attack detection and mitigation utilizing Cross Layer Design,Ad Hoc Networks
mobile_cpu,On the boundary immobilization and variable space grid methods for transient heat conduction problems with phase change: Discussion and refinement,Comptes Rendus Mécanique
mobile_cpu,Simulation of polycrystal deformation with grain and grain boundary effects,International Journal of Plasticity
mobile_cpu,Fast adaptive motion estimation algorithm and its efficient VLSI system for high definition videos,Expert Systems with Applications
mobile_cpu,3: Cardbus: The 32-Bit Bus,Inside PC Card
mobile_cpu,CUDA programs for solving the time-dependent dipolar Gross–Pitaevskii equation in an anisotropic trap,Computer Physics Communications
mobile_cpu,Chapter 3: Backscatter technology and intelligent reflecting technology surface technology in the Internet of Things,Intelligent Sensing and Communications for Internet of Everything
mobile_cpu,Abstracts of Invited Talks,Electronic Notes in Theoretical Computer Science
mobile_cpu,Modeling uncertainty of induced technological change,Energy Policy
mobile_cpu,Abstracts of Recent Articles and Literature,Computers & Security
