keyword,title,publication
phone_latency,"The association between sex-specific typologies of mobile phone addiction, alexithymia and negative emotions among college students: A latent profile analysis",Children and Youth Services Review
phone_latency,Assessing the impact of summer heat on the movement of people in Tokyo based on mobile phone location data,Building and Environment
phone_latency,Parents’ desire to change phone use: Associations with objective smartphone use and feelings about problematic use and distraction,Computers in Human Behavior
phone_latency,"Perils, power and promises: Latent profile analysis on the attitudes towards artificial intelligence (AI) among middle-aged and older adults in Hong Kong",Computers in Human Behavior: Artificial Humans
phone_latency,SAFERIDES: Application of decentralized control edge-computing to ridesharing monitoring services,International Journal of Information Management Data Insights
phone_latency,Evaluation of the impact of a digital care navigator on increasing patient registration with digital mental health interventions in routine care,Internet Interventions
phone_latency,Edge computing-based Generative Adversarial Network for photo design style transfer using conditional entropy distance,Computer Communications
phone_latency,Real-time visualization of latent fingermarks with level 3 details based on a solid state emissive organic fluorophore using the powder dusting method,Materials Advances
phone_latency,"Can consumer big data reveal often-overlooked urban poverty? Evidence from Guangzhou, China","Computers, Environment and Urban Systems"
phone_latency,Defining ‘seamlessly connected’: user perceptions of operation latency in cross-device interaction,International Journal of Human-Computer Studies
phone_latency,Latency and geofence testing of wireless emergency alerts intended for the ShakeAlert® earthquake early warning system for the West Coast of the United States of America,Safety Science
phone_latency,Optimizing performance for cooling electronic components using innovative heterogeneous materials,Applied Energy
phone_latency,Unsupervised anomaly detection by densely contrastive learning for time series data,Neural Networks
phone_latency,Cell phone-related driver distraction: Habits predict behavior over and above the theory of planned behavior variables,Accident Analysis & Prevention
phone_latency,"Underreported trips, a non-negligible empirical effect of traditional survey methods – A new weighting procedure of data enriching to overcome this bias",Transportation Research Procedia
phone_latency,The influence of parental autonomy support on cyberbullying victimization of high school students: A latent moderation analysis,Acta Psychologica
phone_latency,Efficient fruit disease diagnosis on resource-constrained agriculture devices,Journal of the Saudi Society of Agricultural Sciences
phone_latency,Investigating the impact of environmental and temporal features on mobile phone distracted driving behavior using phone use data,Accident Analysis & Prevention
phone_latency,Optimizing point-of-sale services in MEC enabled near field wireless communications using multi-agent reinforcement learning,Computer Communications
phone_latency,Phonation-induced Upper Esophageal Sphincter Contraction Caused by Different Phonation Types,Journal of Voice
phone_latency,A data fusion approach with mobile phone data for updating travel survey-based mode split estimates,Transportation Research Part C: Emerging Technologies
phone_latency,Full wireless goniometer design with activity recognition for upper and lower limb,Microprocessors and Microsystems
phone_latency,Reduced subjective sleep quality in people rating themselves as electro-hypersensitive: An observational study,Sleep Medicine
phone_latency,An expert system for hybrid edge to cloud computational offloading in heterogeneous MEC–MCC environments,Journal of Network and Computer Applications
phone_latency,D-wash – A dynamic workload aware adaptive cache coherance protocol for multi-core processor system,Microelectronics Journal
phone_latency,Texting and crossing: An extended theory of planned behaviour to model the psychological and demographic factors related to pedestrians' use of cell phone for texting at crosswalks in developing country,IATSS Research
phone_latency,Economic value and latent demand for agricultural drought forecast: Emerging market for weather and climate information in Central-Southern Nigeria,Climate Risk Management
phone_latency,Deadline-aware multi-objective IoT services placement optimization in fog environment using parallel FFD-genetic algorithm,Pervasive and Mobile Computing
phone_latency,My Latent Tuberculosis Treatment - mobile application to assist in adherence to latent tuberculosis treatment,Procedia Computer Science
phone_latency,Association between trajectories of problematic mobile phone use and chronotype among Chinese college students,Addictive Behaviors
phone_latency,Learning and controlling the source-filter representation of speech with a variational autoencoder,Speech Communication
phone_latency,Awareness of user mobility in Named Data Networking for IoT traffic under the push communication mode,Journal of Network and Computer Applications
phone_latency,"Comparison of Patient Health Questionnaire-9, Edinburgh Postnatal Depression Scale and Hospital Anxiety and Depression – Depression subscale scores by administration mode: An individual participant data differential item functioning meta-analysis",Journal of Affective Disorders
phone_latency,Patient preferences and willingness-to-pay for community pharmacy-led Medicare Part D consultation services: A discrete choice experiment,Research in Social and Administrative Pharmacy
phone_latency,The prevalence of bad posture and musculoskeletal symptoms originating from the use of gadgets as an impact of the work from home program of the university community,Heliyon
phone_latency,Smart Phone/Ecological Momentary Assessment of Sleep and Daytime Symptoms Among Older Adults With Insomnia,The American Journal of Geriatric Psychiatry
phone_latency,Deep Transfer Learning Models for Mobile-Based Ocular Disorder Identification on Retinal Images,"Computers, Materials and Continua"
phone_latency,Digital media use and sleep in late adolescence and young adulthood: A systematic review,Sleep Medicine Reviews
phone_latency,"Mobile phone use addiction, insomnia, and depressive symptoms in adolescents from ethnic minority areas in China: A latent variable mediation model",Journal of Affective Disorders
phone_latency,SPOTTER: A novel asynchronous and independent WiFi and BLE fusion method based on particle filter for indoor positioning,Internet of Things
phone_latency,A study on 5G performance and fast conditional handover for public transit systems,Computer Communications
phone_latency,Symptom Reduction and Engagement in a Cognitive-Behavioral Mobile Phone App: A Study of User Profiling to Determine Prognostic Indicators,Behavior Therapy
phone_latency,A GPU-accelerated real-time human voice separation framework for mobile phones,Journal of Systems Architecture
phone_latency,Two protocols for improving security during the authentication and key agreement procedure in the 3GPP networks,Computer Communications
phone_latency,Incorporating active and non-active mode preferences for Departure time choice behavior,Transportation Letters
phone_latency,"Metal-free and ecofriendly photoluminescent nanoparticles for visualization of latent fingerprints, anticounterfeiting, and information encryption",Sensors and Actuators B: Chemical
phone_latency,The value of consideration data in a discrete choice experiment,Journal of Choice Modelling
phone_latency,Does iPhone night shift mitigate negative effects of smartphone use on sleep outcomes in emerging adults?,Sleep Health
phone_latency,RareAnom: A Benchmark Video Dataset for Rare Type Anomalies,Pattern Recognition
phone_latency,Privacy-preserving contact tracing in 5G-integrated and blockchain-based medical applications,Computer Standards & Interfaces
phone_latency,Investigating the effects of online communication apprehension and digital technology anxiety on organizational dissent in virtual teams,Computers in Human Behavior
phone_latency,Designing and evaluating a smartphone app to increase underserved communities’ data representation in transportation policy and planning,Transportation Research Interdisciplinary Perspectives
phone_latency,Children's Daily Negative Affect Patterns and Food Consumption on Weekends: An Ecological Momentary Assessment Study,Journal of Nutrition Education and Behavior
phone_latency,Digital health use in latent tuberculosis infection care: A systematic review,International Journal of Medical Informatics
phone_latency,"Distributed application execution in fog computing: A taxonomy, challenges and future directions",Journal of King Saud University - Computer and Information Sciences
phone_latency,Assessment of auditory conduction in mobile phone users: A pilot study,Indian Journal of Medical Specialities
phone_latency,Mobile phone-based evaluation of latent tuberculosis infection: Proof of concept for an integrated image capture and analysis system,Computers in Biology and Medicine
phone_latency,A method of forensic authentication of audio recordings generated using the Voice Memos application in the iPhone,Forensic Science International
phone_latency,Modeling sentimental bias and temporal dynamics for adaptive deep recommendation system,Expert Systems with Applications
phone_latency,"Mobile phone and cordless phone use and the risk for glioma – Analysis of pooled case-control studies in Sweden, 1997–2003 and 2007–2009",Pathophysiology
phone_latency,Identification of source mobile hand sets using audio latency feature,Forensic Science International
phone_latency,Learning emotions latent representation with CVAE for text-driven expressive audiovisual speech synthesis,Neural Networks
phone_latency,"On the association between glioma, wireless phones, heredity and ionising radiation",Pathophysiology
phone_latency,Modelling trip generation using mobile phone data: A latent demographics approach,Journal of Transport Geography
phone_latency,A latent class analysis of psychological symptoms and health risk behaviors among Chinese adolescents,Asian Journal of Psychiatry
phone_latency,"Land Use detection with cell phone data using topic models: Case Santiago, Chile","Computers, Environment and Urban Systems"
phone_latency,Inferring the 1985–2014 impact of mobile phone use on selected brain cancer subtypes using Bayesian structural time series and synthetic controls,Environment International
phone_latency,Mobile phone use while driving: A hybrid modeling approach,Accident Analysis & Prevention
phone_latency,Health and information disparities among non-adopters of smartphones,Health Policy and Technology
phone_latency,Enabling off-the-grid telephony: An adaptive probabilistic model for broadcasting in ad-hoc mobile phone networks,Simulation Modelling Practice and Theory
phone_latency,Fine-grained LTE radio link estimation for mobile phones,Pervasive and Mobile Computing
phone_latency,An attitude-based latent class segmentation analysis of mobile phone users,Telematics and Informatics
phone_latency,Scalable fabrication of high-enthalpy polyethylene/carbon nanotubes/paraffin wax nanocomposite with flexibility and superhydrophobicity for efficient thermal management,Composites Part A: Applied Science and Manufacturing
phone_latency,Latent space models for dynamic networks with weighted edges,Social Networks
phone_latency,Acoustic and lexical resource constrained ASR using language-independent acoustic model and language-dependent probabilistic lexical model,Speech Communication
phone_latency,9430 The Impact of Anxiety and Depression on Regret after Hysterectomy,Journal of Minimally Invasive Gynecology
phone_latency,Addicted to cellphones: exploring the psychometric properties between the nomophobia questionnaire and obsessiveness in college students,Heliyon
phone_latency,Dysphonia Severity Degree and Phonation Onset Latency in Laryngeal Adductor Dystonia,Journal of Voice
phone_latency,Modelling interactions among offenders: A latent space approach for interdependent ego-networks,Social Networks
phone_latency,Structural model proposal to explain online game addiction,Entertainment Computing
phone_latency,Processed data on the night-time use of screen-based media devices and adolescents' sleep quality and health-related quality of life,Data in Brief
phone_latency,Use of mobile phones and cordless phones is associated with increased risk for glioma and acoustic neuroma,Pathophysiology
phone_latency,Chapter Seventeen: 5G—Communication in HealthCare applications,Advances in Computers
phone_latency,HashXor: A lightweight scheme for identity privacy of IoT devices in 5G mobile network,Computer Networks
phone_latency,The barriers and enablers to downloading the COVIDSafe app – a topic modelling analysis,Australian and New Zealand Journal of Public Health
phone_latency,Laryngeal electromyography in dysphonic patients with incomplete glottic closure,Brazilian Journal of Otorhinolaryngology
phone_latency,Long-term effect of mobile phone use on sleep quality: Results from the cohort study of mobile phone use and health (COSMOS),Environment International
phone_latency,Examining driver behavior at the onset of yellow in a traffic simulator environment: Comparisons between random parameters and latent class logit models,Accident Analysis & Prevention
phone_latency,"Protective and risk factors associated with adolescent sleep: findings from Australia, Canada, and The Netherlands",Sleep Medicine
phone_latency,The impact of psychological distress on weight regain in post-bariatric patients during the COVID-19 pandemic: A latent profile analysis,Journal of Psychosomatic Research
phone_latency,Exploring groups of opinion spam using sentiment analysis guided by nominated topics,Expert Systems with Applications
phone_latency,"Measuring a conceptual model of the relationship between compulsive cell phone use, in-vehicle cell phone use, and motor vehicle crash",Accident Analysis & Prevention
phone_latency,Lack of interaction between concurrent caffeine and mobile phone exposure on visual target detection: An ERP study,Pharmacology Biochemistry and Behavior
phone_latency,Monitoring Parkinson's disease progression based on recorded speech with missing ordinal responses and replicated covariates,Computers in Biology and Medicine
phone_latency,Investigating the drinking patterns of young people over the course of the evening at weekends,Drug and Alcohol Dependence
phone_latency,An effective approach of latency-aware fog smart gateways deployment for IoT services,Internet of Things
phone_latency,Case-control study on the use of mobile and cordless phones and the risk for malignant melanoma in the head and neck region,Pathophysiology
phone_latency,cVEMPs and oVEMPs normative data in Malaysian preschool and primary school-aged children,International Journal of Pediatric Otorhinolaryngology
phone_latency,A simple low cost latent fingerprint sensor based on deflectometry and WFT analysis,Optics & Laser Technology
phone_latency,Bedtime mobile phone use and sleep in adults,Social Science & Medicine
phone_latency,"The association between problematic smartphone use, depression and anxiety symptom severity, and objectively measured smartphone use over one week",Computers in Human Behavior
phone_latency,Which factors lead to driving errors? A structural equation model analysis through a driving simulator experiment,IATSS Research
phone_latency,Artesunate-luminol chemiluminescence system for the detection of hemin,Talanta
phone_latency,The culture of distracted driving: Evidence from a public opinion survey in Iowa,Transportation Research Part F: Traffic Psychology and Behaviour
phone_latency,Control of Fundamental Frequency in Dysphonic Patients During Phonation and Speech,Journal of Voice
phone_latency,Connecting the dots: understanding how human mobility shapes TB epidemics,Trends in Microbiology
phone_latency,Highly-efficient cold energy storage enabled by brine phase change material gels towards smart cold chain logistics,Journal of Energy Storage
phone_latency,Epidemiological evidence for an association between use of wireless phones and tumor diseases,Pathophysiology
phone_latency,Night-time screen-based media device use and adolescents' sleep and health-related quality of life,Environment International
phone_latency,Mobile-phone pulse triggers evoked potentials,Neuroscience Letters
phone_latency,Effects of twenty-minute 3G mobile phone irradiation on event related potential components and early gamma synchronization in auditory oddball paradigm,Neuroscience
phone_latency,Maternal mobile phone exposure adversely affects the electrophysiological properties of Purkinje neurons in rat offspring,Neuroscience
phone_latency,Effects of thirty-minute mobile phone exposure on saccades,Clinical Neurophysiology
phone_latency,Effectiveness of a strategic hazard anticipation training intervention in high risk scenarios,Transportation Research Part F: Traffic Psychology and Behaviour
phone_latency,An Aerodynamic Study of Phonations in Patients With Parkinson Disease (PD),Journal of Voice
phone_latency,Mobile phone use and pre-trial perceptions of the WelTel mobile health intervention among English-as-a-second-language participants with latent tuberculosis infection,Annals of Global Health
phone_latency,Paste-like recyclable Ga liquid metal phase change composites loaded with miscible Ga2O3 particles for transient cooling of portable electronics,Applied Thermal Engineering
phone_latency,Smartphone connectivity stress across generations: Validation of a brief scale for adolescents and adults,Computers in Human Behavior Reports
phone_latency,Visualization of Superficial Similarities between Data Jackets for Aiding Creativity on Innovators Marketsplace on Data Jackets,Procedia Computer Science
phone_latency,Towards latent context-aware recommendation systems,Knowledge-Based Systems
phone_latency,"Trends in incidence of primary brain cancer in New Zealand, 1995 to 2010",Australian and New Zealand Journal of Public Health
phone_latency,Spatial Memory Perfomance of Wistar Rats Exposed to Mobile Phone,Clinics
phone_latency,Why children absorb more microwave radiation than adults: The consequences,Journal of Microscopy and Ultrastructure
phone_latency,Privacy-aware message exchanges for HumaNets,Computer Communications
phone_latency,Applications IO profiling and analysis for smart devices,Journal of Systems Architecture
phone_latency,Use of wireless telephones and serum S100B levels: A descriptive cross-sectional study among healthy Swedish adults aged 18–65 years,Science of The Total Environment
phone_latency,Structural equation model analysis for the evaluation of overall driving performance: A driving simulator study focusing on driver distraction,Traffic Injury Prevention
phone_latency,Experimental and numerical study on phase change material (PCM) for thermal management of mobile devices,Applied Thermal Engineering
phone_latency,Consumer driven product technology function deployment using social media and patent mining,Advanced Engineering Informatics
phone_latency,The effect of electromagnetic field emitted by a mobile phone on the inhibitory control of saccades,Clinical Neurophysiology
phone_latency,Protective and risk factors for adolescent sleep: A meta-analytic review,Sleep Medicine Reviews
phone_latency,Predictive analytics as a service for vehicle health monitoring using edge computing and AK-NN algorithm,Materials Today: Proceedings
phone_latency,Mobile phone ‘talk-mode’ signal delays EEG-determined sleep onset,Neuroscience Letters
phone_latency,A dynamic multi-sink routing protocol for static and mobile self-organizing wireless networks: A routing protocol for Internet of Things,Ad Hoc Networks
phone_latency,Overall performance impairment and crash risk due to distracted driving: A comprehensive analysis using structural equation modelling,Transportation Research Part F: Traffic Psychology and Behaviour
phone_latency,Mobile phones for financial inclusion: What explains the diffusion of mobile money innovations?,Research Policy
phone_latency,Patient Preferences in Surveillance: Findings From a Discrete Choice Experiment in the “My Follow-Up” Study,Value in Health
phone_latency,"A Pilot Randomized Controlled Trial of the Insomnia Coach Mobile App to Assess Its Feasibility, Acceptability, and Potential Efficacy",Behavior Therapy
phone_latency,Self-reported sleep quality and dysfunctional sleep-related beliefs in young and older adults: changes in times of COVID-19 lockdown,Sleep Medicine
phone_latency,Cell phone use and acoustic neuroma: the need for standardized questionnaires and access to industry data,Surgical Neurology
phone_latency,Cell phones and brain tumors: a review including the long-term epidemiologic data,Surgical Neurology
phone_latency,Visual Servo for Fast Glass Handling by Industrial Robot with Large Sensor Latency and Low Sampling Rate,IFAC-PapersOnLine
phone_latency,"A network analysis approach to the relationship between fear of missing out (FoMO), smartphone addiction, and social networking site use among a sample of Chinese university students",Computers in Human Behavior
phone_latency,Examining the effects of electromagnetic fields emitted by GSM mobile phones on human event-related potentials and performance during an auditory task,Clinical Neurophysiology
phone_latency,Thirty minutes mobile phone use has no short-term adverse effects on central auditory pathways,Clinical Neurophysiology
phone_latency,Public health implications of wireless technologies,Pathophysiology
phone_latency,Can peer-tutored psychological flexibility training facilitate physical activity among adults with overweight?,Journal of Contextual Behavioral Science
phone_latency,Acoustic neuroma risk in relation to mobile telephone use: Results of the INTERPHONE international case–control study,Cancer Epidemiology
phone_latency,Adolescents' technology and face-to-face time use predict objective sleep outcomes,Sleep Health
phone_latency,Case–control study of the association between the use of cellular and cordless telephones and malignant brain tumors diagnosed during 2000–2003,Environmental Research
phone_latency,Essential problems in the interpretation of epidemiologic evidence for an association between mobile phone use and brain tumours,Comptes Rendus Physique
phone_latency,Processing of self-initiated sound motion in the human brain,Brain Research
phone_latency,The price sensitivity of mobile use among low income households in six countries of Asia,Telecommunications Policy
phone_latency,Selecting representative affective dimensions using Procrustes analysis: An application to mobile phone design,Applied Ergonomics
phone_latency,"Clinical, electrophysiological, and ultrasound evaluation for early detection of musculoskeletal hand disorders and nerve entrapment in mobile phone users",Revista Colombiana de Reumatología (English Edition)
phone_latency,"An analysis of architecture, framework, security and challenging aspects for data aggregation and routing techniques in IoT WSNs",Theoretical Computer Science
phone_latency,Does acute radio-frequency electromagnetic field exposure affect visual event-related potentials in healthy adults?,Clinical Neurophysiology
phone_latency,Whole body exposure with GSM 900MHz affects spatial memory in mice,Pathophysiology
phone_latency,Anatomic and electro-physiologic connectivity of the language system: A combined DTI-CCEP study,Computers in Biology and Medicine
phone_latency,Comparison of text messaging and paper-and-pencil for ecological momentary assessment of food craving and intake,Appetite
phone_latency,What drives technology-based distractions? A structural equation model on social-psychological factors of technology-based driver distraction engagement,Accident Analysis & Prevention
phone_latency,Trajectories of traumatic stress symptoms during conflict: A latent class growth analysis,Journal of Affective Disorders
phone_latency,Combining multiple correspondence analysis with association rule mining to conduct user-driven product design of wearable devices,Computer Standards & Interfaces
phone_latency,The association of sleep and late‐night cell phone use among adolescents,Jornal de Pediatria (Versão em Português)
phone_latency,An Effective Method for Habitual Behavior Extraction from the Internet,Procedia Computer Science
phone_latency,Modeling and inferring mobile phone users’ negative emotion spreading in social networks,Future Generation Computer Systems
phone_latency,Frequency of Text Messaging and Adolescents' Mental Health Symptoms Across 4 Years of High School,Journal of Adolescent Health
phone_latency,Prevalence and characteristics of addictive behaviors in a community sample: A latent class analysis,Addictive Behaviors Reports
phone_latency,Designing delay constrained hybrid ad hoc network infrastructure for post-disaster communication,Ad Hoc Networks
phone_latency,Family patterns of psychopathology in psychiatric disorders,Comprehensive Psychiatry
phone_latency,Asociación entre las radiaciones de teléfonos móviles y el riesgo tumoral en personas adultas,Gaceta Sanitaria
phone_latency,Principal component analysis of the P600 waveform: RF and gender effects,Neuroscience Letters
phone_latency,"Clinical, electrophysiological, and ultrasound evaluation for early detection of musculoskeletal hand disorders and nerve entrapment in mobile phone users",Revista Colombiana de Reumatología
phone_latency,Chapter 2: HSA Overview,Heterogeneous System Architecture
