keyword,title,publication
phone_resource,Survey of women with pelvic floor disorders: Could a smartphone application be helpful for patient care?,Journal of Obstetrics and Gynaecology Canada
phone_resource,Tablet computers in support of rural and frontier clinical practice,International Journal of Medical Informatics
phone_resource,Creating Opportunities for Personal Empowerment: Symptom and Technology Management Resources (COPE-STAR) Intervention for Caregivers of Children with Medical Technology,Journal of Pediatric Health Care
phone_resource,Outcome of patients with psychogenic nonepileptic seizures with limited resources: A longitudinal study,Seizure
phone_resource,“How do I help this kid adjust to what real life is for them?”: Youth service providers experiences on supporting children with incarcerated parents,Children and Youth Services Review
phone_resource,Realization of Call-Back Authentication (CBA) for secure web to cellular phone SMS communication,Computers & Mathematics with Applications
phone_resource,System-integrated technology-enabled model of care to improve the health of stroke patients in rural China: protocol for SINEMA—a cluster-randomized controlled trial,American Heart Journal
phone_resource,A dynamic model for managing overlapped iterative product development,European Journal of Operational Research
phone_resource,Synthesizing enterprise data to strategically align performance: The intentionality of strategy surrogation,International Journal of Accounting Information Systems
phone_resource,Urban mining potentials of university: In-use and hibernating stocks of personal electronics and students’ disposal behaviors,"Resources, Conservation and Recycling"
phone_resource,Large-scale characterization of non-native Mandarin Chinese spoken by speakers of European origin: Analysis on iCALL,Speech Communication
phone_resource,Self-sustainable robot from e-scrap using renewable energy (Scrapino),IFAC-PapersOnLine
phone_resource,Complaints in environmental health and the construction of risk as cultural resource,Comptes Rendus Physique
phone_resource,Kinematic analysis of an auto-winding system with the pawl-lever mechanism and its application in energy harvesting,International Journal of Mechanical Sciences
phone_resource,Integrative Medicine in Preventive Medicine Education: Implementation Analysis,American Journal of Preventive Medicine
phone_resource,A preliminary categorization of end-of-life electrical and electronic equipment as secondary metal resources,Waste Management
phone_resource,GET Access: Geriatric Education on Telehealth. Increasing Video Access for Geriatric Psychiatry Patients at the Onset of the COVID Pandemic and Beyond,The American Journal of Geriatric Psychiatry
phone_resource,Improving Patient Care and Reducing Readmissions Using a Standardized Transition of Care Plan,Heart & Lung
phone_resource,Composition analysis of the cathode active material of spent Li-ion batteries leached in citric acid solution: A study to monitor and assist recycling processes,Science of The Total Environment
phone_resource,Optimizing version release dates of research and development long-term processes,European Journal of Operational Research
phone_resource,Vehicular networks and the future of the mobile internet,Computer Networks
phone_resource,"The online version of an evidence-based hand exercise program for people with rheumatoid arthritis: A mixed-method, proof-of-concept study",Journal of Hand Therapy
phone_resource,A fog computing model for implementing motion guide to visually impaired,Simulation Modelling Practice and Theory
phone_resource,Multimedia Information Resource «The Church of the Savior on Ilyina Street in Novgorod the Great»,Procedia Computer Science
phone_resource,Comparing long-term outcomes of epilepsy patients from a single-visit outreach clinic with a conventional epilepsy clinic: A cross-sectional observational study from India,Seizure
phone_resource,Chapter 4: Molecular investigation of plant-environment interaction at functional level,Plant Perspectives to Global Climate Changes
phone_resource,"Smart cup: A minimally-instrumented, smartphone-based point-of-care molecular diagnostic device",Sensors and Actuators B: Chemical
phone_resource,Combined effects of alcohol and distraction on driving performance,Accident Analysis & Prevention
phone_resource,Human–computer negotiation in a three player market setting,Artificial Intelligence
phone_resource,Chapter 2: End-to-End Acoustic Modeling Using Convolutional Neural Networks,Intelligent Speech Signal Processing
phone_resource,Surviving psychiatry on-calls,European Psychiatry
phone_resource,Patient Hand-Off iNitiation and Evaluation (PHONE) study: A randomized trial of patient handoff methods,The American Journal of Surgery
phone_resource,Energy and eMergy assessment of the production and operation of a personal computer,"Resources, Conservation and Recycling"
phone_resource,Traumatic Brain Injury: Epidemiology and Rehabilitation in Ireland,Archives of Physical Medicine and Rehabilitation
phone_resource,Cleaner production status in the Middle East and North Africa region with special focus on Egypt,Journal of Cleaner Production
phone_resource,Underage College Students' Alcohol Displays on Facebook and Real-Time Alcohol Behaviors,Journal of Adolescent Health
phone_resource,Automatic feature selection for context recognition in mobile devices,Pervasive and Mobile Computing
phone_resource,Resource Consumption and Costs of Palliative Care Services in Spain: A Multicenter Prospective Study,Journal of Pain and Symptom Management
phone_resource,A high-frequency mobile phone data collection approach for research in social-environmental systems: Applications in climate variability and food security in sub-Saharan Africa,Environmental Modelling & Software
phone_resource,Accuracy of Fully Automated 3D Imaging System for Child Anthropometry in a Low-Resource Setting: An Effectiveness Evaluation in South Sudan,Current Developments in Nutrition
phone_resource,Identity-based encryption with outsourced equality test in cloud computing,Information Sciences
phone_resource,"In the name of Development: Power, profit and the datafication of the global South",Geoforum
phone_resource,Porous silicon microcavities redefine colorimetric ELISA sensitivity for ultrasensitive detection of autoimmune antibodies,Sensors and Actuators B: Chemical
phone_resource,Mobile health application for remote oral cancer surveillance,The Journal of the American Dental Association
phone_resource,2. WELLNESS FUEL TANK,Academic Pediatrics
phone_resource,ICBT program for improving informal caregiver well-being: A qualitative study,Internet Interventions
phone_resource,Motivational Interviewing and Self-Management Support in Early Stroke Rehabilitation: A Feasibility Randomized Controlled Study,Archives of Physical Medicine and Rehabilitation
phone_resource,"Demographic characteristics, call details and psychosocial support needs of the family/friends of someone diagnosed with cancer who access Australian Cancer Council telephone information and support services",European Journal of Oncology Nursing
phone_resource,Virtualization-based Cognitive Radio Networks,Journal of Systems and Software
phone_resource,Expectations versus reality: The impact of men’s expectancy violations in conversations with healthcare providers about BRCA-related cancer risks,Patient Education and Counseling
phone_resource,New approach to the polyglot speech generation by means of an HMM-based speaker adaptable synthesizer,Speech Communication
phone_resource,"Effects of an educational intervention on heart failure knowledge, self-care behaviors, and health-related quality of life of patients with heart failure: Exploring the role of depression",Patient Education and Counseling
phone_resource,P88 SNAP4CT.org: An Online Nutrition Education Platform for CT SNAP Recipients,Journal of Nutrition Education and Behavior
phone_resource,Lessons learned from the development and implementation of a citywide stair prompt initiative,Preventive Medicine Reports
phone_resource,Bridging E-Gaps at PNU by using Alternative Energy,Procedia - Social and Behavioral Sciences
phone_resource,A daily SMS reminder increases adherence to asthma treatment: A three-month follow-up study,Respiratory Medicine
phone_resource,AlexVG: An OpenVG implementation with SVG-Tiny support,Computer Standards & Interfaces
phone_resource,The E-Coach transition support computer telephony implementation study: Protocol of a randomized trial,Contemporary Clinical Trials
phone_resource,An Educational Intervention on Drug Use in Nursing Homes Improves Health Outcomes Resource Utilization and Reduces Inappropriate Drug Prescription,Journal of the American Medical Directors Association
phone_resource,Improving recognition of proper nouns in ASR through generating and filtering phonetic transcriptions,Computer Speech & Language
phone_resource,Improving breast cancer care coordination and symptom management by using AI driven predictive toolkits,The Breast
phone_resource,An analytical model for delivery evaluation of multimodal contents in pervasive computing,Computers in Industry
phone_resource,Cubital Tunnel Decompression: Equivalent Outcome Scores when Procedure Performed with Local versus General Anesthetic,Journal of Hand and Microsurgery
phone_resource,Flexible Bytecode for Linking in .NET,Electronic Notes in Theoretical Computer Science
phone_resource,Natural history of patients with psychogenic nonepileptic seizures,Seizure
phone_resource,"Impact of COVID-19 on the Patient Enrollment for a Pragmatic, Cluster Randomized Clinical Trial for Fibromyalgia",The Journal of Pain
phone_resource,Five Secrets to Leveraging Maximum Buying Power with Your Media Project,Facial Plastic Surgery Clinics of North America
phone_resource,Postpartum Unit Modifies Delivery of Care to Enhance Readiness,"Journal of Obstetric, Gynecologic & Neonatal Nursing"
phone_resource,HELP: Handheld Emergency Logistics Program for Generating Structured Requests in Stressful Conditions,Procedia Engineering
phone_resource,"Epilepsy field workers, a smartphone application and telephone telemedicine: Safe and effective epilepsy care in rural Nepal",Seizure
phone_resource,Chapter 10: Microbial leaching of heavy metals from e-waste: opportunities and challenges,Biovalorisation of Wastes to Renewable Chemicals and Biofuels
phone_resource,The War on Diabetic Retinopathy: Where Are We Now?,Asia-Pacific Journal of Ophthalmology
phone_resource,Improved pipelined wavelet implementation for filtering ECG signals,Pattern Recognition Letters
phone_resource,"A dynamic decision support system based on geographical information and mobile social networks: A model for tsunami risk mitigation in Padang, Indonesia",Safety Science
phone_resource,Imagery-inducing distraction leads to cognitive tunnelling and deteriorated driving performance,Transportation Research Part F: Traffic Psychology and Behaviour
phone_resource,Use of an enterocolitis triage and treatment protocol in children with Hirschsprung disease reduces hospital admissions,Journal of Pediatric Surgery
phone_resource,Probability of false alarm based interference suppression methods in Internet of Things (IoT) systems,Computer Networks
phone_resource,Financing off-grid sustainable energy access for the poor,Energy Policy
phone_resource,Supervisory control of adaptive and reconfigurable computing systems,IFAC Proceedings Volumes
phone_resource,Effectiveness of a Short Message Reminder in Increasing Compliance with Pediatric Cataract Treatment: A Randomized Trial,Ophthalmology
phone_resource,An efficient mesh-based face beautifier on mobile devices,Neurocomputing
phone_resource,"Human Trafficking Victim Identification, Assessment, and Intervention Strategies in South Texas Emergency Departments",Journal of Emergency Nursing
phone_resource,Immune Defense Single Nucleotide Polymorphisms and Recruitment Strategies Associated with Contact Lens Keratitis,Ophthalmology
phone_resource,An app performance optimization advisor for mobile device app marketplaces,Sustainable Computing: Informatics and Systems
phone_resource,Dypermin: Dynamic permission mining framework for android platform,Computers & Security
phone_resource,Haggle: Opportunistic mobile content sharing using search,Computer Communications
phone_resource,Lightweight private proximity testing for geospatial social networks,Computer Communications
phone_resource,Enriching Perioperative Communication Through Family Texting,Journal of PeriAnesthesia Nursing
phone_resource,"After all, is E-Mental Health capable of making a paradigm shift?",European Psychiatry
phone_resource,103. IMPROVING SCREENING LAB COMPLIANCE IN AN URBAN PEDIATRIC PRACTICE,Academic Pediatrics
phone_resource,Flexible opto-electronics enabled microfluidics systems with cloud connectivity for point-of-care micronutrient analysis,Biosensors and Bioelectronics
phone_resource,Preventing spam in opportunistic networks,Computer Communications
phone_resource,The Inverse Care Law might not apply to preventative health services in community pharmacy,Research in Social and Administrative Pharmacy
phone_resource,Chapter 2: Security Management Systems,Managing Information Security (Second Edition)
phone_resource,Data poverty: A global evaluation for 2009 to 2013 - implications for sustainable development and disaster risk reduction,International Journal of Applied Earth Observation and Geoinformation
phone_resource,Algorithms and heuristics for efficient medical information display in PDA,Computers in Biology and Medicine
phone_resource,Addiction component walk along working towards a new app,European Psychiatry
phone_resource,"Impact of community-delivered SMS alerts on dog-owner participation during a mass rabies vaccination campaign, Haiti 2017",Vaccine
phone_resource,Caracterización acústica y aerodinámica de la voz esofágica,Acta Otorrinolaringológica Española
phone_resource,A novel on-demand vehicular sensing framework for traffic condition monitoring,Vehicular Communications
phone_resource,"Immigration, barriers to healthcare and transnational ties: A case study of South Korean immigrants in Toronto, Canada",Social Science & Medicine
phone_resource,Co-operative ITS: Smartphone based Measurement Systems for Road Safety Assessment,Procedia Computer Science
phone_resource,Motion and appearance based background subtraction for freely moving cameras,Signal Processing: Image Communication
phone_resource,Augmenting psychoeducation with a mobile intervention for bipolar disorder: A randomized controlled trial,Journal of Affective Disorders
phone_resource,Learning recency based comparative choice towards point-of-interest recommendation,Expert Systems with Applications
phone_resource,Chapter 3: Mechanisms of change in dialectical behavior therapy,The Handbook of Dialectical Behavior Therapy
phone_resource,Chapter 21: Utility 2.0: Maryland's Pilot Design,Distributed Generation and its Implications for the Utility Industry
phone_resource,Chapter 10: Mobile Applications and Devices,Securing the Smart Grid
phone_resource,Implementation challenges of conducting a heart failure palliative care intervention pilot trial in the deep south,Heart & Lung
phone_resource,Neurological effects of product price and evaluation on online purchases based on event-related potentials,Neuroscience Letters
phone_resource,Customized computer-aided application mapping on NoC infrastructure using multi-objective optimization,Journal of Systems Architecture
phone_resource,Regional caries data availability in Saudi Arabia: Impact of socioeconomic factors and research potential,The Saudi Dental Journal
phone_resource,Preferences for improved early warning services among coastal communities at risk in cyclone prone south-west region of Bangladesh,Progress in Disaster Science
phone_resource,Cognitive task fulfilment may decrease gaze control performances,Physiology & Behavior
phone_resource,Flexible and Adaptive Services in Pervasive Computing,Advances in Computers
phone_resource,Impact of Free Hospital-Provided Rideshare Service on Radiation Therapy Completion Rates: A Matched Cohort Analysis,International Journal of Radiation Oncology*Biology*Physics
phone_resource,Chapter 12: Outreach to Support Rural Innovation,Agricultural Systems (Second Edition)
phone_resource,Flexible sodium-ion based energy storage devices: Recent progress and challenges,Energy Storage Materials
phone_resource,Qualitative Exploration Of Tele-Exercise Program To Inform Adaptive Intervention Design For Adults With Multiple Sclerosis,Archives of Physical Medicine and Rehabilitation
phone_resource,IGNA's original LIMS: A complete traceability of administrative and analytic processes for forensic cases,Forensic Science International: Genetics Supplement Series
phone_resource,Potential role of tele-rehabilitation to address barriers to implementation of physical therapy among West African stroke survivors: A cross-sectional survey,Journal of the Neurological Sciences
phone_resource,A Novel Recycling Approach for Transforming Waste Printed Circuit Boards into a Material Resource,Procedia Environmental Sciences
phone_resource,Understanding factors influencing the adoption of mHealth by the elderly: An extension of the UTAUT model,International Journal of Medical Informatics
phone_resource,Chapter 22: Security Management Systems,Computer and Information Security Handbook (Second Edition)
phone_resource,Leveraging technology to address the problem of cigarette smoking among women of reproductive age,Preventive Medicine
phone_resource,Cervical cancer control for Hispanic women in Texas: Strategies from research and practice,Gynecologic Oncology
phone_resource,Cancer Care Coordinators to Improve Tamoxifen Persistence in Breast Cancer: How Heterogeneity in Baseline Prognosis Impacts on Cost-Effectiveness,Value in Health
phone_resource,In situ plasmonic generation in functional ionic-gold-nanogel scaffold for rapid quantitative bio-sensing,Biosensors and Bioelectronics
phone_resource,Novel optimized link state routing protocol based on quantum genetic strategy for mobile learning,Journal of Network and Computer Applications
phone_resource,"Rationale, design, and sample characteristics of a practical randomized trial to assess a weight loss intervention for low-income women: The Weight-Wise II Program",Contemporary Clinical Trials
phone_resource,Multidialectal Spanish acoustic modeling for speech recognition,Speech Communication
phone_resource,CN122: Role of the advanced practice nurse (APN) in a functional unit for lung cancer at the Catalan Institute of Oncology,Annals of Oncology
phone_resource,Same-Day Total Joint Discharges: A Collaborative Effort for Patient Safety,Journal of PeriAnesthesia Nursing
phone_resource,Perinatal Experiences of Somali Couples in the United States,"Journal of Obstetric, Gynecologic & Neonatal Nursing"
phone_resource,Chapter 7: Experience and Experimentation: From Survive to Thrive,The Craft and Science of Coffee
phone_resource,Emerging communication technologies in emergency medical services,Prehospital Emergency Care
phone_resource,“Nomads at last”? A set of perspectives on how mobile technology may affect travel,Journal of Transport Geography
phone_resource,"Implementations of the HL7 Context-Aware Knowledge Retrieval (“Infobutton”) Standard: Challenges, strengths, limitations, and uptake",Journal of Biomedical Informatics
phone_resource,CrowdSensing: A crowd-sourcing based indoor navigation using RFID-based delay tolerant network,Journal of Network and Computer Applications
phone_resource,Emotional mapping of the archaeologist game,Computers in Human Behavior
phone_resource,Development of an app for estimating leaf area index using a smartphone. Trueness and precision determination and comparison with other indirect methods,Computers and Electronics in Agriculture
phone_resource,Community Programs and Resources for Persons With Multiple Sclerosis,Physical Medicine and Rehabilitation Clinics of North America
phone_resource,Study Protocol: A randomized controlled trial of suicide risk reduction in the year following jail release (the SPIRIT Trial),Contemporary Clinical Trials
phone_resource,Environmental Risks and Futures.,Procedia Environmental Sciences
phone_resource,Chapter 1: Overview,iPhone and iOS Forensics
phone_resource,"Telemedicine Online Visits in Urology During the COVID-19 Pandemic—Potential, Risk Factors, and Patients’ Perspective",European Urology
phone_resource,A middleware framework for scalable management of linked streams,Journal of Web Semantics
phone_resource,Multifocal Assessment Reveals Anemia-related Program Gaps and Implementation Challenges in Ghana (P10-088-19),Current Developments in Nutrition
phone_resource,Strategies Used and Challenges Faced by a Breast Cancer Patient Navigator in an Urban Underserved Community,Journal of the National Medical Association
phone_resource,Examining disaster preparedness at Matara District General Hospital in Sri Lanka,International Journal of Disaster Risk Reduction
phone_resource,Creating a halo traction wheelchair resource manual: Using the EBP approach,Journal of Pediatric Nursing
phone_resource,Assessment of contraceptive use in Puerto Rico during the 2016 Zika virus outbreak,Contraception
phone_resource,The Effect of Pricing and Advertising on Customer Retention in a Liberalizing Market,Journal of Interactive Marketing
phone_resource,Achieving a reliable compact acoustic model for embedded speech recognition system with high confusion frequency model handling,Speech Communication
phone_resource,Fluidification du parcours ville-hôpital : analyse de la trajectoire des patients impliqués dans le dispositif RAPIDO après un an de mise en place,La Revue de Médecine Interne
phone_resource,Chapter 14: Extending cloud-based applications with mobile opportunistic networks: Security issues and privacy challenges,Pervasive Computing
phone_resource,Capturing depression with your smartphone: Validity and utilization of iHOPE for depressed patients in Taiwan,European Psychiatry
phone_resource,Place de la trachéotomie au long cours dans l’insuffisance respiratoire chronique sévère à l’ère de la ventilation non invasive,Revue des Maladies Respiratoires
phone_resource,Sodium-ion batteries: Electrochemical properties of sodium titanate as negative electrode,Journal of Energy Storage
phone_resource,"Perceived mHealth barriers and benefits for home-based HIV testing and counseling and other care: Qualitative findings from health officials, community health workers, and persons living with HIV in South Africa",Social Science & Medicine
phone_resource,Language-dependent state clustering for multilingual acoustic modelling,Speech Communication
phone_resource,Why don't telephones have off switches? Understanding the use of everyday technologies: A research note,Interacting with Computers
phone_resource,"An ideographic study into physiology, alcohol craving and lapses during one hundred days of daily life monitoring",Addictive Behaviors Reports
phone_resource,A review on density functional theory–based study on two-dimensional materials used in batteries,Materials Today Chemistry
phone_resource,Peer-to-peer multipoint videoconferencing on the Internet,Signal Processing: Image Communication
phone_resource,Legal and Regulatory Barriers to Reverse Innovation,Annals of Global Health
phone_resource,Outcomes of Depression Screening for Adolescents Accessing Pediatric Primary Care-Based Services,Journal of Pediatric Nursing
phone_resource,Track: A randomized controlled trial of a digital health obesity treatment intervention for medically vulnerable primary care patients,Contemporary Clinical Trials
phone_resource,Missed Appointments in a Breast Clinic: Patient-Related Factors,The American Journal of the Medical Sciences
phone_resource,Frequency agility in cognitive radios: A new measurement algorithm for optimal operative frequency selection,Measurement
phone_resource,Rationale and development of a randomized pragmatic trial to improve diabetes outcomes in patient-centered medical homes serving rural patients,Contemporary Clinical Trials
phone_resource,Helping New Mothers and Newborns Sleep: An Innovative Sleep Support Program,"Journal of Obstetric, Gynecologic & Neonatal Nursing"
phone_resource,13: Smartphone-based detection devices for the agri-food industry,Smartphone-Based Detection Devices
phone_resource,Mobile content contribution and retrieval: An exploratory study using the uses and gratifications paradigm,Information Processing & Management
phone_resource,Smartphone application for captopril determination in dosage forms and synthetic urine employing digital imaging,Talanta
phone_resource,Chapter 4: Social Impacts of Mobile Technologies for Children: Keystone or Invasive Species?,Mobile Technology for Children
phone_resource,Inclusion of frail elderly patients in clinical trials: Solutions to the problems,Journal of Geriatric Oncology
phone_resource,Lessons learned from a blended telephone/e-health platform for caregivers in promoting physical activity and nutrition in children with a mobility disability,Disability and Health Journal
phone_resource,FAST DASH: Program overview and key findings from initial technology evaluations,Accident Analysis & Prevention
phone_resource,"Improved performance of Mn-, Co-based oxides from spent lithium-ion batteries supported on CeO2 with different morphologies for 2-ethoxyethyl acetate oxidation",Journal of Environmental Chemical Engineering
phone_resource,Discrepancies between Parents’ and Adolescents’ Perceptions of Family Meal Habits,Current Developments in Nutrition
phone_resource,An autonomic cloud environment for hosting ECG data analysis services,Future Generation Computer Systems
