keyword,title,publication
phone_latency,Late Pregnancy Sleep: Does Altitude Effect Length of Labor and Cesarean Rates?,"Journal of Obstetric, Gynecologic & Neonatal Nursing"
phone_latency,The association of sleep and late-night cell phone use among adolescents,Jornal de Pediatria
phone_latency,Latent Semantic Engineering – A new conceptual user-centered design approach,Advanced Engineering Informatics
phone_latency,Patients with low back pain had distinct clinical course patterns that were typically neither complete recovery nor constant pain. A latent class analysis of longitudinal data,The Spine Journal
phone_latency,Measurement of intention to travel: Considering the effect of telecommunications on trips,Transportation Research Part C: Emerging Technologies
phone_latency,Evidence of the voice-related cortical potential: An electroencephalographic study,NeuroImage
phone_latency,Cellular Network Telecontrolled Robot Vehicle,IFAC Proceedings Volumes
phone_latency,Principal component analysis of the electricity consumption in residential dwellings,Energy and Buildings
phone_latency,Chapter 10: Digital Imaging Technologies,Crime Scene Photography (Third Edition)
phone_latency,Estimating the risk of brain tumors from cellphone use: Published case–control studies,Pathophysiology
phone_latency,Can mobile phone emissions affect auditory functions of cochlea or brain stem?,Otolaryngology - Head and Neck Surgery
phone_latency,Patterns of distracted driving behaviors among young adult drivers: Exploring relationships with personality variables,Transportation Research Part F: Traffic Psychology and Behaviour
phone_latency,Novel online data allocation for hybrid memories on tele-health systems,Microprocessors and Microsystems
phone_latency,Weekly brief phone support in self-help cognitive behavioral therapy for insomnia disorder: Relevance to adherence and efficacy,Behaviour Research and Therapy
phone_latency,An experimental study on effects of radiofrequency electromagnetic fields on sleep in healthy elderly males and females: Gender matters!,Environmental Research
phone_latency,Mobile-banking adoption by Iranian bank clients,Telematics and Informatics
phone_latency,"A day-by-day prospective analysis of stress, craving and risk of next day alcohol intake during alcohol use disorder treatment",Drug and Alcohol Dependence
phone_latency,Long-term Outcomes of Patients With Normal or Minor Motor Function Abnormalities Detected by High-resolution Esophageal Manometry,Clinical Gastroenterology and Hepatology
phone_latency,Suicidal ideation among recently returned veterans and its relationship to insomnia and depression,Psychiatry Research
phone_latency,Brief Behavioral Treatment for Insomnia vs. Cognitive Behavioral Therapy for Insomnia: Results of a Randomized Noninferiority Clinical Trial Among Veterans,Behavior Therapy
phone_latency,"Internet of Things in arable farming: Implementation, applications, challenges and potential",Biosystems Engineering
phone_latency,Depression and emotion regulation predict objective smartphone use measured over one week,Personality and Individual Differences
phone_latency,Adolescents' depressive symptoms and subsequent technology-based interpersonal behaviors: A multi-wave study,Journal of Applied Developmental Psychology
phone_latency,QoS management in heterogeneous home networks,Computer Networks
phone_latency,Impact of service quality on user satisfaction: Modeling and estimating distribution of quality of experience using Bayesian data analysis,Electronic Commerce Research and Applications
phone_latency,Personalized information system for the control of tuberculosis in resource-limited settings: A simplistic proposal approach,International Journal of Mycobacteriology
phone_latency,Polyvictimization and Youth Violence Exposure Across Contexts,Journal of Adolescent Health
phone_latency,Evening and night exposure to screens of media devices and its association with subjectively perceived sleep: Should “light hygiene” be given more attention?,Sleep Health
phone_latency,Unmet basic needs and health intervention effectiveness in low-income populations,Preventive Medicine
phone_latency,A detailed examination of the longitudinal associations between individual and team sports and alcohol use,Addictive Behaviors
phone_latency,Optimized location-based service selection for QoS improvement in wireless networks,Computers & Electrical Engineering
phone_latency,Differential effects of perturbation direction and magnitude on the neural processing of voice pitch feedback,Clinical Neurophysiology
phone_latency,"Post-manufacturing, 17-times acceptable raw bit error rate enhancement, dynamic codeword transition ECC scheme for highly reliable solid-state drives, SSDs",Solid-State Electronics
phone_latency,RF-EMF exposure effects on sleep – Age doesn't matter in men!,Environmental Research
phone_latency,CrowdPulse: A framework for real-time semantic analysis of social streams,Information Systems
phone_latency,Unmanned Aerial System (UAS) Human-machine Interfaces: New Paradigms in Command and Control,Procedia Manufacturing
phone_latency,Transmission of infectious diseases from internationally adopted children to their adoptive families,Clinical Microbiology and Infection
phone_latency,On-body wearable device localization with a fast and memory efficient SVM-kNN using GPUs,Pattern Recognition Letters
phone_latency,Internet of Things as a Service (iTaaS): Challenges and solutions for management of sensor data on the cloud and the fog,Internet of Things
phone_latency,Chapter 10: Digital Imaging Technologies,Crime Scene Photography (Second Edition)
phone_latency,A Single Exposure to GSM-1800 MHz Signals in the Course of an Acute Neuroinflammatory Reaction can Alter Neuronal Responses and Microglial Morphology in the Rat Primary Auditory Cortex,Neuroscience
phone_latency,It’s not all fun and games: An investigation of the reported benefits and disadvantages of conducting activities while commuting,Travel Behaviour and Society
phone_latency,DPDRM: A decentralized post-disaster resource management scheme using energy efficient smart phone based DTN,Journal of Network and Computer Applications
phone_latency,Cognitive task fulfilment may decrease gaze control performances,Physiology & Behavior
phone_latency,Generating an efficient version of the Edinburgh Postnatal Depression Scale in an urban obstetrical population,Journal of Affective Disorders
phone_latency,Chapter 12: Voice Over Peer-to-Peer,P2P Networking and Applications
phone_latency,Protective effects of melatonin and omega-3 on the hippocampus and the cerebellum of adult Wistar albino rats exposed to electromagnetic fields,Journal of Microscopy and Ultrastructure
phone_latency,Effects of a cell phone radiofrequency (860 MHz) on the latency of brain tumors in rats,International Congress Series
phone_latency,5: VoIP Processing,Voice over Internet Protocol (VoIP) Security
phone_latency,A Kansei mining system for affective design,Expert Systems with Applications
phone_latency,On the performance of a multi-user multi-hop hybrid FSO/RF communication system,Optics Communications
phone_latency,Nonincome factors behind the purchase decisions of solar home systems in rural Bangladesh,Energy for Sustainable Development
phone_latency,Characteristics of vocal fold adduction related to voice onset,Journal of Voice
phone_latency,Efficient segment-based video transcoding proxy for mobile multimedia services,Journal of Systems Architecture
phone_latency,IP-in-IP tunneling to enable the simultaneous use of multiple IP interfaces for network level connection striping,Computer Networks
phone_latency,Caractérisation de l’activité cérébrale auditive recueillie en champ électromagnétique émis par des téléphones portables,ITBM-RBM
phone_latency,Influence of age on auditory startle responses in humans,Neuroscience Letters
phone_latency,Chapter 5: UMC: Current Market Solution Overview,Fixed/Mobile Convergence and Beyond
phone_latency,Factors Associated with the Treatment of Latent Tuberculosis Infection Among Health-Care Workers at a Midwestern Teaching Hospital,Chest
phone_latency,Sleep habits and sleep disorders in children with attention deficit-hyperactivity disorder. Influence of treatment. A multicenter study,Sleep Medicine
phone_latency,PROPOUMON: Systematic screening for occupational exposures in lung cancer patients. A prospective French cohort,Revue d'Épidémiologie et de Santé Publique
phone_latency,Exaggerated auditory startle responses in multiple system atrophy: a comparative study of parkinson and cerebellar subtypes,Clinical Neurophysiology
phone_latency,Model driven middleware: A new paradigm for developing distributed real-time and embedded systems,Science of Computer Programming
phone_latency,A Pilot Study Comparing Two Manual Therapy Interventions for Carpal Tunnel Syndrome,Journal of Manipulative and Physiological Therapeutics
phone_latency,Shortened REM latency PostECT is associated with rapid recurrence of depressive symptomatology,Biological Psychiatry
phone_latency,Influence of gender on auditory startle responses,Brain Research
phone_latency,Trajectories of suicidal ideation in patients with first-episode psychosis: secondary analysis of data from the OPUS trial,The Lancet Psychiatry
phone_latency,"Foreperiod duration, range, and ordering effects on acoustic LRT in normal speakers",Journal of Voice
phone_latency,Non-dreamers,Sleep Medicine
phone_latency,COOP/WONCA: fiabilidad y validez de la prueba administrada telefónicamente,Atención Primaria
phone_latency,The treatment of persistent vomiting through shaping and contingency management,Journal of Behavior Therapy and Experimental Psychiatry
phone_latency,Photoelicitation: A useful tool to investigate management of the vulnerability of homeless women,Enfermería Clínica (English Edition)
phone_latency,Foto-elicitación: una herramienta útil para investigar la gestión de la vulnerabilidad de las mujeres sin hogar,Enfermería Clínica
phone_latency,Abnormal brain-stem function (brain-stem auditory evoked response) correlates with acoustic cry features in term infants with hyperbilirubinemia,The Journal of Pediatrics
phone_latency,Sound spectrographic cry analysis in neonatal diagnostics. An evaluative study,Journal of Phonetics
phone_latency,Primate phonation: Unilateral and bilateral cingulate lesion effects,Behavioural Brain Research
phone_latency,Self-directed treatment for premature ejaculation: Preliminary case reports,Journal of Behavior Therapy and Experimental Psychiatry
phone_latency,Usefulness of piezoelectric earphones in recording the brain stem auditory evoked potentials: A new early deflection,Electroencephalography and Clinical Neurophysiology
phone_latency,Analytic processing elicits right ear superiority in monaurally presented speech,Neuropsychologia
phone_latency,The importance of phase of stimulus and the reference recording electrode in brain stem auditory evoked potentials,Electroencephalography and Clinical Neurophysiology
