keyword,title,publication
phone_resource,Peer-to-Peer Phone Calls and Letters Appealing Insurance Denials of Service: Practical Tips and Resources,Practical Radiation Oncology
phone_resource,Distracted on duty: A theory-based exploration of influences leading to mobile phone distracted riding among food delivery workers,Accident Analysis & Prevention
phone_resource,How to promote mobile phone recovery? Evaluation of a collection campaign in Belgian schools,Cleaner and Responsible Consumption
phone_resource,Phone Versus In-Person Navigation of Social Needs and Caregivers’ Desire for Resources in the Pediatric Emergency Department,Academic Pediatrics
phone_resource,Detection of color phenotype in strawberry germplasm resources based on field robot and semantic segmentation,Computers and Electronics in Agriculture
phone_resource,Resource Use and Clinical Outcomes in Infants with Supraventricular Tachycardia Monitored with the Owlet Smart Sock,The Journal of Pediatrics
phone_resource,uLiDR: An inertial-assisted unmodulated visible light positioning system for smartphone-based pedestrian navigation,Information Fusion
phone_resource,Agent-based simulation of non-urgent egress from mass events in open public spaces,Simulation Modelling Practice and Theory
phone_resource,How to obtain customer requirements for each stage of the product life cycle from online reviews: Using mobile phones as an example,Journal of Retailing and Consumer Services
phone_resource,Optimizing point-of-sale services in MEC enabled near field wireless communications using multi-agent reinforcement learning,Computer Communications
phone_resource,"Healthcare professionals' willingness to utilize a mobile health application for adverse drug reaction reporting in a limited resource setting: An input for digital health, 2023",European Journal of Obstetrics & Gynecology and Reproductive Biology: X
phone_resource,A comprehensive dental dataset of six classes for deep learning based object detection study,Data in Brief
phone_resource,Application of e-learning and interactive business experience based on edge computing in smart city tourism management,Entertainment Computing
phone_resource,Addressing immediate public health needs as part of Afghan evacuees’ resettlement to the United States during the COVID-19 pandemic,Public Health
phone_resource,Addressing the need for genetic cancer risk assessment in Mexico: From establishment of a formal program to delivery innovation and expansion,Genetics in Medicine Open
phone_resource,New insights into grocery store visits among east Los Angeles residents using mobility data,Health & Place
phone_resource,Novel resource-efficient recovery of high purity indium products: Unlocking value from end-of-life mobile phone liquid crystal display screens,Journal of Environmental Chemical Engineering
phone_resource,Multilingual non-intrusive binaural intelligibility prediction based on phone classification,Computer Speech & Language
phone_resource,Novel hydrometallurgical process for the recovery of copper from end-of-life mobile phone printed circuit boards using ionic liquids,Journal of Cleaner Production
phone_resource,A family-centered approach to social needs awareness in the pediatric emergency department,PEC Innovation
phone_resource,Critical and strategic metals in mobile phones: A detailed characterisation of multigenerational waste mobile phones and the economic drivers for recovery of metal value,Journal of Cleaner Production
phone_resource,"Plastic surgery online, how accessible are our units?",The Surgeon
phone_resource,Evaluation of the recycling potential of obsolete mobile phones through secondary material resources identification: A comprehensive characterization study,Journal of Environmental Management
phone_resource,High Hopes: Experimental Evidence on Financial Inclusion and the Transition to High School in Kenya,Economic Development and Cultural Change
phone_resource,Understanding the disparate impacts of the 2021 Texas winter storm and power outages through mobile phone location data and nighttime light images,International Journal of Disaster Risk Reduction
phone_resource,Efficient fruit disease diagnosis on resource-constrained agriculture devices,Journal of the Saudi Society of Agricultural Sciences
phone_resource,An expert system for hybrid edge to cloud computational offloading in heterogeneous MEC–MCC environments,Journal of Network and Computer Applications
phone_resource,The lifeline and advanced practice nursing/intervention prevention perspective,Archives of Psychiatric Nursing
phone_resource,BIAS: A novel secure and efficient biometric-based anonymous authentication scheme,Computer Networks
phone_resource,Cellulose acetate microwell plates for high-throughput colorimetric assays,RSC Advances
phone_resource,Home-Based Pediatric Hospice and Palliative Care Provider Visits: Effects on Healthcare Utilization,The Journal of Pediatrics
phone_resource,Automated detection of abnormal respiratory sound from electronic stethoscope and mobile phone using MobileNetV2,Biocybernetics and Biomedical Engineering
phone_resource,Enhancing resource efficiency through the utilization of the green bond market: An empirical analysis of Asian economies,Resources Policy
phone_resource,A dataset for assessing real-time attention levels of the students during online classes,Data in Brief
phone_resource,Cost analysis of orthognathic surgery: outpatient care versus inpatient care,International Journal of Oral and Maxillofacial Surgery
phone_resource,Characterizing environmental pollution with civil complaints and social media data: A case of the Greater Taipei Area,Journal of Environmental Management
phone_resource,Revealing the heterogeneity of periodic visiting patterns across different ages and spaces using a flexible detection method: A case study of Beijing,Applied Geography
phone_resource,Enhancing business process simulation models with extraneous activity delays,Information Systems
phone_resource,"A dataset of community perspectives on living conditions and disaster risk management in informal settlements: A case study in KwaZulu-Natal Province, South Africa",Data in Brief
phone_resource,Using mobile phone big data to identify inequity of aging groups in transit-oriented development station usage: A case of Tokyo,Transport Policy
phone_resource,Direct-to-participant recruitment of mothers and infants: A strategic approach during challenging pandemic times,Contemporary Clinical Trials Communications
phone_resource,Telehealth resources and utilization interest among women who sell sex: An explanatory sequential mixed methods study,Public Health in Practice
phone_resource,National Implementation of CPAP Telemonitoring and a Pay-for-performance Scheme for Homecare Providers in France Leads to Prioritisation of Resources to Individuals with Low Therapy Adherence: The IMPACT-PAP Cohort Study,Archivos de Bronconeumología
phone_resource,A label-free fluorescence aptamer sensor for point-of-care serotonin detection,Talanta
phone_resource,Rapid and non-destructive quality grade assessment of Hanyuan Zanthoxylum bungeanum fruit using a smartphone application integrating computer vision systems and convolutional neural networks,Food Control
phone_resource,Optimizing the detection of emerging infections using mobility-based spatial sampling,International Journal of Applied Earth Observation and Geoinformation
phone_resource,Exploring the untapped practices in bacterial-fungal mixed-based cultures for acidic treatment of metal-enriched printed circuit board waste,Waste Management
phone_resource,Caregiver Preferences for Primary Care Clinic-Based Food Assistance: A Discrete Choice Experiment,Academic Pediatrics
phone_resource,Electrolyte circulation: Metal recovery from waste printed circuit boards of mobile phones by alkaline slurry electrolysis,Journal of Cleaner Production
phone_resource,"Websites, mobile apps, and social media: Premier online educational tools for radiology",Clinical Imaging
phone_resource,"Novel closed-loop recovery of light rare earth elements, as their oxides, from end-of-life mobile phone speakers using [Hbet][Tf2N]",Journal of Environmental Chemical Engineering
phone_resource,Animations and food science: A new and effective approach to communicate cheese processing safety,International Journal of Gastronomy and Food Science
phone_resource,Extending limited datasets with GAN-like self-supervision for SMS spam detection,Computers & Security
phone_resource,Seeking materials from nature for interrupting eye damage: Ultraviolet to blue light blocking clear cellulose films enabled by curcumin,International Journal of Biological Macromolecules
phone_resource,E-learning and speech dynamic recognition based on network transmission in music interactive teaching experience,Entertainment Computing
phone_resource,Impact of Internet of Things (IOT) on Human Resource Management: A review,Materials Today: Proceedings
phone_resource,A lightweight deep learning-based android malware detection framework,Expert Systems with Applications
phone_resource,"Translocal resource governance, social relations and aspirations: Linking translocality and Feminist Political Ecology to explore farmer-managed irrigation systems and migration in Nepal",Geoforum
phone_resource,Grey weighted influence non-linear gauge systems (WINGS) for evaluating consumption barriers of refurbished mobile phones for a circular economy,Cleaner and Responsible Consumption
phone_resource,Achieving urban vibrancy through effective city planning: A spatial and temporal perspective,Cities
phone_resource,What does clean energy attract? Evidence from the transfer structure of energy-intensive projects in China,Renewable Energy
phone_resource,Communicating with B2B buyers after “Dropping the Ball”: Using digital and non-digital communication formats to recover from salesperson transgressions,International Journal of Research in Marketing
phone_resource,“It is a different type of policing than in the bush”: Police officers’ perceptions of the differences in enforcement of the phone use while driving legislation in rural and urban areas,Accident Analysis & Prevention
phone_resource,Analysis and Modeling of Mobile Phone Activity Data Using Interactive Cyber-Physical Social System,"Computers, Materials and Continua"
phone_resource,How does hands-free cognitive distraction influence cycling behaviour and perceived safety?,Transportation Research Part F: Traffic Psychology and Behaviour
phone_resource,Inferring household size distribution and its association with the built environment using massive mobile phone data,Cities
phone_resource,An efficient algorithm for energy harvesting in IIoT based on machine learning and swarm intelligence,Heliyon
phone_resource,A threatened heritage: Sustainable alternatives for Mediterranean small-scale fisheries,Marine Policy
phone_resource,A new adversarial malware detection method based on enhanced lightweight neural network,Computers & Security
phone_resource,Discovering phonetic inventories with crosslingual automatic speech recognition,Computer Speech & Language
phone_resource,A meta-analysis of voter mobilization tactics by electoral salience,Electoral Studies
phone_resource,Reducing No-Show Appointments in Preanesthesia Screening,Journal of PeriAnesthesia Nursing
phone_resource,Pharmacy technicians trained as community health workers: A prospective multicenter cohort study,Journal of the American Pharmacists Association
phone_resource,Teaching in a lockdown: The impact of COVID-19 on teachers' capacity to teach across different school types in Nigeria,Heliyon
phone_resource,Homomorphic federated learning schemes enabled pedestrian and vehicle detection system,Internet of Things
phone_resource,Impacts of household vulnerability on hurricane logistics evacuation under COVID-19: The case of U.S. Hampton Roads,Transportation Research Part E: Logistics and Transportation Review
phone_resource,"The impact of COVID-19 national lockdowns on drug-resistant tuberculosis in KwaZulu-Natal, South Africa: A spatial analysis",Annals of Epidemiology
phone_resource,Big geo-data unveils influencing factors on customer flow dynamics within urban commercial districts,International Journal of Applied Earth Observation and Geoinformation
phone_resource,Classification of skin blemishes with cell phone images using deep learning techniques,Heliyon
phone_resource,Persons living with dementia and caregivers' communication preferences for receiving a dementia diagnosis,PEC Innovation
phone_resource,Using augmented reality in molecular case studies to enhance biomolecular structure-function explorations in undergraduate classrooms,Journal of Microbiology & Biology Education
phone_resource,The TrollLabs open hackathon dataset: Generative AI and large language models for prototyping in engineering design,Data in Brief
phone_resource,"Can training over phone calls help improve outcomes for COVID-19 positive patients under home isolation? An analysis of the COVID-19 Care Companion Program in Punjab, India",Clinical Epidemiology and Global Health
phone_resource,"Designing and implementing a physical exercise intervention for people with first episode psychosis using experience-based co-design: A pilot study from Chennai, India",Asian Journal of Psychiatry
phone_resource,Edwards curve digital signature algorithm for video integrity verification on blockchain framework,Science & Justice
phone_resource,"Eyes on the road, hands upon the wheel? Reciprocal dynamics between smartphone use while driving and job crafting",Transportation Research Part F: Traffic Psychology and Behaviour
phone_resource,A hybrid acoustic model based on PDP coding for resolving articulation differences in low-resource speech recognition,Applied Acoustics
phone_resource,Android malware detection and identification frameworks by leveraging the machine and deep learning techniques: A comprehensive review,Telematics and Informatics Reports
phone_resource,Helping parents know when to seek help for an acutely ill child: Evidence based co-development of a mobile phone app using complex intervention methodology,International Journal of Medical Informatics
phone_resource,Reconstructing human activities via coupling mobile phone data with location-based social networks,Travel Behaviour and Society
phone_resource,The attribution problem of a seemingly intangible industry,Environmental Challenges
phone_resource,"Firm exit from open multiparty alliances: The role of social influence, uncertainty, and interfirm imitation in collective technology development",Research Policy
phone_resource,Diet Quality Among Mothers and Children in India: Roles of Social and Behavior Change Communication and Nutrition-Sensitive Social Protection Programs,The Journal of Nutrition
phone_resource,Recovery of gold from waste mobile phone circuit boards and synthesis of nanomaterials using emulsion liquid membrane,Journal of Hazardous Materials
phone_resource,Deep Transfer Learning Models for Mobile-Based Ocular Disorder Identification on Retinal Images,"Computers, Materials and Continua"
phone_resource,The effect of primary language on access to specialized orthopedic care,Seminars in Arthroplasty: JSES
phone_resource,Longitudinal Evaluation of a Statewide Quality Improvement Program for Nursing Homes,Journal of the American Medical Directors Association
phone_resource,Supporting dementia family care partners during COVID-19: Perspectives from hospice staff,Geriatric Nursing
phone_resource,Advances in bio/chemical approaches for sustainable recycling and recovery of rare earth elements from secondary resources,Science of The Total Environment
phone_resource,Social Emergency Medicine: Capitalizing on the Pediatric Emergency Department Visit to Screen and Connect Patients and Families to Community Resources,Academic Pediatrics
phone_resource,Research on species identification of wild grape leaves based on deep learning,Scientia Horticulturae
phone_resource,Revealing spatiotemporal matching patterns between traffic flux and road resources using big geodata - A case study of Beijing,Cities
phone_resource,A high productivity bioprocess for obtaining metallic copper from printed circuit boards (PCBs),Minerals Engineering
phone_resource,In good times and bad: Low-cost mobile teaching during a pandemic,Economics of Education Review
phone_resource,YOLO-PAI: Real-time handheld call behavior detection algorithm and embedded application,Signal Processing: Image Communication
phone_resource,82: Can educating Radiographers in identifying urgent findings requiring IR intervention improve patient outcomes? A Pilot Study,Journal of Medical Imaging and Radiation Sciences
phone_resource,"Pressure, Flow, and Glottal Area Waveform Profile Changes During Phonation Using the Acapella Choice Device",Journal of Voice
phone_resource,Comparison and analysis of new curriculum criteria for end-to-end ASR,Speech Communication
phone_resource,Comparative sanitation data from high-frequency phone surveys across 3 countries,Data in Brief
phone_resource,Research on an intelligent disassembling method for multi-type mobile phones based on rough set theory,Procedia CIRP
phone_resource,A study on 5G performance and fast conditional handover for public transit systems,Computer Communications
phone_resource,Why did this happen to me? Causal attributions of illness and cultural health capital,Social Science & Medicine
phone_resource,Examining income segregation within activity spaces under natural disaster using dynamic mobility network,Sustainable Cities and Society
phone_resource,How can pharmacists better support patients with chronic diseases? The patient perspective,Journal of the American Pharmacists Association
phone_resource,"Gender inequalities, water research and knowledge production in Ghana",Environmental Science & Policy
phone_resource,"Development of a customized m-Health-based intervention to reduce loss to follow-up among patients undergoing treatment for cervical lesions at a rural referral Hospital, South Western Uganda",Gynecologic Oncology Reports
phone_resource,Chapter 15: Membrane-based technologies for lithium extraction,Current Trends and Future Developments on (Bio-) Membranes
phone_resource,"Low-cost, open-source contact angle analyzer using a mobile phone, commercial tripods and 3D printed parts",HardwareX
phone_resource,"The effect of mobile phone use at night on the sleep of pre-adolescent (8-11 year), early adolescent (12-14 year) and late adolescent (15-18 year) children: A study of 252,195 Australian children",Sleep Health
phone_resource,mHealth for Self-Management in Pregnancy: Perceptions of Women in Low-Resource Settings,Procedia Computer Science
phone_resource,Healthcare resource utilization following apical prolapse surgery in women who received in-office versus phone-only preoperative teaching,American Journal of Obstetrics and Gynecology
phone_resource,Hermetic microfluidic device for point-of-care viral nucleic acid testing,Sensors and Actuators B: Chemical
phone_resource,Improving primary health care for children and adolescents in Europe,Global Pediatrics
phone_resource,Mi Superpoder es la Programación: A tool for teaching programming to children and youth,Science of Computer Programming
phone_resource,Electrocardiogram Signal Classification Using Lightweight DNN for Mobile Devices,Procedia Computer Science
phone_resource,“Barcode” cell sensor microfluidic system: Rapid and sample-to-answer antimicrobial susceptibility testing applicable in resource-limited conditions,Biosensors and Bioelectronics
phone_resource,Interactive display method of electric power business hall based on 3D technology,Computers and Electrical Engineering
phone_resource,Perceptions of sleep health among African American mothers regarding their preschool-aged children: A qualitative study to decrease sleep health disparities,Sleep Health
phone_resource,Development of a life cycle based process for cobalt recovering from cell batteries,Cleaner Waste Systems
phone_resource,Diagnosis of skin diseases in the era of deep learning and mobile technology,Computers in Biology and Medicine
phone_resource,Practical Resources for Effective Postpartum Parenting (PREPP): a randomized controlled trial of a novel parent-infant dyadic intervention to reduce symptoms of postpartum depression: RCT of the PREPP intervention for postpartum depression,American Journal of Obstetrics & Gynecology MFM
phone_resource,Estimation of E-waste at micro level for reverse logistics: A case of Delhi,Journal of Cleaner Production
phone_resource,Point-of-care applications of smartphone-based microscopy,Sensors and Actuators A: Physical
phone_resource,How distraction affects pedestrian response: Evidence from behavior patterns and cortex oxyhemoglobin changes,Transportation Research Part F: Traffic Psychology and Behaviour
phone_resource,Deadline-aware multi-objective IoT services placement optimization in fog environment using parallel FFD-genetic algorithm,Pervasive and Mobile Computing
phone_resource,Evaluation of junior doctors’ retention of knowledge and skills after simulation training in shockable rhythm cardiac arrest in a low-resource setting in Nepal,Resuscitation Plus
phone_resource,"Social media: The forefront of pediatric surgical education, recruitment, and information",Journal of Pediatric Surgery Open
phone_resource,"Engineering of coherent plasmon resonances from silver soret colloids, graphene oxide and Nd2O3 nanohybrid architectures studied in mobile phone-based surface plasmon-coupled emission platform",Materials Letters
phone_resource,Strategies to enhance remote monitoring adherence among patients with cardiovascular implantable electronic devices,Heart Rhythm O2
phone_resource,Outcomes of endoscopic percutaneous suture lateralization for neonatal and infantal bilateral vocal ford paralysis,Brazilian Journal of Otorhinolaryngology
phone_resource,Driving information communication technology for tax revenue mobilization in Sub-Saharan Africa,Telecommunications Policy
phone_resource,"Highly transparent, low haze and ultraviolet to blue light blocking cellulose films tailored by lutein as electronic screen protectors",Industrial Crops and Products
phone_resource,Development of a lateral flow immunoassay using antibody cocktail for the detection of the various epidemic subtypes of group A Streptococcus in clinical samples,Sensors and Actuators B: Chemical
phone_resource,End-to-end acoustic modelling for phone recognition of young readers,Speech Communication
phone_resource,"Tracheostomy-related durable medical equipment: Insurance coverage, gaps, and barriers",American Journal of Otolaryngology
phone_resource,A knowledge distillation based deep learning framework for cropped images detection in spatial domain,Signal Processing: Image Communication
phone_resource,Design and Implementation of a Low-Cost Portable Water Quality Monitoring System,"Computers, Materials and Continua"
phone_resource,Comparison of electronic versus phone-based administration of the Quality of Recovery-40 survey after ambulatory surgery,Journal of Clinical Anesthesia
phone_resource,Analyzing and forecasting service demands using human mobility data: A two-stage predictive framework with decomposition and multivariate analysis,Expert Systems with Applications
phone_resource,Towards circular economy of wasted printed circuit boards of mobile phones fuelled by machine learning and robust mathematical optimization framework,"Resources, Conservation & Recycling Advances"
phone_resource,A qualitative assessment of adolescent perspectives on patient education in the outpatient setting,PEC Innovation
phone_resource,Comparing deep learning models for tuberculosis detection: A retrospective study of digital vs. analog chest radiographs,Indian Journal of Tuberculosis
phone_resource,Forecasting quantities of critical raw materials in obsolete feature and smart phones in Greece: A path to circular economy,Journal of Environmental Management
phone_resource,Increased nationwide use of green spaces in Norway during the COVID-19 pandemic,Environment International
phone_resource,Smart-phone phase contrast microscope with a singlet lens and deep learning,Optics & Laser Technology
phone_resource,FedDCS: A distributed client selection framework for cross device federated learning,Future Generation Computer Systems
phone_resource,A patient-centered evaluation of a novel medical student-based patient navigation program,Patient Education and Counseling
phone_resource,Incorporating self-employed maintainers into WEEE formal recycling system: A system dynamic approach,Journal of Environmental Management
phone_resource,Health Impact of a Mobile-Delivered Diabetes Intervention to Control Blood Pressure in Older Adults,AJPM Focus
phone_resource,Waste Cotton-Derived Fiber-Based Thermoelectric Aerogel for Wearable and Self-Powered Temperature–Compression Strain Dual-Parameter Sensing,Engineering
phone_resource,Are postoperative opioid stewardship protocols sustainable? Results from a 2-year quality improvement project,Surgery
phone_resource,Enhancing Radiation Oncology Resident Education: A Multifaceted Approach to Managing Emergencies,International Journal of Radiation Oncology*Biology*Physics
phone_resource,Low-complex resource mapping heuristics for mobile and iot workloads on NoC-HMPSoC architecture,Microprocessors and Microsystems
phone_resource,Effect of information and communication technology and electricity consumption on green total factor productivity,Applied Energy
phone_resource,Financial Toxicity of Breast Cancer Care: The Patient Perspective Through Surveys and Interviews,Journal of Surgical Research
phone_resource,Traffic violations analysis: Identifying risky areas and common violations,Heliyon
