keyword,title,publication
smartphone_memory,Chapter 14: A study on smartphone sensor-based Human Activity Recognition using deep learning approaches,Handbook of Computational Intelligence in Biomedical Engineering and Healthcare
smartphone_memory,Static malware detection and attribution in android byte-code through an end-to-end deep system,Future Generation Computer Systems
smartphone_memory,Complete vector quantization of feedforward neural networks,Neurocomputing
smartphone_memory,A fusion of a deep neural network and a hidden Markov model to recognize the multiclass abnormal behavior of elderly people,Knowledge-Based Systems
smartphone_memory,Learning to type with mobile keyboards: Findings with a randomized keyboard,Computers in Human Behavior
smartphone_memory,Nondestructive detection of fiber content in steel fiber reinforced concrete through percussion method coordinated with a hybrid deep learning network,Journal of Building Engineering
smartphone_memory,Optimized device centric aggregation mechanisms for mobile devices with multiple wireless interfaces,Computer Networks
smartphone_memory,A multivariate symbolic approach to activity recognition for wearable applications,IFAC-PapersOnLine
smartphone_memory,The use of Information and Communication technology when completing instrumental activities of daily living,Computers in Human Behavior
smartphone_memory,Fast ML-based next-word prediction for hybrid languages,Internet of Things
smartphone_memory,Revisiting swapping in mobile systems with SwapBench,Future Generation Computer Systems
smartphone_memory,Differences in time-based task characteristics help to explain the age-prospective memory paradox,Cognition
smartphone_memory,8: “Chrono-sensitivity”: From Concept to Ethics,The Human Challenge of Telemedicine
smartphone_memory,A Survey Of mobile face biometrics,Computers & Electrical Engineering
smartphone_memory,An overall assessment of Mobile Internal Acquisition Tool,Digital Investigation
smartphone_memory,Machine Learning Based Activity Recognition To Identify Wasteful Activities In Production,Procedia Manufacturing
smartphone_memory,Learning from Usage Analysis of Mobile Devices,Procedia Computer Science
smartphone_memory,Cognitive effects of multi-night adolescent sleep restriction: current data and future possibilities,Current Opinion in Behavioral Sciences
smartphone_memory,ADAM-sense: Anxiety-displaying activities recognition by motion sensors,Pervasive and Mobile Computing
smartphone_memory,Evidential two-step tree species recognition approach from leaves and bark,Expert Systems with Applications
smartphone_memory,DeepTransHAR: a novel clustering-based transfer learning approach for recognizing the cross-domain human activities using GRUs (Gated Recurrent Units) Networks,Internet of Things
smartphone_memory,On-body wearable device localization with a fast and memory efficient SVM-kNN using GPUs,Pattern Recognition Letters
smartphone_memory,Velox VM: A safe execution environment for resource-constrained IoT applications,Journal of Network and Computer Applications
smartphone_memory,Android malware classification using optimum feature selection and ensemble machine learning,Internet of Things and Cyber-Physical Systems
smartphone_memory,Developing parallel programming and soft skills: A project based learning approach,Journal of Parallel and Distributed Computing
smartphone_memory,Robot-assisted therapy for rehabilitation of children with cerebral palsy - A complementary and alternative approach,Computers in Human Behavior
smartphone_memory,Human activity recognition using improved complete ensemble EMD with adaptive noise and long short-term memory neural networks,Biocybernetics and Biomedical Engineering
smartphone_memory,Forensic smartphone analysis using adhesives: Transplantation of Package on Package components,Digital Investigation
smartphone_memory,On the Influencing Factors of Dictionary App Interface Design for the Elders,Procedia Manufacturing
smartphone_memory,Human worker activity recognition in a production floor environment through deep learning,Journal of Manufacturing Systems
smartphone_memory,Cognitive training for neurocognitive and functional impairments in obsessive compulsive disorder: A case report,Journal of Obsessive-Compulsive and Related Disorders
smartphone_memory,Blockchain-enabled deep semantic video-to-video summarization for IoT devices,Computers & Electrical Engineering
smartphone_memory,1.2 Watt Classification of 3D Voxel Based Point-clouds using a CNN on a Neural Compute Stick,Neurocomputing
smartphone_memory,Structured feature sparsity training for convolutional neural network compression,Journal of Visual Communication and Image Representation
smartphone_memory,Performance evaluation of Attribute-Based Encryption on constrained IoT devices,Computer Communications
smartphone_memory,IFHNFS: fast indexing information in mobile devices,Procedia Computer Science
smartphone_memory,BIG-OH: BInarization of gradient orientation histograms,Image and Vision Computing
smartphone_memory,Revolutionizing education system with interactive augmented reality for quality education,Materials Today: Proceedings
smartphone_memory,"A novel GPS/DVL/MEMS-INS smartphone sensors integrated method to enhance autonomous navigation, guidance and control system of AUSVs based on ADSF Combined Filter",Measurement
smartphone_memory,(117) Characterizing Fibrofog in Daily Life: Ambulatory Cognitive Functioning in Adults with Fibromyalgia and Matched Controls,The Journal of Pain
smartphone_memory,"Disembodied voices, embodied places: Mobile technology, enabling discourse, and interpreting place",Landscape and Urban Planning
smartphone_memory,Chapter 5: Graph convolutional networks for pain detection via telehealth,Artificial Intelligence in Healthcare and COVID-19
smartphone_memory,Energy consumption of data mining algorithms on mobile phones: Evaluation and prediction,Pervasive and Mobile Computing
smartphone_memory,Affective and cognitive processes involved in behavioral addictions,Addictive Behaviors
smartphone_memory,"Digital assessment of working memory and processing speed in everyday life: Feasibility, validation, and lessons-learned",Internet Interventions
smartphone_memory,Exploiting VoIP softphone vulnerabilities to disable host computers: Attacks and mitigation,International Journal of Critical Infrastructure Protection
smartphone_memory,Human activity recognition using a multi-branched CNN-BiLSTM-BiGRU model,Applied Soft Computing
smartphone_memory,Relationship between daily rated depression symptom severity and the retrospective self-report on PHQ-9: A prospective ecological momentary assessment study on 80 psychiatric outpatients,Journal of Affective Disorders
smartphone_memory,The state of the art in measurement-based experiments on the mobile web,Information and Software Technology
smartphone_memory,Facial attributes for active authentication on mobile devices,Image and Vision Computing
smartphone_memory,Decontamination of blood soaked electronic devices using ultrasonic technology,Forensic Science International
smartphone_memory,Utilisation d’un agenda électronique dans la maladie d’Alzheimer : étude de cas dans un contexte clinique,NPG Neurologie - Psychiatrie - Gériatrie
smartphone_memory,Functionalized water soluble nanomaterials and their applications in wirelessly destructible programmed flexible transient photodetectors,Materials Science in Semiconductor Processing
smartphone_memory,Switching on or switching off? Everyday computer use as a predictor of sustained attention and cognitive reflection,Computers in Human Behavior
smartphone_memory,HRCal: An effective calibration system for heart rate detection during exercising,Journal of Network and Computer Applications
smartphone_memory,Chapter Seven: Architecture of neural processing unit for deep neural networks,Advances in Computers
smartphone_memory,Chapter 13: Proximity-Based Service: An Advanced Way of Extending Human Proximity Awareness,Smart Sensors Networks
smartphone_memory,The role of cognition in mediating the relationship between media use and health in a media saturated world,Encyclopedia of Child and Adolescent Health
smartphone_memory,Promising technological innovations in cognitive training to treat eating-related behavior,Appetite
smartphone_memory,Protection of heterogeneous architectures on FPGAs: An approach based on hardware firewalls,Microprocessors and Microsystems
smartphone_memory,BanglaSER: A speech emotion recognition dataset for the Bangla language,Data in Brief
smartphone_memory,Generic Context Adaptation for Mobile Cloud Computing Environments,Procedia Computer Science
smartphone_memory,Audio signals and artificial neural networks for classification of plastic resins for recycling,Digital Chemical Engineering
smartphone_memory,Chapter 18: Peer-reviewed working memory training: is it an effective intervention for addiction?,Cognition and Addiction
smartphone_memory,Automation of fizzy extraction enabled by inexpensive open-source modules,Heliyon
smartphone_memory,New algorithms for processing time-series big EEG data within mobile health monitoring systems,Computer Methods and Programs in Biomedicine
smartphone_memory,Mussel-inspired strategy to construct 3D silver nanoparticle network in flexible phase change composites with excellent thermal energy management and electromagnetic interference shielding capabilities,Composites Part B: Engineering
smartphone_memory,Increase attractor capacity using an ensembled neural network,Expert Systems with Applications
smartphone_memory,Geological and hydrological visualization models for Digital Earth representation,Computers & Geosciences
smartphone_memory,Efficient and Transparent Use of personal device storage in opportunistic data forwarding,Computer Communications
smartphone_memory,Efficient image-based indoor localization with MEMS aid on the mobile device,ISPRS Journal of Photogrammetry and Remote Sensing
smartphone_memory,Chapter 5: Batteries and Displays for Mobile Devices,Power Management in Mobile Devices
smartphone_memory,Exploring touch feedback display of virtual keyboards for reduced eye movements,Displays
smartphone_memory,Statistical data mining of streaming motion data for activity and fall recognition in assistive environments,Neurocomputing
smartphone_memory,Adaptive priority-based cache replacement and prediction-based cache prefetching in edge computing environment,Journal of Network and Computer Applications
smartphone_memory,"Flexible all-inorganic Sm-doped PMN-PT film with ultrahigh piezoelectric coefficient for mechanical energy harvesting, motion sensing, and human-machine interaction",Nano Energy
smartphone_memory,Dynamic deployment and quality adaptation for mobile augmented reality applications,Journal of Systems and Software
smartphone_memory,Technological insomnia and actigraphy,Sleep Medicine
smartphone_memory,Engaging across dimensions of diversity: A cross-national perspective on mHealth tools for managing relapsing remitting and progressive multiple sclerosis,Multiple Sclerosis and Related Disorders
smartphone_memory,A quantitative approach to neuropsychiatry: The why and the how,Neuroscience & Biobehavioral Reviews
smartphone_memory,Detection of mental fatigue state with wearable ECG devices,International Journal of Medical Informatics
smartphone_memory,Dynamic framework for building highly-localized mobile web DTN applications,Computer Communications
smartphone_memory,App usage prediction for dual display device via two-phase sequence modeling,Pervasive and Mobile Computing
smartphone_memory,Foodborne Outbreak Investigation: Effect of Recall Inaccuracies on Food Histories,Journal of Food Protection
smartphone_memory,Monitoring Patient Reported Outcomes in PNH: Interim Results of a Market Research with florio ® PNH,Blood
smartphone_memory,FitCNN: A cloud-assisted and low-cost framework for updating CNNs on IoT devices,Future Generation Computer Systems
smartphone_memory,"I Did OK, but Did I Like It? Using Ecological Momentary Assessment to Examine Perceptions of Social Interactions Associated With Severity of Social Anxiety and Depression",Behavior Therapy
smartphone_memory,Atrial fibrillation detection from raw photoplethysmography waveforms: A deep learning application,Heart Rhythm O2
smartphone_memory,Shared Reading Quality and Brain Activation during Story Listening in Preschool-Age Children,The Journal of Pediatrics
smartphone_memory,Optimization of rule-based systems in mHealth applications,Engineering Applications of Artificial Intelligence
smartphone_memory,Modeling & analysis of an LTE-Advanced receiver using mode-controlled dataflow,Microprocessors and Microsystems
smartphone_memory,Smart cyber society: Integration of capillary devices with high usability based on Cyber–Physical System,Future Generation Computer Systems
smartphone_memory,(119) The Role of Environmental Distractions in the Experience of Fibrofog in Real-World Settings,The Journal of Pain
smartphone_memory,"Intrusion detection for mobile devices using the knowledge-based, temporal abstraction method",Journal of Systems and Software
smartphone_memory,Gesture recognition: A review focusing on sign language in a mobile context,Expert Systems with Applications
smartphone_memory,The effects of COVID-19 on cognitive performance in a community-based cohort: a COVID symptom study biobank prospective cohort study,eClinicalMedicine
smartphone_memory,Chapter 8: Internet of Things technologies for elderly health-care applications,Emergence of Pharmaceutical Industry Growth with Industrial IoT Approach
smartphone_memory,A privacy-preserving smart parking system using an IoT elliptic curve based security platform,Computer Communications
smartphone_memory,A study of energy-aware implementation techniques: Redistribution of computational jobs in mobile apps,Sustainable Computing: Informatics and Systems
smartphone_memory,"Evolving materials, attributes, and functionality in consumer electronics: Case study of laptop computers","Resources, Conservation and Recycling"
smartphone_memory,An intelligent healthcare monitoring framework using wearable sensors and social networking data,Future Generation Computer Systems
smartphone_memory,A deep learning model to discern indoor from outdoor environments based on data recorded by a tri-axial digital magnetic sensor,Gait & Posture
smartphone_memory,Mobiiscape: Middleware support for scalable mobility pattern monitoring of moving objects in a large-scale city,Journal of Systems and Software
smartphone_memory,Kriging metamodeling for approximation of high-dimensional wave and surge responses in real-time storm/hurricane risk assessment,Computer Methods in Applied Mechanics and Engineering
smartphone_memory,Low cost remote gaze gesture recognition in real time,Applied Soft Computing
smartphone_memory,Developing Low-Cost and Scalable Virtual Reality Mindfulness Interventions for Older Psychiatry Inpatients,The American Journal of Geriatric Psychiatry
smartphone_memory,Telemedicine Readiness in a Large Cohort of Geriatric Psychiatry Clinic Patient Referrals,The American Journal of Geriatric Psychiatry
smartphone_memory,La modification du biais attentionnel dans les troubles anxieux et la dépression : une revue synthétique de la littérature,"Annales Médico-psychologiques, revue psychiatrique"
smartphone_memory,"De l’identité numérique vers la personnalité connectée, du diagnosticien augmenté vers le soignant virtuel : quels enjeux pour la psychologie et la psychiatrie du futur ?",L'Évolution Psychiatrique
