keyword,title,publication
smartphone_memory,Can limiting bedtime smartphone use improve next-day working memory among undergraduates with problematic smartphone use?,Psychiatry Research
smartphone_memory,Exploring current smartphone-based cognitive assessments in schizophrenia and bipolar disorder,Schizophrenia Research: Cognition
smartphone_memory,Effective connectivity analysis of verbal working memory advantage across materials for pathological smartphone users by fNIRS,Psychiatry Research: Neuroimaging
smartphone_memory,Does a smartphone on the desk drain our brain? No evidence of cognitive costs due to smartphone presence in a short-term and prospective memory task,Consciousness and Cognition
smartphone_memory,Investigation of the influence of 45-minute pre-sleep social media use on sleep quality and memory consolidation in adolescents,Sleep Medicine
smartphone_memory,Smartphone based structural health monitoring using deep neural networks,Sensors and Actuators A: Physical
smartphone_memory,Exploiting RPMB authentication in a closed source TEE implementation,Forensic Science International: Digital Investigation
smartphone_memory,"Exposure to neighborhood violence, and laboratory-based and ambulatory cognitive task performance in adulthood",Social Science & Medicine
smartphone_memory,Provoking lucid dreams at home with sensory cues paired with pre-sleep cognitive training,Consciousness and Cognition
smartphone_memory,Using Facebook to Recruit Urban Participants for Smartphone-Based Travel Surveys,Transportation Research Interdisciplinary Perspectives
smartphone_memory,Association of social isolation and smartphone use on cognitive functions,Archives of Gerontology and Geriatrics
smartphone_memory,Effects of evening smartphone use on sleep and declarative memory consolidation in adolescents and young adults,Sleep Medicine
smartphone_memory,Parental Problematic Smartphone Use and Children's Executive Function: The Mediating Role of Technoference and the Moderating Role of Children's Age,Early Childhood Research Quarterly
smartphone_memory,"Smartphones and attention, curse or blessing? - A review on the effects of smartphone usage on attention, inhibition, and working memory",Computers in Human Behavior Reports
smartphone_memory,Externalizing autobiographical memories in the digital age,Trends in Cognitive Sciences
smartphone_memory,Can smartphone presence affect cognitive function? The moderating role of fear of missing out,Computers in Human Behavior
smartphone_memory,Should Participants be Left to their Own Devices? Comparing Paper and Smartphone Diaries in Psychological Research,Journal of Applied Research in Memory and Cognition
smartphone_memory,Federated Learning Framework for Human Activity Recognition Using Smartphones,Procedia Computer Science
smartphone_memory,MotionID: Towards practical behavioral biometrics-based implicit user authentication on smartphones,Pervasive and Mobile Computing
smartphone_memory,A review of deep learning models to detect malware in Android applications,Cyber Security and Applications
smartphone_memory,Hybrid deep learning models for road surface condition monitoring,Measurement
smartphone_memory,Human activity recognition based on hybrid learning algorithm for wearable sensor data,Measurement: Sensors
smartphone_memory,A smart decision support system to diagnose arrhythymia using ensembled ConvNet and ConvNet-LSTM model,Expert Systems with Applications
smartphone_memory,Grey Wolf-Based Method for an Implicit Authentication of Smartphone Users,"Computers, Materials and Continua"
smartphone_memory,Deep learning models for real-life human activity recognition from smartphone sensor data,Internet of Things
smartphone_memory,Forensic analysis techniques for fragmented flash memory pages in smartphones,Digital Investigation
smartphone_memory,Combined CNN-LSTM Deep Learning Algorithms for Recognizing Human Physical Activities in Large and Distributed Manners: A Recommendation System,"Computers, Materials and Continua"
smartphone_memory,CardioHelp: A smartphone application for beat-by-beat ECG signal analysis for real-time cardiac disease detection using edge-computing AI classifiers,Smart Health
smartphone_memory,Live acquisition of main memory data from Android smartphones and smartwatches,Digital Investigation
smartphone_memory,Semantic Segmentation on Smartphone Motion Sensor Data for Road Surface Monitoring,Procedia Computer Science
smartphone_memory,Working memory in young children: A pilot study on the gender-mediated effect of Touch Screen Device use,Computers in Human Behavior Reports
smartphone_memory,"Smartphone with optical, physical, and electrochemical nanobiosensors",Journal of Industrial and Engineering Chemistry
smartphone_memory,Comparing factual recall of tapped vs. handwritten text,Acta Psychologica
smartphone_memory,Cognitive domain-independent aberrant frontoparietal network strength in individuals with excessive smartphone use,Psychiatry Research: Neuroimaging
smartphone_memory,Unproctored internet-based device-type effects on test scores: The role of working memory,Intelligence
smartphone_memory,VolMemDroid—Investigating android malware insights with volatile memory artifacts,Expert Systems with Applications
smartphone_memory,Effects of smartphone-based memory training for older adults with subjective memory complaints,European Psychiatry
smartphone_memory,Physical activity forecasting with time series data using Android smartphone,Pervasive and Mobile Computing
smartphone_memory,Cognitive ability and personality: Testing broad to nuanced associations with a smartphone app,Intelligence
smartphone_memory,"Smartphones, Memory, and Pharmacy Education",American Journal of Pharmaceutical Education
smartphone_memory,Exploiting write-only-once characteristics of file data in smartphone buffer cache management,Pervasive and Mobile Computing
smartphone_memory,Use of Smartphones for Hypoglycaemia Prediction - A Feasibility Study,Procedia Computer Science
smartphone_memory,Practical use of smartphone cameras in rip current monitoring studies,Ocean & Coastal Management
smartphone_memory,Gait identification and authentication using LSTM based on 3-axis accelerations of smartphone,Procedia Computer Science
smartphone_memory,Privacy-preserving activity recognition using multimodal sensors in smart office,Future Generation Computer Systems
smartphone_memory,New acquisition method based on firmware update protocols for Android smartphones,Digital Investigation
smartphone_memory,Unlocking the potential of play: A TF-IDF analysis of ‘MapleStory’ as a serious game for cognitive enhancement in seniors,Entertainment Computing
smartphone_memory,An approach for offloading in mobile cloud computing to optimize power consumption and processing time,Sustainable Computing: Informatics and Systems
smartphone_memory,Durability of smartphones: A technical analysis of reliability and repairability aspects,Journal of Cleaner Production
smartphone_memory,New flash memory acquisition methods based on firmware update protocols for LG Android smartphones,Digital Investigation
smartphone_memory,Effects of Electromagnetic Radiation from Smartphones on Learning Ability and Hippocampal Progenitor Cell Proliferation in Mice,Osong Public Health and Research Perspectives
smartphone_memory,Synchronized Diabetes Monitoring System: Development of Smart Mobile Apparatus for Diabetes Using Insulin,IRBM
smartphone_memory,Social media use is predictable from app sequences: Using LSTM and transformer neural networks to model habitual behavior,Computers in Human Behavior
smartphone_memory,Windows mobile advanced forensics: An alternative to existing tools,Digital Investigation
smartphone_memory,Freeze and Crypt: Linux kernel support for main memory encryption,Computers & Security
smartphone_memory,Is the smartphone a smart choice? The effect of smartphone separation on executive functions,Computers in Human Behavior
smartphone_memory,Privacy Enhanced Mobile User Authentication Method Using Motion Sensors,CMES - Computer Modeling in Engineering and Sciences
smartphone_memory,Chapter 40: Integrated medical and psychiatric self-management smartphone technologies for older adults with serious mental illness,"Assessments, Treatments and Modeling in Aging and Neurological Disease"
smartphone_memory,Older adults' self-reported prospective memory lapses in everyday life: Connections to inflammation and gender,Journal of Psychosomatic Research
smartphone_memory,Windows Mobile LiveSD Forensics,Journal of Network and Computer Applications
smartphone_memory,Snapchat Analysis to Discover Digital Forensic Artifacts on Android Smartphone,Procedia Computer Science
smartphone_memory,Functionalized cellulose nanocrystals-MoS2 nanosheets to tailor brick–mortar architecture of green composite for next-generation electronic packaging,Chemical Engineering Journal
smartphone_memory,NOHAR - NOvelty discrete data stream for Human Activity Recognition based on smartphones with inertial sensors,Expert Systems with Applications
smartphone_memory,A symmetrical imine-linkage colorimetric probe for sequential detection of Al3+ and PO43- ions,Inorganica Chimica Acta
smartphone_memory,Working memory deterioration as an early warning sign for relapse in remitted psychosis: A one-year naturalistic follow-up study,Psychiatry Research
smartphone_memory,PAL: A pseudo assembly language for optimizing secure function evaluation in mobile devices,Journal of Information Security and Applications
smartphone_memory,Effectiveness of telerehabilitation plus virtual reality (Tele-RV) in cognitive e social functioning: A randomized clinical study on Parkinson's disease,Parkinsonism & Related Disorders
smartphone_memory,Heart rate variability modulates memory function in a virtual task,Physiology & Behavior
smartphone_memory,TinyML-Raman: A novel IoT based field-deployable spectra analysis for accurate identification of pharmaceuticals and trace dye-pesticide mixtures from facile SERS method,Analytica Chimica Acta
smartphone_memory,"Integrating a spoken dialogue system, nursing records, and activity data collection based on smartphones",Computer Methods and Programs in Biomedicine
smartphone_memory,Chapter Eight: Smartphone-Based Biosensors for Bioanalytics: A Critical Review,Comprehensive Analytical Chemistry
smartphone_memory,A framework of transportation mode detection for people with mobility disability,Journal of Intelligent Transportation Systems
smartphone_memory,Offloading memory leaves us vulnerable to memory manipulation,Cognition
smartphone_memory,How to decrypt PIN-Based encrypted backup data of Samsung smartphones,Digital Investigation
smartphone_memory,Implicit authentication method for smartphone users based on rank aggregation and random forest,Alexandria Engineering Journal
smartphone_memory,Effects of media multitasking on the processing and comprehension of multiple documents: Does main idea summarization make a difference?,Contemporary Educational Psychology
smartphone_memory,"Temporary flood marks proposal: What we learned after losing the baroque artifact from Cracow, Poland",International Journal of Disaster Risk Reduction
smartphone_memory,EPQuant: A Graph Neural Network compression approach based on product quantization,Neurocomputing
smartphone_memory,Moment-to-Moment Association Between Cognitive Regulation and Performance of Daily Activities in Mild Stroke and Transient Ischemic Attack using Ecological Momentary Assessment,Archives of Physical Medicine and Rehabilitation
smartphone_memory,Does cognitive impairment in bipolar disorder impact on a SIMPLe app use?,Journal of Affective Disorders
smartphone_memory,Hush now! Context factors behind smartphone ringer mode changes,Pervasive and Mobile Computing
smartphone_memory,Effect of technological developments for smartphone lithium battery on metal-derived resource depletion and toxicity potentials,"Resources, Conservation and Recycling"
smartphone_memory,Chapter 12: Smartphone-based microfluidic devices,Biomedical Applications of Microfluidic Devices
smartphone_memory,Transfer learning for the efficient detection of COVID-19 from smartphone audio data,Pervasive and Mobile Computing
smartphone_memory,A Transfer Learning and Explainable Solution to Detect mpox from Smartphones images,Pervasive and Mobile Computing
smartphone_memory,Mobile sensors based platform of Human Physical Activities Recognition for COVID-19 spread minimization,Computers in Biology and Medicine
smartphone_memory,A mobile computer aided system for optic nerve head detection,Computer Methods and Programs in Biomedicine
smartphone_memory,Smartphone assisted fieldwork: Towards the digital transition of geoscience fieldwork using LiDAR-equipped iPhones,Earth-Science Reviews
smartphone_memory,USING SMARTPHONE PERSONAL ASSISTANT TECHNOLOGY TO SUPPORT PROSPECTIVE MEMORY IN MILD COGNITIVE IMPAIRMENT: PRELIMINARY LESSONS ON TRAINING FEASIBILITY AND PHONE USABILITY,Alzheimer's & Dementia
smartphone_memory,CLAID: Closing the Loop on AI & Data Collection — A cross-platform transparent computing middleware framework for smart edge-cloud and digital biomarker applications,Future Generation Computer Systems
smartphone_memory,Robust Human Activity Recognition using smartwatches and smartphones,Engineering Applications of Artificial Intelligence
smartphone_memory,From Self-Reports to Auto-Tech-Detect (ATD)-Based Self-Reports in Traffic Research,International Encyclopedia of Transportation
smartphone_memory,Real-time detection of abnormal driving behavior based on long short-term memory network and regression residuals,Transportation Research Part C: Emerging Technologies
smartphone_memory,"Serial position, output order, and list length effects for words presented on smartphones over very long intervals",Journal of Memory and Language
smartphone_memory,Language facilitates introspection: Verbal mind-wandering has privileged access to consciousness,Consciousness and Cognition
smartphone_memory,"Advances in Mind/Body Therapies: Concept, Data and Delivery",The American Journal of Geriatric Psychiatry
smartphone_memory,Consistent and robust predictors of Internet Use among older adults over time identified by machine learning,Computers in Human Behavior
smartphone_memory,Predicting human mobility flows in response to extreme urban floods: A hybrid deep learning model considering spatial heterogeneity,"Computers, Environment and Urban Systems"
smartphone_memory,Optimizing echo state networks for continuous gesture recognition in mobile devices: A comparative study,Heliyon
smartphone_memory,"Atmospheres of street performance in Taipei: Affect and emotion as dynamic, simultaneous, more-than-representational experiences","Emotion, Space and Society"
smartphone_memory,Digital forensic analysis of the private mode of browsers on Android,Computers & Security
smartphone_memory,An adaptive teacher–student learning algorithm with decomposed knowledge distillation for on-edge intelligence,Engineering Applications of Artificial Intelligence
smartphone_memory,Does real time experience matter? Comparison of retrospective and in-situ spatial data in participatory mapping,"Computers, Environment and Urban Systems"
smartphone_memory,Acquisition and analysis of volatile memory from android devices,Digital Investigation
smartphone_memory,"Linguistic dual tasking reduces emotionality, vividness and credibility of voice memories in voice-hearing individuals: Results from a controlled trial",Schizophrenia Research
smartphone_memory,A pilot study towards a smart-health framework to collect and analyze biomarkers with low-cost and flexible wearables,Smart Health
smartphone_memory,A role for metamemory in cognitive offloading,Cognition
smartphone_memory,P2OP—Plant Pathology on Palms: A deep learning-based mobile solution for in-field plant disease detection,Computers and Electronics in Agriculture
smartphone_memory,A light weight smartphone based human activity recognition system with high accuracy,Journal of Network and Computer Applications
smartphone_memory,Memory-optimized distributed utility mining for big data,Journal of King Saud University - Computer and Information Sciences
smartphone_memory,One key to rule them all: Recovering the master key from RAM to break Android's file-based encryption,Forensic Science International: Digital Investigation
smartphone_memory,Additive manufacturing with shape changing/memory materials: A review on 4D printing technology,Materials Today: Proceedings
smartphone_memory,HAR-DeepConvLG: Hybrid deep learning-based model for human activity recognition in IoT applications,Information Sciences
smartphone_memory,A method supporting fault-tolerant optical text recognition from video sequences recorded with handheld cameras,Engineering Applications of Artificial Intelligence
smartphone_memory,Enabling IoT interoperability through opportunistic smartphone-based mobile gateways,Journal of Network and Computer Applications
smartphone_memory,Design of a WeChat Learning Platform for Syndrome Differentiation,Digital Chinese Medicine
smartphone_memory,Forensic analysis of the ChatSecure instant messaging application on android smartphones,Digital Investigation
smartphone_memory,Development of Voice Control Algorithm for Robotic Wheelchair Using MIN and LSTM Models,"Computers, Materials and Continua"
smartphone_memory,Recurrent neural network based scenario recognition with Multi-constellation GNSS measurements on a smartphone,Measurement
smartphone_memory,Keeping track of time: A Smartphone-based analysis of travel time perception in a suburban environment,Travel Behaviour and Society
smartphone_memory,Forensic analysis of social networking applications on mobile devices,Digital Investigation
smartphone_memory,Do pre-schoolers with high touchscreen use show executive function differences?,Computers in Human Behavior
smartphone_memory,Does texting interrupt imitation learning in 19-month-old infants?,Infant Behavior and Development
smartphone_memory,Modelling the dynamics of customer requirements considering their lability and sensitivity in product development,Advanced Engineering Informatics
smartphone_memory,Cyclic behaviours of superelastic shape-memory alloy plates joined by tungsten inert gas welding,Construction and Building Materials
smartphone_memory,Modelling of Accelerometer Data for Travel Mode Detection by Hierarchical Application of Binomial Logistic Regression,Transportation Research Procedia
smartphone_memory,MADRAS-NET: A deep learning approach for detecting and classifying android malware using Linknet,Measurement: Sensors
smartphone_memory,Toward a hardware man-in-the-middle attack on PCIe bus,Microprocessors and Microsystems
smartphone_memory,Improved chimp optimization algorithm (ICOA) feature selection and deep neural network framework for internet of things (IOT) based android malware detection,Measurement: Sensors
smartphone_memory,HiNextApp: A context-aware and adaptive framework for app prediction in mobile systems,Sustainable Computing: Informatics and Systems
smartphone_memory,Blurring boundaries: Effects of device features on metacognitive evaluations,Computers in Human Behavior
smartphone_memory,Verbal memory measurement towards digital perspectives in first-episode psychosis: A review,Schizophrenia Research: Cognition
smartphone_memory,A disposable reader-sensor solution for wireless temperature logging,Device
smartphone_memory,Fingerprint recognition system based on modified multi-connect architecture (MMCA),Cognitive Systems Research
smartphone_memory,Mobile context inference using two-layered Bayesian networks for smartphones,Expert Systems with Applications
smartphone_memory,Temporal feature enhancement network with external memory for live-stream video object detection,Pattern Recognition
smartphone_memory,An efficient GPU-accelerated inference engine for binary neural network on mobile phones,Journal of Systems Architecture
smartphone_memory,Forensic analysis for AI speaker with display Echo Show 2nd generation as a case study,Forensic Science International: Digital Investigation
smartphone_memory,Chapter 7: Constraint-Aware Data Analysis on Mobile Devices: An Application to Human Activity Recognition on Smartphones,Adaptive Mobile Computing
smartphone_memory,Toward supervised shape-based behavioral authentication on smartphones,Journal of Information Security and Applications
smartphone_memory,Toward practical algorithms for activity chain optimization,Transportation Letters
smartphone_memory,SIMoP box – A smart intelligent mobile pill box,Materials Today: Proceedings
smartphone_memory,Technology use and subjective cognitive concerns in older adults,Archives of Gerontology and Geriatrics
smartphone_memory,Capturing significant events with neural networks,Neural Networks
smartphone_memory,Validation of the smartphone-based dietary assessment tool “Traqq” for assessing actual dietary intake by repeated 2-h recalls in adults: comparison with 24-h recalls and urinary biomarkers,The American Journal of Clinical Nutrition
smartphone_memory,"Secure authentication scheme to thwart RT MITM, CR MITM and malicious browser extension based phishing attacks",Journal of Information Security and Applications
smartphone_memory,Chapter 32: A design procedure for the development of VR platforms for the rehabilitation of patients after stroke,Digital Human Modeling and Medicine
smartphone_memory,Energy-efficient global illumination algorithms for mobile devices using dynamic voltage and frequency scaling,Computers & Graphics
smartphone_memory,Websocket to Support Real Time Smart Home Applications,Procedia Computer Science
smartphone_memory,Strategic use of reminders in an ‘intention offloading’ task: Do individuals with autism spectrum conditions compensate for memory difficulties?,Neuropsychologia
smartphone_memory,Quantization Friendly MobileNet (QF-MobileNet) Architecture for Vision Based Applications on Embedded Platforms,Neural Networks
smartphone_memory,Efficient Gait Analysis Using Deep Learning Techniques,"Computers, Materials and Continua"
smartphone_memory,R-R interval-based sleep apnea screening by a recurrent neural network in a large clinical polysomnography dataset,Clinical Neurophysiology
smartphone_memory,Interface and interaction design: How mobile touch devices foster cognitive offloading,Computers in Human Behavior
smartphone_memory,An efficient method for physical fields mapping through crowdsensing,Pervasive and Mobile Computing
smartphone_memory,Neural Processing During Fear Extinction Predicts Intrusive Memories,Biological Psychiatry: Cognitive Neuroscience and Neuroimaging
smartphone_memory,A wireless point-of-care testing system for the detection of neuron-specific enolase with microfluidic paper-based analytical devices,Biosensors and Bioelectronics
smartphone_memory,Summarizing large scale 3D mesh for urban navigation,Robotics and Autonomous Systems
smartphone_memory,COVID-19 cough classification using machine learning and global smartphone recordings,Computers in Biology and Medicine
smartphone_memory,Agent-based broadcast protocols for wireless heterogeneous node networks,Computer Communications
smartphone_memory,The memory-experience gap for PTSD symptoms: The correspondence between experience sampling and past month retrospective reports of traumatic stress symptoms,Psychiatry Research
smartphone_memory,Behavioral correlates of changes in hippocampal gray matter structure during acquisition of foreign vocabulary,NeuroImage
smartphone_memory,Dynamic power management of DRAM using accessed physical addresses,Microprocessors and Microsystems
smartphone_memory,Privacy enabled driver behavior analysis in heterogeneous IoV using federated learning,Engineering Applications of Artificial Intelligence
smartphone_memory,Key-hiding on the ARM platform,Digital Investigation
smartphone_memory,Convergence of real-time and retrospective assessments: A systematic investigation of naturally occurring and experimentally induced intrusions,Journal of Behavior Therapy and Experimental Psychiatry
smartphone_memory,Improved pipelined wavelet implementation for filtering ECG signals,Pattern Recognition Letters
smartphone_memory,Screen media technology and ADHD in children and adolescents: Potential perils and emerging opportunities,Encyclopedia of Child and Adolescent Health
smartphone_memory,How resource utilization influences UI responsiveness of Android software,Information and Software Technology
smartphone_memory,Flexible tag datalogger for food logistics,Sensors and Actuators A: Physical
smartphone_memory,Relative validity of a mobile AI-technology–assisted dietary assessment in adolescent females in Vietnam,The American Journal of Clinical Nutrition
smartphone_memory,Flexible Tag Datalogger for Food Logistics,Procedia Chemistry
smartphone_memory,RESTful Web Services improve the efficiency of data transfer of a whole-farm simulator accessed by Android smartphones,Computers and Electronics in Agriculture
smartphone_memory,Condensed internet-delivered prolonged exposure provided soon after trauma: A randomised pilot trial,Internet Interventions
smartphone_memory,WISNet: A deep neural network based human activity recognition system,Expert Systems with Applications
smartphone_memory,Polar contrast attention and skip cross-channel aggregation for efficient learning in U-Net,Computers in Biology and Medicine
smartphone_memory,"Synthesis, performance, and application of molecularly imprinted membranes: A review",Journal of Environmental Chemical Engineering
smartphone_memory,Readiness for mHealth interventions in Jordan: Refugee camp and urban community survey,Internet Interventions
