keyword,title,publication,matched_venue,remain,analyzed
mobile_performance,“Inconsistent Performance”: Understanding Concerns of Real-World Users on Smart Mobile Health Applications Through Analyzing App Reviews,UIST '22 Adjunct: Adjunct Proceedings of the 35th Annual ACM Symposium on User Interface Software and Technology,ist ,no,not in venue list
mobile_performance,On the Impact of the Critical CSS Technique on the Performance and Energy Consumption of Mobile Browsers,EASE '22: Proceedings of the 26th International Conference on Evaluation and Assessment in Software Engineering,"ase 
ease 
international conference on evaluation and assessment in software engineering",yes,only target problem
mobile_performance,Performance bottlenecks identification in cloudified mobile networks,MobiCom '20: Proceedings of the 26th Annual International Conference on Mobile Computing and Networking,"mobicom 
international conference on mobile computing and networking",no,no need
mobile_performance,"Global mobile network aggregators: taxonomy, roaming performance and optimization","MobiSys '22: Proceedings of the 20th Annual International Conference on Mobile Systems, Applications and Services","mobisys 
international conference on mobile systems, applications and services",no,no need
mobile_performance,Investigating the Correlation between Performance Scores and Energy Consumption of Mobile Web Apps,EASE '20: Proceedings of the 24th International Conference on Evaluation and Assessment in Software Engineering,"ase 
ease 
international conference on evaluation and assessment in software engineering",no,no need
mobile_performance,An In-depth Analysis of the Impact of Battery Usage Patterns on Performance of Task Allocation Algorithms in Sparse Mobile Crowdsensing,"MSWIM '19: Proceedings of the 22nd International ACM Conference on Modeling, Analysis and Simulation of Wireless and Mobile Systems",mswim ,no,no need
mobile_performance,Session details: PAPER SESSION 8: Mobile Performance,"MobiSys '17: Proceedings of the 15th Annual International Conference on Mobile Systems, Applications, and Services",mobisys ,no,no need
mobile_performance,"Communications-based Formation Control of Mobile Robots: Modeling, Analysis and Performance Evaluation","MSWiM '20: Proceedings of the 23rd International ACM Conference on Modeling, Analysis and Simulation of Wireless and Mobile Systems",mswim ,no,no need
mobile_performance,Improved Mobile Robot Programming Performance through Real-time Program Assessment,ITiCSE '17: Proceedings of the 2017 ACM Conference on Innovation and Technology in Computer Science Education,icse ,no,not in venue list
mobile_performance,"A Method and a Tool for Commercial Performance Evaluation of a Company: The case of a ""Mobile Telephony Operator""",ICIST '20: Proceedings of the 10th International Conference on Information Systems and Technologies,ist ,no,not in venue list
mobile_performance,Romou: rapidly generate high-performance tensor kernels for mobile GPUs,MobiCom '22: Proceedings of the 28th Annual International Conference on Mobile Computing And Networking,"mobicom 
international conference on mobile computing and networking",no,no need
mobile_performance,Rethinking Energy-Performance Trade-Off in Mobile Web Page Loading,MobiCom '15: Proceedings of the 21st Annual International Conference on Mobile Computing and Networking,"mobicom 
international conference on mobile computing and networking",no,no need
mobile_performance,Performance Evaluation of a Wireless Network using a VoIP Traffic Generator on a Mobile Device,SAICSIT '14: Proceedings of the Southern African Institute for Computer Scientist and Information Technologists Annual Conference 2014 on SAICSIT 2014 Empowered by Technology,ist ,no,not in venue list
mobile_performance,Mobile-Health Tool Use and Community Health Worker Performance in the Kenyan Context: A Task-Technology Fit Perspective,SAICSIT '14: Proceedings of the Southern African Institute for Computer Scientist and Information Technologists Annual Conference 2014 on SAICSIT 2014 Empowered by Technology,ist ,no,not in venue list
mobile_performance,Mobile network performance evaluation using the radio frequency network channel emulation simulation tool(RFnest™),MobiCom '13: Proceedings of the 19th annual international conference on Mobile computing & networking,mobicom ,no,no need
mobile_performance,Handover performance in the IEEE 802.16 mobile networks,SIMUTools '10: Proceedings of the 3rd International ICST Conference on Simulation Tools and Techniques,icst ,no,not in venue list
mobile_performance,Design and performance evaluation of an energy-aware scheduling framework for mobile WiMAX,"MSWIM '10: Proceedings of the 13th ACM international conference on Modeling, analysis, and simulation of wireless and mobile systems",mswim ,no,no need
mobile_performance,Delay-throughput performance in mobile ad-hoc networks with heterogeneous nodes,"MSWiM '09: Proceedings of the 12th ACM international conference on Modeling, analysis and simulation of wireless and mobile systems",mswim ,no,no need
mobile_performance,Performance assertions for mobile devices,ISSTA '06: Proceedings of the 2006 international symposium on Software testing and analysis,"issta 
international symposium on software testing and analysis",no,no need
mobile_performance,ZIPT: Zero-Integration Performance Testing of Mobile App Designs,UIST '17: Proceedings of the 30th Annual ACM Symposium on User Interface Software and Technology,ist ,no,not in venue list
mobile_performance,Poster: Application-Layer Optimization of Performance vs Energy in Mobile Network I/O,"MobiSys '17: Proceedings of the 15th Annual International Conference on Mobile Systems, Applications, and Services",mobisys ,no,no need
mobile_performance,Performance analysis of the mobile IP fast authentication protocol,"MSWiM '04: Proceedings of the 7th ACM international symposium on Modeling, analysis and simulation of wireless and mobile systems",mswim ,no,no need
mobile_performance,UML based modeling and performance analysis of mobile systems,"MSWiM '04: Proceedings of the 7th ACM international symposium on Modeling, analysis and simulation of wireless and mobile systems",mswim ,no,no need
mobile_performance,Performance evaluation of a streaming based protocol for 3D virtual environment exploration on mobile devices,MSWiM '06: Proceedings of the 9th ACM international symposium on Modeling analysis and simulation of wireless and mobile systems,mswim ,no,no need
mobile_performance,Improving TCP performance over wireless networks with collaborative multi-homed mobile hosts,"MobiSys '05: Proceedings of the 3rd international conference on Mobile systems, applications, and services",mobisys ,no,no need
mobile_performance,Improving TCP performance over mobile ad hoc networks by exploiting cross-layer information awareness,MobiCom '04: Proceedings of the 10th annual international conference on Mobile computing and networking,"mobicom 
international conference on mobile computing and networking",no,no need
mobile_performance,Performance analysis of optimized smooth handoff in mobile IP,MSWiM '02: Proceedings of the 5th ACM international workshop on Modeling analysis and simulation of wireless and mobile systems,mswim ,no,no need
mobile_performance,The performance impact of traffic patterns on routing protocols in mobile ad hoc networks,"MSWiM '04: Proceedings of the 7th ACM international symposium on Modeling, analysis and simulation of wireless and mobile systems",mswim ,no,no need
mobile_performance,Performance evaluation of mobile wireless networks: a new perspective,"MSWIM '01: Proceedings of the 4th ACM international workshop on Modeling, analysis and simulation of wireless and mobile systems",mswim ,no,no need
mobile_performance,Demo: Mapping global mobile performance trends with mobilyzer and mobiPerf,"MobiSys '14: Proceedings of the 12th annual international conference on Mobile systems, applications, and services",mobisys ,no,no need
mobile_performance,Multi-hop mobile wireless network design: implicit cross-layer loss models and performance sensitivities,MobiCom '08: Proceedings of the 14th ACM international conference on Mobile computing and networking,"mobicom 
international conference on mobile computing and networking",no,no need
mobile_performance,Improving TCP performance over mobile ad-hoc networks with out-of-order detection and response,MobiHoc '02: Proceedings of the 3rd ACM international symposium on Mobile ad hoc networking & computing,mobihoc ,no,no need
mobile_performance,Analysis of TCP performance over mobile ad hoc networks,MobiCom '99: Proceedings of the 5th annual ACM/IEEE international conference on Mobile computing and networking,"mobicom 
international conference on mobile computing and networking",no,no need
mobile_performance,A comparison of TCP performance over three routing protocols for mobile ad hoc networks,MobiHoc '01: Proceedings of the 2nd ACM international symposium on Mobile ad hoc networking & computing,mobihoc ,no,no need
mobile_performance,Evaluating the performance of mobile agent-based message communication among mobile hosts in large ad hoc wireless network,"MSWiM '99: Proceedings of the 2nd ACM international workshop on Modeling, analysis and simulation of wireless and mobile systems",mswim ,no,no need
mobile_performance,Performance analysis of mobile agents for filtering data streams on wireless networks,"MSWIM '00: Proceedings of the 3rd ACM international workshop on Modeling, analysis and simulation of wireless and mobile systems",mswim ,no,no need
mobile_performance,"PROTEUS: network performance forecast for real-time, interactive mobile applications","MobiSys '13: Proceeding of the 11th annual international conference on Mobile systems, applications, and services",mobisys ,no,no need
mobile_performance,"System and process modelling for design, management and performance evaluation of present and future mobile networks","MSWIM '01: Proceedings of the 4th ACM international workshop on Modeling, analysis and simulation of wireless and mobile systems",mswim ,no,no need
mobile_performance,Scenario-based performance analysis of routing protocols for mobile ad-hoc networks,MobiCom '99: Proceedings of the 5th annual ACM/IEEE international conference on Mobile computing and networking,"mobicom 
international conference on mobile computing and networking",no,no need
mobile_performance,Performance comparison of mobile support strategies,MobiCom '95: Proceedings of the 1st annual international conference on Mobile computing and networking,"mobicom 
international conference on mobile computing and networking",no,no need
mobile_performance,Poster: collective mobile sensing for wireless network performance monitoring,"MobiSys '11: Proceedings of the 9th international conference on Mobile systems, applications, and services",mobisys ,no,no need
mobile_performance,CTG: a connectivity trace generator for testing the performance of opportunistic mobile systems,ESEC-FSE '07: Proceedings of the the 6th joint meeting of the European software engineering conference and the ACM SIGSOFT symposium on The foundations of software engineering,fse ,no,no need
smartphone_energy,"BaMbI, a battery free and energy harvesting smartphone","MobiSys '22: Proceedings of the 20th Annual International Conference on Mobile Systems, Applications and Services","mobisys 
international conference on mobile systems, applications and services",no,no need
smartphone_energy,"Smartphone Background Activities in the Wild: Origin, Energy Drain, and Optimization",MobiCom '15: Proceedings of the 21st Annual International Conference on Mobile Computing and Networking,"mobicom 
international conference on mobile computing and networking",no,no need
smartphone_energy,Performance-Energy Trade-offs in Smartphones,"MSWiM '16: Proceedings of the 19th ACM International Conference on Modeling, Analysis and Simulation of Wireless and Mobile Systems",mswim ,no,no need
smartphone_energy,Energy-delay tradeoffs in smartphone applications,"MobiSys '10: Proceedings of the 8th international conference on Mobile systems, applications, and services",mobisys ,no,no need
smartphone_energy,Flexible And Effective Energy Management In Smartphones,PhDForum '15: Proceedings of the 2015 on MobiSys PhD Forum,mobisys ,no,no need
smartphone_energy,Making web applications more energy efficient for OLED smartphones,ICSE 2014: Proceedings of the 36th International Conference on Software Engineering,"icse
international conference on software engineering",yes,only target problem
smartphone_energy,Energy-efficient positioning for smartphones using Cell-ID sequence matching,"MobiSys '11: Proceedings of the 9th international conference on Mobile systems, applications, and services",mobisys ,no,no need
smartphone_energy,Where is the energy spent inside my app?: fine grained energy accounting on smartphones with Eprof,EuroSys '12: Proceedings of the 7th ACM european conference on Computer Systems,eurosys ,yes,yes
smartphone_energy,Improving energy efficiency of location sensing on smartphones,"MobiSys '10: Proceedings of the 8th international conference on Mobile systems, applications, and services",mobisys ,no,no need
smartphone_energy,Energy-efficient rate-adaptive GPS-based positioning for smartphones,"MobiSys '10: Proceedings of the 8th international conference on Mobile systems, applications, and services",mobisys ,no,no need
smartphone_energy,Poster: Energy-efficient Web Browsing in Smartphones,"MobiSys '16 Companion: Proceedings of the 14th Annual International Conference on Mobile Systems, Applications, and Services Companion",mobisys ,no,no need
smartphone_energy,What is keeping my phone awake?: characterizing and detecting no-sleep energy bugs in smartphone apps,"MobiSys '12: Proceedings of the 10th international conference on Mobile systems, applications, and services",mobisys ,yes,yes
smartphone_energy,Wireless wakeups revisited: energy management for voip over wi-fi smartphones,"MobiSys '07: Proceedings of the 5th international conference on Mobile systems, applications and services","mobisys 
international conference on mobile systems, applications and services",no,no need
mobile_latency,Low Latency Mobile Augmented Reality with Flexible Tracking,MobiCom '18: Proceedings of the 24th Annual International Conference on Mobile Computing and Networking,"mobicom 
international conference on mobile computing and networking",no,no need
mobile_latency,RemoteGL - Towards Low-latency Interactive Cloud Graphics Experience for Mobile Devices (demo),"MobiSys '19: Proceedings of the 17th Annual International Conference on Mobile Systems, Applications, and Services",mobisys ,no,no need
mobile_latency,Latency Adaptive Streaming of 8K 360 Degree Video to Mobile VR Headsets (demo),"MobiSys '19: Proceedings of the 17th Annual International Conference on Mobile Systems, Applications, and Services",mobisys ,no,no need
mobile_latency,Mitigating the Latency-Accuracy Trade-off in Mobile Data Analytics Systems,MobiCom '18: Proceedings of the 24th Annual International Conference on Mobile Computing and Networking,"mobicom 
international conference on mobile computing and networking",no,no need
mobile_latency,Leveraging program analysis to reduce user-perceived latency in mobile applications,ICSE '18: Proceedings of the 40th International Conference on Software Engineering,"icse 
international conference on software engineering",yes,only target problem
mobile_latency,Tutti: coupling 5G RAN and mobile edge computing for latency-critical video analytics,MobiCom '22: Proceedings of the 28th Annual International Conference on Mobile Computing And Networking,"mobicom 
international conference on mobile computing and networking",no,no need
mobile_latency,mGEMM: low-latency convolution with minimal memory overhead optimized for mobile devices,"MobiSys '22: Proceedings of the 20th Annual International Conference on Mobile Systems, Applications and Services","mobisys 
international conference on mobile systems, applications and services",no,no need
mobile_latency,Latency-optimized broadcast in mobile ad hoc networks without node coordination,MobiHoc '14: Proceedings of the 15th ACM international symposium on Mobile ad hoc networking and computing,"mobihoc 
mobile ad hoc networking and computing",no,no need
mobile_latency,On the latency for information dissemination in mobile wireless networks,MobiHoc '08: Proceedings of the 9th ACM international symposium on Mobile ad hoc networking and computing,"mobihoc 
mobile ad hoc networking and computing",no,no need
mobile_latency,Poster: Edge-cloud Enhancement -- Latency-aware Virtual Cluster Placement for Supporting Cloud Applications in Mobile Edge Networks,MobiCom '19: The 25th Annual International Conference on Mobile Computing and Networking,"mobicom 
international conference on mobile computing and networking",no,no need
mobile_latency,A comparison of mechanisms for improving mobile IP handoff latency for end-to-end TCP,MobiCom '03: Proceedings of the 9th annual international conference on Mobile computing and networking,"mobicom 
international conference on mobile computing and networking",no,no need
mobile_latency,A scalable low-latency cache invalidation strategy for mobile environments,MobiCom '00: Proceedings of the 6th annual international conference on Mobile computing and networking,"mobicom 
international conference on mobile computing and networking",no,no need
mobile_latency,Demo: DeLorean: using speculation to enable low-latency continuous interaction for mobile cloud gaming,"MobiSys '14: Proceedings of the 12th annual international conference on Mobile systems, applications, and services",mobisys ,no,no need
smartphone_battery,How much battery does dark mode save?: an accurate OLED display power profiler for modern smartphones,"MobiSys '21: Proceedings of the 19th Annual International Conference on Mobile Systems, Applications, and Services",mobisys ,no,no need
smartphone_battery,Demo: Wireless Link Selection on Smartphone: Throughput vs Battery Drain,MobiCom '15: Proceedings of the 21st Annual International Conference on Mobile Computing and Networking,"mobicom 
international conference on mobile computing and networking",no,no need
mobile_gpu,A GPU-enabled mobile telemedicine training system for graphic rendering,MobiCom '22: Proceedings of the 28th Annual International Conference on Mobile Computing And Networking,"mobicom 
international conference on mobile computing and networking",no,no need
mobile_gpu,Pantheon: Preemptible Multi-DNN Inference on Mobile Edge GPUs,"MOBISYS '24: Proceedings of the 22nd Annual International Conference on Mobile Systems, Applications and Services","mobisys 
international conference on mobile systems, applications and services",no,no need
mobile_gpu,GPU based High Definition Parallel Video Codec Optimization in Mobile Device,MobiCom '18: Proceedings of the 24th Annual International Conference on Mobile Computing and Networking,"mobicom 
international conference on mobile computing and networking",no,no need
mobile_gpu,Accelerating Mobile Audio Sensing Algorithms through On-Chip GPU Offloading,"MobiSys '17: Proceedings of the 15th Annual International Conference on Mobile Systems, Applications, and Services",mobisys ,no,no need
mobile_gpu,CoDL: efficient CPU-GPU co-execution for deep learning inference on mobile devices,"MobiSys '22: Proceedings of the 20th Annual International Conference on Mobile Systems, Applications and Services","mobisys 
international conference on mobile systems, applications and services",no,no need
mobile_gpu,Heimdall: mobile GPU coordination platform for augmented reality applications,MobiCom '20: Proceedings of the 26th Annual International Conference on Mobile Computing and Networking,"mobicom 
international conference on mobile computing and networking",no,no need
mobile_gpu,LiteReconfig: cost and content aware reconfiguration of video object detection systems for mobile GPUs,EuroSys '22: Proceedings of the Seventeenth European Conference on Computer Systems,eurosys ,no,no need
mobile_gpu,DeepMon: Mobile GPU-based Deep Learning Framework for Continuous Vision Applications,"MobiSys '17: Proceedings of the 15th Annual International Conference on Mobile Systems, Applications, and Services",mobisys ,no,no need
mobile_gpu,Demo: DeepMon: Building Mobile GPU Deep Learning Models for Continuous Vision Applications,"MobiSys '17: Proceedings of the 15th Annual International Conference on Mobile Systems, Applications, and Services",mobisys ,no,no need
mobile_gpu,Kahawai: High-Quality Mobile Gaming Using GPU Offload,"MobiSys '15: Proceedings of the 13th Annual International Conference on Mobile Systems, Applications, and Services",mobisys ,no,no need
mobile_gpu,Demo: GPU-based Image Recognition and Object Detection on Commodity Mobile Devices,"MobiSys '16 Companion: Proceedings of the 14th Annual International Conference on Mobile Systems, Applications, and Services Companion",mobisys ,no,no need
mobile_gpu,Demo: Kahawai: high-quality mobile gaming using GPU offload,"MobiSys '14: Proceedings of the 12th annual international conference on Mobile systems, applications, and services",mobisys ,no,no need
mobile_gpu,Poster: towards mobile GPU-accelerated context processing for continuous sensing applications on smartphones,"MobiSys '12: Proceedings of the 10th international conference on Mobile systems, applications, and services",mobisys ,no,no need
mobile_cpu,ConvReLU++: Reference-based Lossless Acceleration of Conv-ReLU Operations on Mobile CPU,"MobiSys '23: Proceedings of the 21st Annual International Conference on Mobile Systems, Applications and Services","mobisys 
international conference on mobile systems, applications and services",no,no need
mobile_cpu,AsyMo: scalable and efficient deep-learning inference on asymmetric mobile CPUs,MobiCom '21: Proceedings of the 27th Annual International Conference on Mobile Computing and Networking,"mobicom 
international conference on mobile computing and networking",no,no need
android_energy,E-MANAFA: Energy Monitoring and ANAlysis tool For Android,ASE '22: Proceedings of the 37th IEEE/ACM International Conference on Automated Software Engineering,"ase 
automated software engineering",no,no need
android_energy,ecoCode: a SonarQube Plugin to Remove Energy Smells from Android Projects,ASE '22: Proceedings of the 37th IEEE/ACM International Conference on Automated Software Engineering,"ase 
automated software engineering",yes,yes
android_energy,A black box technique to reduce energy consumption of Android apps,ICSE-NIER '22: Proceedings of the ACM/IEEE 44th International Conference on Software Engineering: New Ideas and Emerging Results,international conference on software engineering,no,bytecode level
android_energy,Comparing the Energy Efficiency of WebAssembly and JavaScript in Web Applications on Android Mobile Devices,EASE '22: Proceedings of the 26th International Conference on Evaluation and Assessment in Software Engineering,"ase 
ease 
international conference on evaluation and assessment in software engineering",yes,only target problem
android_energy,Automated construction of energy test oracles for Android,ESEC/FSE 2020: Proceedings of the 28th ACM Joint Meeting on European Software Engineering Conference and Symposium on the Foundations of Software Engineering,"esec/fse 
fse ",yes,yes
android_energy,Search-based energy testing of Android,ICSE '19: Proceedings of the 41st International Conference on Software Engineering,"icse 
international conference on software engineering",yes,yes
android_energy,Detection of energy inefficiencies in Android wear watch faces,ESEC/FSE 2018: Proceedings of the 2018 26th ACM Joint Meeting on European Software Engineering Conference and Symposium on the Foundations of Software Engineering,"esec/fse 
fse ",no,no need
android_energy,Multi-Objective Optimization of Energy Consumption of GUIs in Android Apps,"ACM Transactions on Software Engineering and Methodology (TOSEM), Volume 27, Issue 3","transactions on software engineering
transactions on software engineering and methodology",yes,only target problem
android_energy,µDroid: an energy-aware mutation testing framework for Android,ESEC/FSE 2017: Proceedings of the 2017 11th Joint Meeting on Foundations of Software Engineering,"esec/fse 
fse ",yes,only target problem
android_energy,Measuring and optimizing android smartwatch energy consumption: poster,MobiCom '16: Proceedings of the 22nd Annual International Conference on Mobile Computing and Networking,"mobicom 
international conference on mobile computing and networking",no,no need
android_energy,Energy-aware test-suite minimization for Android apps,ISSTA 2016: Proceedings of the 25th International Symposium on Software Testing and Analysis,"issta 
international symposium on software testing and analysis",yes,yes
android_energy,A study on the energy consumption of Android app development approaches,MSR '17: Proceedings of the 14th International Conference on Mining Software Repositories,msr ,yes,only target problem
android_energy,Improving energy consumption in Android apps,ESEC/FSE 2015: Proceedings of the 2015 10th Joint Meeting on Foundations of Software Engineering,"esec/fse 
fse ",yes,yes
android_energy,The accuracy of Android energy measurements for offloading computational expensive tasks: poster,MobiHoc '16: Proceedings of the 17th ACM International Symposium on Mobile Ad Hoc Networking and Computing,"mobihoc 
mobile ad hoc networking and computing",no,no need
android_energy,Optimizing energy consumption of GUIs in Android apps: a multi-objective approach,ESEC/FSE 2015: Proceedings of the 2015 10th Joint Meeting on Foundations of Software Engineering,"esec/fse 
fse ",yes,only target problem
