keyword,title,publication,matched_venue,remain,analyzed
android_energy,Calculating source line level energy information for Android applications,ISSTA 2013: Proceedings of the 2013 International Symposium on Software Testing and Analysis,"issta 
international symposium on software testing and analysis",no,no need
android_energy,Mining energy-greedy API usage patterns in Android apps: an empirical study,MSR 2014: Proceedings of the 11th Working Conference on Mining Software Repositories,msr ,yes,yes
android_energy,GreenHub farmer: real-world data for Android energy mining,MSR '19: Proceedings of the 16th International Conference on Mining Software Repositories,msr ,no,not performance issue analysis
android_energy,"GreenSource: a large-scale collection of Android code, tests and energy metrics",MSR '19: Proceedings of the 16th International Conference on Mining Software Repositories,msr ,no,not performance issue analysis
android_energy,GEMMA: multi-objective optimization of energy consumption of GUIs in Android apps,ICSE-C '17: Proceedings of the 39th International Conference on Software Engineering Companion,international conference on software engineering,yes,yes
android_energy,PETrA: a software-based tool for estimating the energy profile of Android applications,ICSE-C '17: Proceedings of the 39th International Conference on Software Engineering Companion,international conference on software engineering,no,no need
android_energy,Poster: a smart scheduling mechanism for energy saving in android system,"MobiSys '12: Proceedings of the 10th international conference on Mobile systems, applications, and services",mobisys ,no,no need
android_energy,Poster: an energy profiler for android applications used in the real world,"MobiSys '12: Proceedings of the 10th international conference on Mobile systems, applications, and services",mobisys ,no,no need
phone_memory,Imaginary phone: learning imaginary interfaces by transferring spatial memory from a familiar device,UIST '11: Proceedings of the 24th annual ACM symposium on User interface software and technology,ist ,no,not in venue list
mobile_energy,"SERENUS: Alleviating Low-Battery Anxiety Through Real-time, Accurate, and User-Friendly Energy Consumption Prediction of Mobile Applications",UIST '24: Proceedings of the 37th Annual ACM Symposium on User Interface Software and Technology,ist ,no,not in venue list
mobile_energy,Combatting Energy Issues for Mobile Applications,"ACM Transactions on Software Engineering and Methodology (TOSEM), Volume 32, Issue 1","transactions on software engineering
transactions on software engineering and methodology",yes,yes
mobile_energy,Cost-Effective Strategies for Building Energy Efficient Mobile Applications,ICSE '23: Proceedings of the 45th International Conference on Software Engineering: Companion Proceedings,"icse 
international conference on software engineering",yes,yes
mobile_energy,EEFL: High-Speed Wireless Communications Inspired Energy Efficient Federated Learning over Mobile Devices,"MobiSys '23: Proceedings of the 21st Annual International Conference on Mobile Systems, Applications and Services","mobisys 
international conference on mobile systems, applications and services",no,no need
mobile_energy,eGEN: an energy-saving modeling language and code generator for location-sensing of mobile apps,ESEC/FSE 2022: Proceedings of the 30th ACM Joint European Software Engineering Conference and Symposium on the Foundations of Software Engineering,"esec/fse 
fse ",no,no need
mobile_energy,Detecting and diagnosing energy issues for mobile applications,ISSTA 2020: Proceedings of the 29th ACM SIGSOFT International Symposium on Software Testing and Analysis,"issta 
international symposium on software testing and analysis",yes,yes
mobile_energy,Impact of programming languages on energy consumption for mobile devices,ESEC/FSE 2020: Proceedings of the 28th ACM Joint Meeting on European Software Engineering Conference and Symposium on the Foundations of Software Engineering,"esec/fse 
fse ",no,not performance issue
mobile_energy,Optimizing Energy Efficiency of Browsers in Energy-Aware Scheduling-enabled Mobile Devices,MobiCom '19: The 25th Annual International Conference on Mobile Computing and Networking,"mobicom 
international conference on mobile computing and networking",no,no need
mobile_energy,Stochastic energy optimization for mobile GPS applications,ESEC/FSE 2018: Proceedings of the 2018 26th ACM Joint Meeting on European Software Engineering Conference and Symposium on the Foundations of Software Engineering,"esec/fse 
fse ",no,no need
mobile_energy,Measuring the energy footprint of mobile testing frameworks,ICSE '18: Proceedings of the 40th International Conference on Software Engineering: Companion Proceeedings,"icse 
international conference on software engineering",no,no need
mobile_energy,A Context-driven Energy Assessment for Energy-aware Development of Mobile Sensing Applications,Ph.D. Forum '17: Proceedings of the 2017 Workshop on MobiSys 2017 Ph.D. Forum,mobisys ,no,no need
mobile_energy,Advancing energy testing of mobile applications,ICSE-C '17: Proceedings of the 39th International Conference on Software Engineering Companion,international conference on software engineering,yes,yes
mobile_energy,Towards a framework for detecting energy drain in mobile applications: an architecture overview,ISSTA '18: Companion Proceedings for the ISSTA/ECOOP 2018 Workshops,issta ,no,no need
mobile_energy,Reducing energy consumption of resource-intensive scientific mobile applications via code refactoring,ICSE-C '17: Proceedings of the 39th International Conference on Software Engineering Companion,international conference on software engineering,no,no need
mobile_energy,Automated energy optimization of HTTP requests for mobile applications,ICSE '16: Proceedings of the 38th International Conference on Software Engineering,"icse 
international conference on software engineering",yes,yes
mobile_energy,Nyx: a display energy optimizer for mobile web apps,ESEC/FSE 2015: Proceedings of the 2015 10th Joint Meeting on Foundations of Software Engineering,"esec/fse 
fse ",no,no need
mobile_energy,Energy efficient multipath TCP for mobile devices,MobiHoc '14: Proceedings of the 15th ACM international symposium on Mobile ad hoc networking and computing,"mobihoc 
mobile ad hoc networking and computing",no,no need
mobile_energy,A Computing Profiling Procedure for Mobile Developers to Estimate Energy Cost,"MSWiM '15: Proceedings of the 18th ACM International Conference on Modeling, Analysis and Simulation of Wireless and Mobile Systems",mswim ,no,no need
mobile_energy,Detecting energy bugs and hotspots in mobile apps,FSE 2014: Proceedings of the 22nd ACM SIGSOFT International Symposium on Foundations of Software Engineering,fse ,yes,yes
mobile_energy,Maximizing Mobiles Energy Saving Through Tasks Optimal Offloading Placement in two-tier Cloud,"MSWIM '18: Proceedings of the 21st ACM International Conference on Modeling, Analysis and Simulation of Wireless and Mobile Systems",mswim ,no,no need
mobile_energy,Energy aware self-adaptation in mobile systems,ICSE '13: Proceedings of the 2013 International Conference on Software Engineering,"icse 
international conference on software engineering",no,no need
mobile_energy,Energy Efficient and Fair Management of Sensing Applications on Heterogeneous Resource Mobile Devices,PhDForum '15: Proceedings of the 2015 on MobiSys PhD Forum,mobisys ,no,no need
mobile_energy,Energy proportional image sensors for continuous mobile vision,"MobiSys '13: Proceeding of the 11th annual international conference on Mobile systems, applications, and services",mobisys ,no,no need
mobile_energy,Estimating mobile application energy consumption using program analysis,ICSE '13: Proceedings of the 2013 International Conference on Software Engineering,"icse 
international conference on software engineering",no,no need
mobile_energy,APE: an annotation language and middleware for energy-efficient mobile application development,ICSE 2014: Proceedings of the 36th International Conference on Software Engineering,"icse 
international conference on software engineering",yes,only target problem
mobile_energy,An energy efficient adaptive HELLO algorithm for mobile ad hoc networks,"MSWiM '13: Proceedings of the 16th ACM international conference on Modeling, analysis & simulation of wireless and mobile systems",mswim ,no,no need
mobile_energy,Energy characterization and optimization of image sensing toward continuous mobile vision,"MobiSys '13: Proceeding of the 11th annual international conference on Mobile systems, applications, and services",mobisys ,no,no need
mobile_energy,Energy-efficient trajectory tracking for mobile devices,"MobiSys '11: Proceedings of the 9th international conference on Mobile systems, applications, and services",mobisys ,no,no need
mobile_energy,Using OMNeT++ for energy optimization simulations in mobile core networks,SIMUTOOLS '12: Proceedings of the 5th International ICST Conference on Simulation Tools and Techniques,icst ,no,not in venue list
mobile_energy,Security versus energy tradeoffs in host-based mobile malware detection,"MobiSys '11: Proceedings of the 9th international conference on Mobile systems, applications, and services",mobisys ,no,no need
mobile_energy,Energy management in mobile devices with the cinder operating system,EuroSys '11: Proceedings of the sixth conference on Computer systems,eurosys ,no,no need
mobile_energy,EXPRESS: an energy-efficient and secure framework for mobile edge computing and blockchain based smart systems,ASE '20: Proceedings of the 35th IEEE/ACM International Conference on Automated Software Engineering,"ase 
automated software engineering",no,no need
mobile_energy,EMaaS: energy measurements as a service for mobile applications,ICSE-NIER '19: Proceedings of the 41st International Conference on Software Engineering: New Ideas and Emerging Results,international conference on software engineering,no,no need
mobile_energy,Self-constructive high-rate system energy modeling for battery-powered mobile systems,"MobiSys '11: Proceedings of the 9th international conference on Mobile systems, applications, and services",mobisys ,no,no need
mobile_energy,Energy-accuracy trade-off for continuous mobile device location,"MobiSys '10: Proceedings of the 8th international conference on Mobile systems, applications, and services",mobisys ,no,no need
mobile_energy,Middleware for energy-awareness in mobile devices,COMSWARE '09: Proceedings of the Fourth International ICST Conference on COMmunication System softWAre and middlewaRE,icst ,no,not in venue list
mobile_energy,Poster: Energy Efficient Mobile Video Transmission over Wireless Networks in IoT Applications,MobiCom '19: The 25th Annual International Conference on Mobile Computing and Networking,"mobicom 
international conference on mobile computing and networking",no,no need
mobile_energy,Detecting energy-greedy anomalies and mobile malware variants,"MobiSys '08: Proceedings of the 6th international conference on Mobile systems, applications, and services",mobisys ,no,no need
mobile_energy,On the limits of effective hybrid micro-energy harvesting on mobile CRFID sensors,"MobiSys '10: Proceedings of the 8th international conference on Mobile systems, applications, and services",mobisys ,no,no need
mobile_energy,EARMO: an energy-aware refactoring approach for mobile apps,ICSE '18: Proceedings of the 40th International Conference on Software Engineering,"icse 
international conference on software engineering",yes,yes
mobile_energy,A framework of energy efficient mobile sensing for automatic user state recognition,"MobiSys '09: Proceedings of the 7th international conference on Mobile systems, applications, and services",mobisys ,no,no need
mobile_energy,GfxDoctor: A Holistic Graphics Energy Profiler for Mobile Devices,EuroSys '17: Proceedings of the Twelfth European Conference on Computer Systems,eurosys ,no,no need
mobile_energy,Session details: Energy conservation for mobile devices,"MobiSys '04: Proceedings of the 2nd international conference on Mobile systems, applications, and services",mobisys ,no,no need
mobile_energy,Randomized energy aware routing algorithms in mobile ad hoc networks,"MSWiM '05: Proceedings of the 8th ACM international symposium on Modeling, analysis and simulation of wireless and mobile systems",mswim ,no,no need
mobile_energy,ConMap: A Novel Framework for Optimizing Multicast Energy in Delay-constrained Mobile Wireless Networks,Mobihoc '17: Proceedings of the 18th ACM International Symposium on Mobile Ad Hoc Networking and Computing,"mobihoc 
mobile ad hoc networking and computing",no,no need
mobile_energy,Constructing minimum energy mobile wireless networks,MobiHoc '01: Proceedings of the 2nd ACM international symposium on Mobile ad hoc networking & computing,mobihoc ,no,no need
mobile_energy,Poster: ETRACK: Energy Efficient Tracking a Mobile Object Using Under Water Sensors,"MobiSys '16 Companion: Proceedings of the 14th Annual International Conference on Mobile Systems, Applications, and Services Companion",mobisys ,no,no need
mobile_energy,Energy-Adaptive Display System Designs for Future Mobile Environments,"MobiSys '03: Proceedings of the 1st international conference on Mobile systems, applications and services","mobisys 
international conference on mobile systems, applications and services",no,no need
mobile_energy,RnB: rate and brightness adaptation for rate-distortion-energy tradeoff in HTTP adaptive streaming over mobile devices,MobiCom '16: Proceedings of the 22nd Annual International Conference on Mobile Computing and Networking,"mobicom 
international conference on mobile computing and networking",no,no need
mobile_energy,Poster: Extremely Parallel Resource Pre-Fetching for Energy Optimized Mobile Web Browsing,MobiCom '15: Proceedings of the 21st Annual International Conference on Mobile Computing and Networking,"mobicom 
international conference on mobile computing and networking",no,no need
mobile_energy,Poster: bPart - A Small and Versatile Bluetooth Low Energy Sensor Platform for Mobile Sensing,"MobiSys '15: Proceedings of the 13th Annual International Conference on Mobile Systems, Applications, and Services",mobisys ,no,no need
mobile_energy,Tracko: Ad-hoc Mobile 3D Tracking Using Bluetooth Low Energy and Inaudible Signals for Cross-Device Interaction,UIST '15: Proceedings of the 28th Annual ACM Symposium on User Interface Software & Technology,ist ,no,not in venue list
mobile_energy,Demo: sesame: self-constructive system energy modeling for battery-powered mobile systems,"MobiSys '11: Proceedings of the 9th international conference on Mobile systems, applications, and services",mobisys ,no,no need
mobile_energy,Poster: energy consumption impact of UHF RFID reader integration with mobile phones,"MobiSys '11: Proceedings of the 9th international conference on Mobile systems, applications, and services",mobisys ,no,no need
mobile_energy,EnTracked: energy-efficient robust position tracking for mobile devices,"MobiSys '09: Proceedings of the 7th international conference on Mobile systems, applications, and services",mobisys ,no,no need
mobile_energy,Catnap: exploiting high bandwidth wireless interfaces to save energy for mobile devices,"MobiSys '10: Proceedings of the 8th international conference on Mobile systems, applications, and services",mobisys ,no,no need
mobile_energy,Demo: e-gesture - a collaborative architecture for energy-efficient gesture recognition with hand-worn sensor and mobile devices,"MobiSys '11: Proceedings of the 9th international conference on Mobile systems, applications, and services",mobisys ,no,no need
mobile_energy,SeeMon: scalable and energy-efficient context monitoring framework for sensor-rich mobile environments,"MobiSys '08: Proceedings of the 6th international conference on Mobile systems, applications, and services",mobisys ,no,no need
mobile_energy,Dali: a communication-centric data abstraction layer for energy-constrained devices in mobile sensor networks,"MobiSys '07: Proceedings of the 5th international conference on Mobile systems, applications and services","mobisys 
international conference on mobile systems, applications and services",no,no need
mobile_battery,MixMax: Leveraging Heterogeneous Batteries to Alleviate Low Battery Experience for Mobile Users,"MobiSys '23: Proceedings of the 21st Annual International Conference on Mobile Systems, Applications and Services","mobisys 
international conference on mobile systems, applications and services",no,no need
mobile_battery,Battery-aware transformations in mobile applications,ASE '16: Proceedings of the 31st IEEE/ACM International Conference on Automated Software Engineering,"ase 
automated software engineering",yes,only target problem
mobile_resource,Resource Allocation for Stable LLM Training in Mobile Edge Computing,"MOBIHOC '24: Proceedings of the Twenty-fifth International Symposium on Theory, Algorithmic Foundations, and Protocol Design for Mobile Networks and Mobile Computing",mobihoc ,no,no need
mobile_resource,Resource Allocation and Secure Wireless Communication in the Large Model based Mobile Edge Computing System,"MOBIHOC '24: Proceedings of the Twenty-fifth International Symposium on Theory, Algorithmic Foundations, and Protocol Design for Mobile Networks and Mobile Computing",mobihoc ,no,no need
mobile_resource,Analyzing the Resource Usage Overhead of Mobile App Development Frameworks,EASE '23: Proceedings of the 27th International Conference on Evaluation and Assessment in Software Engineering,"ase 
ease 
international conference on evaluation and assessment in software engineering",no,no need
mobile_resource,ICE: Collaborating Memory and Process Management for User Experience on Resource-limited Mobile Devices,EuroSys '23: Proceedings of the Eighteenth European Conference on Computer Systems,eurosys ,no,no need
mobile_resource,Fair multi-resource allocation in mobile edge computing with multiple access points,"Mobihoc '20: Proceedings of the Twenty-First International Symposium on Theory, Algorithmic Foundations, and Protocol Design for Mobile Networks and Mobile Computing",mobihoc ,no,no need
mobile_resource,Towards Opportunistic Resource Sharing in Mobile Social Networks: an Evolutionary Game Theoretic Approach,Mobihoc '18: Proceedings of the Eighteenth ACM International Symposium on Mobile Ad Hoc Networking and Computing,"mobihoc 
mobile ad hoc networking and computing",no,no need
mobile_resource,Remove RATs from your code: automated optimization of resource inefficient database writes for mobile applications,ISSTA 2018: Proceedings of the 27th ACM SIGSOFT International Symposium on Software Testing and Analysis,"issta 
international symposium on software testing and analysis",yes,yes
mobile_resource,InFi: end-to-end learnable input filter for resource-efficient mobile-centric inference,MobiCom '22: Proceedings of the 28th Annual International Conference on Mobile Computing And Networking,"mobicom 
international conference on mobile computing and networking",no,no need
mobile_resource,Characterizing resource usage for mobile web browsing,"MobiSys '14: Proceedings of the 12th annual international conference on Mobile systems, applications, and services",mobisys ,no,no need
mobile_resource,Anticipatory Admission Control and Resource Allocation for Media Streaming in Mobile Networks,"MSWiM '15: Proceedings of the 18th ACM International Conference on Modeling, Analysis and Simulation of Wireless and Mobile Systems",mswim ,no,no need
mobile_resource,An Ant-based Mobile Agent Approach to Resource Discovery in Grid Computing,SAICSIT '14: Proceedings of the Southern African Institute for Computer Scientist and Information Technologists Annual Conference 2014 on SAICSIT 2014 Empowered by Technology,ist ,no,not in venue list
mobile_resource,Mobile online gaming via resource sharing,SIMUTOOLS '12: Proceedings of the 5th International ICST Conference on Simulation Tools and Techniques,icst ,no,not in venue list
mobile_resource,Cloudlet-based cyber-foraging for mobile systems in resource-constrained edge environments,ICSE Companion 2014: Companion Proceedings of the 36th International Conference on Software Engineering,"icse 
international conference on software engineering",no,no need
mobile_resource,ShAir: extensible middleware for mobile peer-to-peer resource sharing,ESEC/FSE 2013: Proceedings of the 2013 9th Joint Meeting on Foundations of Software Engineering,"esec/fse 
fse ",no,no need
mobile_resource,Profiling resource usage for mobile applications: a cross-layer approach,"MobiSys '11: Proceedings of the 9th international conference on Mobile systems, applications, and services",mobisys ,no,no need
mobile_resource,NestDNN: Resource-Aware Multi-Tenant On-Device Deep Learning for Continuous Mobile Vision,MobiCom '18: Proceedings of the 24th Annual International Conference on Mobile Computing and Networking,"mobicom 
international conference on mobile computing and networking",no,no need
mobile_resource,Implementing software on resource-constrained mobile sensors: experiences with Impala and ZebraNet,"MobiSys '04: Proceedings of the 2nd international conference on Mobile systems, applications, and services",mobisys ,no,no need
mobile_resource,Demo: mobile application resource optimizer (ARO),"MobiSys '11: Proceedings of the 9th international conference on Mobile systems, applications, and services",mobisys ,no,no need
mobile_resource,On resource discovery in distributed systems with mobile hosts,MobiCom '96: Proceedings of the 2nd annual international conference on Mobile computing and networking,"mobicom 
international conference on mobile computing and networking",no,no need
mobile_resource,LEO: scheduling sensor inference algorithms across heterogeneous mobile processors and network resources,MobiCom '16: Proceedings of the 22nd Annual International Conference on Mobile Computing and Networking,"mobicom 
international conference on mobile computing and networking",no,no need
mobile_resource,iResTrac: an architecture for maintaining medical resource status with mobile devices,MobileHealth '11: Proceedings of the First ACM MobiHoc Workshop on Pervasive Wireless Healthcare,mobihoc ,no,no need
mobile_resource,MaJaB: improving resource management for web-based applications on mobile devices,"MobiSys '09: Proceedings of the 7th international conference on Mobile systems, applications, and services",mobisys ,no,no need
android_resource,Detecting resource utilization bugs induced by variant lifecycles in Android,ISSTA 2022: Proceedings of the 31st ACM SIGSOFT International Symposium on Software Testing and Analysis,"issta 
international symposium on software testing and analysis",yes,yes
android_resource,Relda2: an effective static analysis tool for resource leak detection in Android apps,ASE '16: Proceedings of the 31st IEEE/ACM International Conference on Automated Software Engineering,"ase 
automated software engineering",yes,only target problem
android_resource,Characterizing and detecting resource leaks in android applications,ASE '13: Proceedings of the 28th IEEE/ACM International Conference on Automated Software Engineering,"ase 
automated software engineering",yes,yes
android_resource,JRebel.Android: runtime class- and resource reloading for android,ICSE '15: Proceedings of the 37th International Conference on Software Engineering - Volume 2,"icse 
international conference on software engineering",no,no need
android_resource,Demo: RecDroid: An Android Resource Access Permission Recommendation System,MobiHoc '15: Proceedings of the 16th ACM International Symposium on Mobile Ad Hoc Networking and Computing,"mobihoc 
mobile ad hoc networking and computing",no,no need
android_performance,Demystifying application performance management libraries for Android,ASE '19: Proceedings of the 34th IEEE/ACM International Conference on Automated Software Engineering,"ase 
automated software engineering",no,no need
android_performance,On adopting linters to deal with performance concerns in Android apps,ASE '18: Proceedings of the 33rd ACM/IEEE International Conference on Automated Software Engineering,"ase 
automated software engineering",no,interview paper
android_performance,DiagDroid: Android performance diagnosis via anatomizing asynchronous executions,FSE 2016: Proceedings of the 2016 24th ACM SIGSOFT International Symposium on Foundations of Software Engineering,fse ,yes,yes
android_performance,Mining test repositories for automatic detection of UI performance regressions in Android apps,MSR '16: Proceedings of the 13th International Conference on Mining Software Repositories,msr ,yes,only target problem
mobile_responsiveness,SWAM: Revisiting Swap and OOMK for Improving Application Responsiveness on Mobile Devices,ACM MobiCom '23: Proceedings of the 29th Annual International Conference on Mobile Computing and Networking,"mobicom 
international conference on mobile computing and networking",no,no need
mobile_issue,MotorEase: Automated Detection of Motor Impairment Accessibility Issues in Mobile App UIs,ICSE '24: Proceedings of the IEEE/ACM 46th International Conference on Software Engineering,"icse 
international conference on software engineering",no,no need
mobile_issue,The Metamorphosis: Automatic Detection of Scaling Issues for Mobile Apps,ASE '22: Proceedings of the 37th IEEE/ACM International Conference on Automated Software Engineering,"ase 
automated software engineering",no,no need
mobile_issue,Automated repair of size-based inaccessibility issues in mobile applications,ASE '21: Proceedings of the 36th IEEE/ACM International Conference on Automated Software Engineering,"ase 
automated software engineering",no,no need
