keyword,title,publication
mobile_issue,Ku-mobile: satellite multimedia services for cars in the Ku-band,"International Journal of Satellite Communications and NetworkingVolume 24, Issue 2"
mobile_issue,Issue Information,"Software: Practice and ExperienceVolume 54, Issue 9"
mobile_issue,Communication and sensing trade-offs in cooperative mobile networks,"Asian Journal of ControlVolume 10, Issue 2"
mobile_issue,A study of dynamic addressing techniques in mobile ad hoc networks,"Wireless Communications and Mobile ComputingVolume 4, Issue 3"
mobile_issue,Fixed- versus mobile-bearing UKA: a systematic review and meta-analysis,"Knee Surgery, Sports Traumatology, ArthroscopyVolume 23, Issue 11"
mobile_issue,An infrastructure-less peer-to-peer framework for mobile handheld devices,"European Transactions on TelecommunicationsVolume 15, Issue 6"
mobile_issue,Farm animals and aquaculture: significant reservoirs of mobile colistin resistance genes,"Environmental MicrobiologyVolume 22, Issue 7"
mobile_issue,Personalization of engineering education with the mixed reality mobile applications,"Computer Applications in Engineering EducationVolume 26, Issue 5"
mobile_issue,Medium access control in mobile ad hoc networks: challenges and solutions,"Wireless Communications and Mobile ComputingVolume 6, Issue 2"
mobile_issue,Radio network planning of DVB-H/UMTS hybrid mobile communication networks,"European Transactions on TelecommunicationsVolume 17, Issue 2"
mobile_issue,Development of mobile broadband interactive satellite access system for Ku/Ka band,"International Journal of Satellite Communications and NetworkingVolume 24, Issue 2"
mobile_issue,Physical–statistical methods for determining state transition probabilities in mobile-satellite channel models,"International Journal of Satellite CommunicationsVolume 19, Issue 3"
mobile_issue,Issue Information,"Wireless Communications and Mobile ComputingVolume 12, Issue 18"
mobile_issue,Issue Information,"Wireless Communications and Mobile ComputingVolume 12, Issue 18"
mobile_issue,Urbanization reduces Orthoptera diversity and changes community structure towards mobile species,"Insect Conservation and DiversityVolume 17, Issue 2"
mobile_issue,Persistent resource allocations for VoIP traffic in packet-switching mobile cellular networks,"European Transactions on TelecommunicationsVolume 21, Issue 8"
mobile_issue,A motion control for two-wheel inverted pendulum type of mobile manipulator,"IEEJ Transactions on Electrical and Electronic EngineeringVolume 4, Issue 2"
mobile_issue,43.1: Invited Paper: UB-FFS: New Materials for Advanced Mobile Applications,"SID Symposium Digest of Technical PapersVolume 46, Issue 1"
mobile_issue,Regulation of solvent tolerance in Pseudomonas putida S12 mediated by mobile elements,"Microbial BiotechnologyVolume 10, Issue 6"
mobile_issue,Caching mechanism for mobile edge computing in V2I networks,"Transactions on Emerging Telecommunications TechnologiesVolume 30, Issue 8"
mobile_issue,Special Issue Introduction: Exploring the Lived Experiences of Intra-EU Mobility in an Era of Complex Economic and Political Change,"International MigrationVolume 58, Issue 1"
mobile_issue,Mobile payment recognition technology based on face detection algorithm,"Concurrency and Computation: Practice and ExperienceVolume 30, Issue 22"
mobile_issue,Automated negotiated user profiling across distributed social mobile clouds for resource optimisation,"Concurrency and Computation: Practice and ExperienceVolume 32, Issue 1"
mobile_issue,Development of IoT applications in civil engineering classrooms using mobile devices,"Computer Applications in Engineering EducationVolume 26, Issue 5"
mobile_issue,Issue Information,"Computer Applications in Engineering EducationVolume 29, Issue 3"
mobile_issue,Interference and noise analysis for hybrid FSO/RF-based 6G mobile backhaul,"ETRI JournalVolume 44, Issue 6"
mobile_issue,Mobile delay-tolerant networks with energy-harvesting and wireless energy transfer cooperation,"Concurrency and Computation: Practice and ExperienceVolume 31, Issue 24"
mobile_issue,The very short frame of mobile DVB-RCS: Code design and QoS Performance,"International Journal of Satellite Communications and NetworkingVolume 28, Issue 3-4"
mobile_issue,Direct sequence spectrum spreading techniques for next generation mobile broadband satellite services,"International Journal of Satellite Communications and NetworkingVolume 28, Issue 3-4"
mobile_issue,Performance evaluation of IEEE802.16 WiMax with fixed and mobile subscribers in tight reuse,"European Transactions on TelecommunicationsVolume 17, Issue 2"
mobile_issue,An energy-efficient localization algorithm for mobile vehicles in vehicle to vehicle network,"Concurrency and Computation: Practice and ExperienceVolume 24, Issue 11"
mobile_issue,Mobility Support for Older People with Dementia in Japan: Financial Resources Are an issue but Not the Deciding Factor for Municipalities,"Journal of the American Geriatrics SocietyVolume 59, Issue 12"
mobile_issue,Mobile healthcare (m-Health) based on artificial intelligence in healthcare 4.0,"Expert SystemsVolume 41, Issue 6"
mobile_issue,Mobile payment recognition technology based on face detection algorithm,"Concurrency and Computation: Practice and ExperienceVolume 30, Issue 22"
mobile_issue,Mobile healthcare (m-Health) based on artificial intelligence in healthcare 4.0,"Expert SystemsVolume 41, Issue 6"
mobile_issue,Optimizing the investments in mobile networks and subscriber migrations for a telecommunication operator,"NetworksVolume 77, Issue 4"
mobile_issue,P-184: Improvement of Color Mixing in High PPI Mobile Displays,"SID Symposium Digest of Technical PapersVolume 47, Issue 1"
mobile_issue,Customer-centric category selection for mobile and print promotions in loyalty reward programs,"Naval Research Logistics (NRL)Volume 68, Issue 6"
mobile_issue,Mobile health technology adoption across generations: Narrowing the digital divide,"Information Systems JournalVolume 28, Issue 6"
mobile_issue,Extraction of road traffic sign information based on a vehicle-borne mobile photogrammetric system,"The Photogrammetric RecordVolume 30, Issue 150"
mobile_issue,Remote mobile manipulation with the centauro robot: Full-body telepresence and autonomous operator assistance,"Journal of Field RoboticsVolume 37, Issue 5"
mobile_issue,A robust self-organized public key management for mobile ad hoc networks,"Security and Communication NetworksVolume 3, Issue 1"
mobile_issue,A mirroring architecture for sophisticated mobile games using computation-offloading,"Concurrency and Computation: Practice and ExperienceVolume 30, Issue 17"
mobile_issue,A context-aware mobile augmented reality pet interaction model to enhance user experience,"Computer Animation and Virtual WorldsVolume 34, Issue 1"
mobile_issue,A new outsourcing conditional proxy re-encryption suitable for mobile cloud environment,"Concurrency and Computation: Practice and ExperienceVolume 29, Issue 14"
mobile_issue,Complementing anatomy education using three-dimensional anatomy mobile software applications on tablet computers,"Clinical AnatomyVolume 27, Issue 3"
mobile_issue,Trusted information exchange in peer-to-peer mobile social networks,"Concurrency and Computation: Practice and ExperienceVolume 24, Issue 17"
mobile_issue,Research analysis of wireless localization with insufficient resources for next-generation mobile communication networks,"International Journal of Communication SystemsVolume 26, Issue 9"
mobile_issue,High Performance Publish/Subscribe Middleware for Mobile Wireless Networks,"Mobile Information SystemsVolume 3, Issue 2"
mobile_issue,Securing wireless mobile nodes from distributed denial-of-service attacks,"Concurrency and Computation: Practice and ExperienceVolume 27, Issue 15"
mobile_issue,MAAS: A mobile cloud assisted architecture for handling emergency situations,"International Journal of Communication SystemsVolume 33, Issue 13"
mobile_issue,Issue Information,"Concurrency and Computation: Practice and ExperienceVolume 28, Issue 10"
mobile_issue,Verifiable mobile online social network privacy-preserving location sharing scheme,"Concurrency and Computation: Practice and ExperienceVolume 29, Issue 24"
mobile_issue,Higher forgotten joint score for fixed-bearing than for mobile-bearing total knee arthroplasty,"Knee Surgery, Sports Traumatology, ArthroscopyVolume 24, Issue 8"
mobile_issue,Issue Information,"Concurrency and Computation: Practice and ExperienceVolume 28, Issue 6"
mobile_issue,Mobile free space optic nodes in single-input multiple-output setup under transmitter misalignment,"Wireless Communications and Mobile ComputingVolume 11, Issue 12"
mobile_issue,Issue Information,"Internet Technology LettersVolume 4, Issue 4"
mobile_issue,Drilling the mirror routine: From non-situated looking to mobile practice in driver training,"International Journal of Applied LinguisticsVolume 28, Issue 2"
mobile_issue,Versatile two-state land mobile satellite channel model with first application to DVB-SH analysis,"International Journal of Satellite Communications and NetworkingVolume 28, Issue 5-6"
mobile_issue,Issue Information,"Transactions on Emerging Telecommunications TechnologiesVolume 25, Issue 8"
mobile_issue,Issue Information,"Concurrency and Computation: Practice and ExperienceVolume 28, Issue 10"
mobile_issue,High Performance Publish/Subscribe Middleware for Mobile Wireless Networks,"Mobile Information SystemsVolume 3, Issue 2"
mobile_issue,Different femorotibial contact points between fixed- and mobile-bearing TKAs do not show clinical impact,"Knee Surgery, Sports Traumatology, ArthroscopyVolume 23, Issue 11"
mobile_issue,P-7.12: Research on High Brightness Mode Uniformity Problem of Flexible AMOLED Mobile,"SID Symposium Digest of Technical PapersVolume 54, Issue S1"
mobile_issue,The particle filter algorithm: parallel implementations and performance analysis over Android mobile devices,"Concurrency and Computation: Practice and ExperienceVolume 28, Issue 3"
mobile_issue,Taming the big to small: efficient selfish task allocation in mobile crowdsourcing systems,"Concurrency and Computation: Practice and ExperienceVolume 29, Issue 14"
mobile_issue,State space sampling of feasible motions for high-performance mobile robot navigation in complex environments,"Journal of Field RoboticsVolume 25, Issue 6-7"
mobile_issue,Mobile Construction Supply Chain Management Using PDA and Bar Codes,"Computer-Aided Civil and Infrastructure EngineeringVolume 20, Issue 4"
mobile_issue,A new potential field method for mobile robot path planning in the dynamic environments,"Asian Journal of ControlVolume 11, Issue 2"
mobile_issue,Economic feasibility of multipath protocols in mobile Internet of Things applications,"Concurrency and Computation: Practice and ExperienceVolume 27, Issue 8"
mobile_issue,Wideband spectrum compressive sensing for frequency availability in LEO-based mobile satellite systems,"International Journal of Satellite Communications and NetworkingVolume 35, Issue 5"
mobile_issue,Issue Information,"British Journal of Educational TechnologyVolume 49, Issue 2"
mobile_issue,Toward a Test Protocol for Surface Decontamination Using a Mobile Whole-room UVGI Device,"Photochemistry and PhotobiologyVolume 97, Issue 3"
mobile_issue,Issue Information,"British Journal of Educational TechnologyVolume 49, Issue 2"
mobile_issue,An interactive control system for mobile robot based on cloud services,"Concurrency and Computation: Practice and ExperienceVolume 30, Issue 24"
mobile_issue,Toward a Test Protocol for Surface Decontamination Using a Mobile Whole-room UVGI Device,"Photochemistry and PhotobiologyVolume 97, Issue 3"
mobile_issue,Issue Information,"International Journal of Communication SystemsVolume 35, Issue 5"
mobile_issue,Link layer FEC for quality-of-service provision for Mobile Internet Services over DVB-S2,"International Journal of Satellite Communications and NetworkingVolume 28, Issue 3-4"
mobile_issue,Mobile Applications for Women's Health and Midwifery Care: A Pocket Reference for the 21st Century,"Journal of Midwifery & Women's HealthVolume 63, Issue 3"
mobile_issue,An overview of S-DMB system and the testbed for satellite–mobile convergence services,"International Journal of Satellite Communications and NetworkingVolume 29, Issue 3"
mobile_issue,Optimizing the interested area coverage with efficient mobile advertisement user selection,"Concurrency and Computation: Practice and ExperienceVolume 29, Issue 19"
mobile_issue,Issue Information,"Psychology in the SchoolsVolume 57, Issue 12"
mobile_issue,Issue Information,"Psychology & MarketingVolume 34, Issue 2"
mobile_issue,Telehealth and mobile health interventions in adults with inflammatory bowel disease: A mixed-methods systematic review,"Research in Nursing & HealthVolume 44, Issue 1"
mobile_issue,P-9.15: A Novel Over Drive Technique in OLED Driver IC for Mobile Phone,"SID Symposium Digest of Technical PapersVolume 55, Issue S1"
mobile_issue,Issue Information,"International Journal of Communication SystemsVolume 29, Issue 14"
mobile_issue,Issue Information,"Applications in Plant SciencesVolume 12, Issue 2"
mobile_issue,Green resource allocation method for intelligent medical treatment-oriented service in a 5G mobile network,"Concurrency and Computation: Practice and ExperienceVolume 32, Issue 1"
mobile_issue,P-2.10: Design and Implementation of Mobile Robot Path Planning System Based on SLAM Technology,"SID Symposium Digest of Technical PapersVolume 54, Issue S1"
mobile_issue,Issue Information,"Transactions on Emerging Telecommunications TechnologiesVolume 29, Issue 4"
mobile_issue,Logistics Supply Chain Management and Control Based on Mobile Communication Technology,"IEEJ Transactions on Electrical and Electronic EngineeringVolume 19, Issue 9"
mobile_issue,The emergence of operator-neutral small cells as a strong case for cloud computing at the mobile edge,"Transactions on Emerging Telecommunications TechnologiesVolume 27, Issue 9"
mobile_issue,P-1.4: Oxygen-Plasma Induced Generation of Mobile Charge Carriers in Indium-Tin-Zinc Oxide,"SID Symposium Digest of Technical PapersVolume 54, Issue S1"
mobile_issue,Mobile genetic elements mediate the mixotrophic evolution of novel Alicyclobacillus species for acid mine drainage adaptation,"Environmental MicrobiologyVolume 23, Issue 7"
mobile_issue,P-2.10: Design and Implementation of Mobile Robot Path Planning System Based on SLAM Technology,"SID Symposium Digest of Technical PapersVolume 54, Issue S1"
mobile_issue,SCD-MVA: A mobile application for conducting single-case experimental design research during the pandemic,"Human Behavior and Emerging TechnologiesVolume 3, Issue 1"
mobile_issue,Evaluation of channel access protocol performance for a mobile multimedia terminal in a multihop network,"International Journal of Communication SystemsVolume 13, Issue 6"
mobile_issue,Understanding the Antecedents of Intention to Use Mobile Internet Banking in India: Opportunities for Microfinance Institutions,"Strategic ChangeVolume 24, Issue 3"
mobile_issue,Mobile power sources pre-allocation and dispatch strategy in power-transportation coupled network under extreme weather,"IET Renewable Power GenerationVolume 18, Issue 7"
mobile_issue,Issue Information,"EpilepsiaVolume 61, Issue S1"
mobile_issue,A thousand words in the palm of your hand: management of clinical photography on personal mobile devices,"Medical Journal of AustraliaVolume 205, Issue 11"
mobile_issue,The importance of granularity in multiobjective optimization of mobile cloud hybrid applications,"Transactions on Emerging Telecommunications TechnologiesVolume 30, Issue 8"
mobile_issue,A service oriented cloud-based architecture for mobile geolocated emergency services,"Concurrency and Computation: Practice and ExperienceVolume 29, Issue 11"
mobile_issue,Issue Information,"ETRI JournalVolume 40, Issue 1"
mobile_issue,Using Twitter and the mobile cloud for delivering medical help in emergencies,"Concurrency and Computation: Practice and ExperienceVolume 29, Issue 24"
mobile_issue,The efficacy of mobile health interventions used to manage acute or chronic pain: A systematic review,"Research in Nursing & HealthVolume 44, Issue 1"
mobile_issue,Robust multi-rate modulation for cognitive radio communications over land mobile satellite channel at Ku-band,"International Journal of Satellite Communications and NetworkingVolume 35, Issue 5"
mobile_issue,Different intraoperative kinematics with comparable clinical outcomes of ultracongruent and posterior stabilized mobile-bearing total knee arthroplasty,"Knee Surgery, Sports Traumatology, ArthroscopyVolume 24, Issue 9"
mobile_issue,Mobile device access control: an improved correlation based face authentication scheme and its Java ME application,"Concurrency and Computation: Practice and ExperienceVolume 24, Issue 10"
mobile_issue,An efficient algorithm for dynamic task offloading using cloudlets in mobile cloud computing,"International Journal of Communication SystemsVolume 33, Issue 13"
mobile_issue,Intercalation of solvent and polymer in galleries of mobile clay platelets by a Monte Carlo simulation,"Journal of Polymer Science Part B: Polymer PhysicsVolume 47, Issue 24"
mobile_issue,Issue Information,"Transactions on Emerging Telecommunications TechnologiesVolume 29, Issue 11"
mobile_issue,Adaptive method to support social-based mobile networks using a pagerank approach,"Concurrency and Computation: Practice and ExperienceVolume 27, Issue 8"
mobile_issue,Mobile power sources pre-allocation and dispatch strategy in power-transportation coupled network under extreme weather,"IET Renewable Power GenerationVolume 18, Issue 7"
mobile_issue,Issue Information,"Computational IntelligenceVolume 39, Issue 4"
mobile_issue,P-6.6: A study on evaluation methods of gray pattern flicker based on Mobile low frequency display,"SID Symposium Digest of Technical PapersVolume 55, Issue S1"
mobile_issue,I2.4: Invited Paper: Rethinking the Imaging Pipeline for Energy-Efficient Privacy-Preserving Continuous Mobile Vision,"SID Symposium Digest of Technical PapersVolume 46, Issue 1"
mobile_issue,"Characterization of NMCR-2, a new non-mobile colistin resistance enzyme: implications for an MCR-8 ancestor","Environmental MicrobiologyVolume 23, Issue 2"
mobile_issue,Determinants of student performance with mobile-based assessment systems for English as a foreign language courses,"Journal of Computer Assisted LearningVolume 39, Issue 3"
mobile_issue,Effect of fairness on channel choice of the mobile phone supply chain,"International Transactions in Operational ResearchVolume 28, Issue 4"
mobile_issue,Issue Information,"International Journal of Network ManagementVolume 33, Issue 5"
mobile_issue,Stepping into the Wildeverse: Evaluating the impact of augmented reality mobile gaming on pro-conservation behaviours,"People and NatureVolume 3, Issue 6"
mobile_issue,Secure publish/subscribe-based certificate status validations in mobile ad hoc networks,"Security and Communication NetworksVolume 8, Issue 6"
mobile_issue,Adaptive Ad Network Selection for Publisher-Return Optimization in Mobile-App Advertising,"Decision SciencesVolume 52, Issue 4"
mobile_issue,Issue Information,"Wireless Communications and Mobile ComputingVolume 13, Issue 3"
mobile_issue,The size distribution of ‘cities’ delineated with a network theory-based method and mobile phone GPS data,"International Journal of Economic TheoryVolume 16, Issue 1"
mobile_issue,Bacteriophages of Staphylococcus aureus efficiently package various bacterial genes and mobile genetic elements including SCCmec with different frequencies,"Environmental Microbiology ReportsVolume 5, Issue 1"
mobile_issue,P-7.4: Research on Ultra-thin Narrow Bezel Technology of Liquid Crystal DisplayModule under 5G Mobile Phone,"SID Symposium Digest of Technical PapersVolume 53, Issue S1"
mobile_issue,Breaking Down the Binary: Layers of Vulnerability among Internally and Internationally Mobile Workers in the Context of Southern Africa,"International MigrationVolume 59, Issue 2"
mobile_issue,Issue Information,"EpilepsiaVolume 64, Issue S4"
mobile_issue,Issue Information,"Concurrency and Computation: Practice and ExperienceVolume 33, Issue 18"
mobile_issue,Approximate or accurate? Efficacy of daily use of weather and air quality mobile applications for pollen allergy sufferers?,"Pediatric Allergy and ImmunologyVolume 33, Issue S27"
mobile_issue,Impact of packet-level FEC and existing link level reliability mechanisms to deliver MBMS content over WCDMA mobile satellite systems,"International Journal of Satellite Communications and NetworkingVolume 24, Issue 2"
mobile_issue,Issue Information,"Concurrency and Computation: Practice and ExperienceVolume 33, Issue 18"
mobile_issue,Approximate or accurate? Efficacy of daily use of weather and air quality mobile applications for pollen allergy sufferers?,"Pediatric Allergy and ImmunologyVolume 33, Issue S27"
mobile_issue,Impact of packet-level FEC and existing link level reliability mechanisms to deliver MBMS content over WCDMA mobile satellite systems,"International Journal of Satellite Communications and NetworkingVolume 24, Issue 2"
mobile_issue,54-1: Invited Paper: Promising Conceptual Designs of 2-in-1 Antenna-on-Display (AoD) for Mobile Phones,"SID Symposium Digest of Technical PapersVolume 55, Issue S1"
mobile_issue,Preventive antibiotic treatment of calves: emergence of dysbiosis causing propagation of obese state-associated and mobile multidrug resistance-carrying bacteria,"Microbial BiotechnologyVolume 13, Issue 3"
mobile_issue,P-93: Highly Reliable Mobile Liquid Crystal Display using AIOx Deposited By Atomic Layer Deposition for Side Sealing Structure,"SID Symposium Digest of Technical PapersVolume 46, Issue 1"
mobile_issue,P-10.13: Research on improving the bending ability of foldable AMOLED mobile screen by overlaying FMLOC and COE technology,"SID Symposium Digest of Technical PapersVolume 55, Issue S1"
mobile_issue,Mobile device security defense method and system based on address jump using sliding window technology,"Concurrency and Computation: Practice and ExperienceVolume 34, Issue 14"
mobile_issue,Structured P2P Overlay of Mobile Brokers for Realizing Publish/Subscribe Communication in VANET,"The Scientific World JournalVolume 2014, Issue 1"
mobile_issue,A measurement study of device-to-device sharing in mobile social networks based on Spark,"Concurrency and Computation: Practice and ExperienceVolume 29, Issue 16"
mobile_issue,"Mobile Devices and Applications for Supply Chain Management: Process, Contingency, and Performance Effects","Transportation JournalVolume 55, Issue 4"
mobile_issue,Technological importance and breadth of standard essential patents: A comparison between practicing and non-practicing entities for mobile telecommunication technologies,"ETRI JournalVolume 42, Issue 5"
mobile_issue,"Modulation, coding, and synchronization for mobile and very small satellite terminals, as part of the updated DVB-S2 standard","International Journal of Satellite Communications and NetworkingVolume 34, Issue 3"
mobile_issue,Study protocol for a multisite randomized controlled trial of an internet and mobile-based intervention for preventing and reducing perinatal depressive symptoms,"Research in Nursing & HealthVolume 44, Issue 1"
mobile_issue,Effects of mobile health interventions on improving glycemic stability and quality of life in patients with type 1 diabetes: A meta-analysis,"Research in Nursing & HealthVolume 44, Issue 1"
mobile_issue,No difference between fixed- and mobile-bearing total knee arthroplasty in activities of daily living and pain: a randomized clinical trial,"Knee Surgery, Sports Traumatology, ArthroscopyVolume 25, Issue 6"
mobile_issue,"Use of passive sensing to quantify adolescent mobile device usage: Feasibility, acceptability, and preliminary validation of the eMoodie application","Human Behavior and Emerging TechnologiesVolume 3, Issue 1"
mobile_issue,Comparison of ultra-congruent mobile- and fixed-bearing navigation-assisted total knee arthroplasty with minimum 5-year follow-up,"Knee Surgery, Sports Traumatology, ArthroscopyVolume 24, Issue 11"
mobile_issue,"Biosolids for safe land application: does wastewater treatment plant size matters when considering antibiotics, pollutants, microbiome, mobile genetic elements and associated resistance genes?","Environmental MicrobiologyVolume 24, Issue 3"
mobile_issue,Multistage stochastic programming for the closed-loop supply chain planning with mobile modules under uncertainty,"AIChE JournalVolume 69, Issue 9"
mobile_issue,Comparison of ultra-congruent mobile- and fixed-bearing navigation-assisted total knee arthroplasty with minimum 5-year follow-up,"Knee Surgery, Sports Traumatology, ArthroscopyVolume 24, Issue 11"
mobile_issue,Multistage stochastic programming for the closed-loop supply chain planning with mobile modules under uncertainty,"AIChE JournalVolume 69, Issue 9"
mobile_issue,The effective practices of mobile phone producers' green supply chain management in reducing GHG emissions,"Environmental Quality ManagementVolume 28, Issue 3"
mobile_issue,On the Catalytic Degradation in Fuel Cell Power Supplies for Long-Life Mobile Field Sensors,"Fuel CellsVolume 13, Issue 2"
mobile_issue,Reassuring evacuation guidance with mobile terminal communication and RFID system in absence of power supply,"Electrical Engineering in JapanVolume 177, Issue 2"
mobile_issue,Issue Information,"NetworksVolume 79, Issue 3"
mobile_issue,Issue Information,"Population, Space and PlaceVolume 21, Issue 7"
mobile_issue,Issue Information,"Population, Space and PlaceVolume 26, Issue 3"
mobile_issue,Issue Information,"Global PolicyVolume 12, Issue S2"
mobile_issue,Issue Information,"Journal of Management StudiesVolume 55, Issue 1"
