keyword,title,publication
mobile_issue,MyMOOCSpace: Mobile cloud-based system tool to improve collaboration and preparation of group assessments in traditional engineering courses in higher education,"Computer Applications in Engineering EducationVolume 26, Issue 5"
mobile_issue,Issue Information,"Population, Space and PlaceVolume 23, Issue 5"
mobile_issue,Issue Information,"Sustainable DevelopmentVolume 26, Issue 5"
mobile_issue,"Formaldehyde levels in FEMA-supplied travel trailers, park models, and mobile homes in Louisiana and Mississippi","Indoor AirVolume 23, Issue 2"
mobile_issue,Issue Information,"Population, Space and PlaceVolume 24, Issue 1"
mobile_issue,Issue Information,"Higher Education QuarterlyVolume 72, Issue 3"
mobile_issue,Issue Information,"New Zealand GeographerVolume 73, Issue 2"
mobile_issue,Issue Information,"Regional Science Policy & PracticeVolume 14, Issue S1"
mobile_issue,Issue Information,"Journal of Consumer BehaviourVolume 22, Issue 2"
mobile_issue,Issue Information,"Journal of Operations ManagementVolume 69, Issue 1"
mobile_issue,Issue Information,"Transactions on Emerging Telecommunications TechnologiesVolume 33, Issue 8"
mobile_issue,Issue Information,"Global PolicyVolume 8, Issue S1"
mobile_issue,Issue Information,"Early Medieval EuropeVolume 31, Issue 3"
mobile_issue,Issue Information,"Journal of Consumer BehaviourVolume 22, Issue 2"
mobile_issue,Issue Information,"Wireless Communications and Mobile ComputingVolume 11, Issue 4"
mobile_issue,[Retracted] Mobile Communication Procurement Platform Optimization Decision Based on Overseas Retailer Investment under Supply and Demand Disruption Risk,"Wireless Communications and Mobile ComputingVolume 2021, Issue 1"
mobile_issue,Retracted: Mobile Communication Procurement Platform Optimization Decision Based on Overseas Retailer Investment under Supply and Demand Disruption Risk,"Wireless Communications and Mobile ComputingVolume 2023, Issue 1"
mobile_issue,Research trends in mobile and ubiquitous learning: a review of publications in selected journals from 2001 to 2010,"British Journal of Educational TechnologyVolume 42, Issue 4"
mobile_issue,Responses of leaf nitrogen and mobile carbohydrates in different Quercus species/provenances to moderate climate changes,"Plant BiologyVolume 15, Issue s1"
mobile_issue,Issue Information - TOC,"Journal of Social IssuesVolume 72, Issue 4"
mobile_issue,An allocative method of stationary and vehicle-mounted mobile energy storage for emergency power supply in urban areas,"Energy StorageVolume 6, Issue 5"
mobile_issue,"Erratum: Soft Decision with Soft Target for Car-like Mobile Vehicle in Dynamic Environment. Yougen Chen Seiji Yasunobu. IEEJ Transactions on Electrical and Electronic Engineering, 2009, 4","IEEJ Transactions on Electrical and Electronic EngineeringVolume 4, Issue 5"
mobile_issue,Stakeholders' engagement through social media analytics in promoting sustainable development practices in the mobile supply chain: A cross-country analysis,"Business Strategy and the EnvironmentVolume 32, Issue 8"
mobile_issue,Integrating mobile learning and SPOC-based flipped classroom to teach a course in water supply and drainage science and engineering,"Computer Applications in Engineering EducationVolume 31, Issue 3"
mobile_issue,Call for Papers: Special Issue on Advanced Communication Systems for Enhanced Big Data Technology and Applications,"International Journal of Communication SystemsVolume 26, Issue 6"
mobile_issue,"Learning curves in collaborative planning, forecasting, and replenishment (CPFR) information systems: An empirical analysis from a mobile phone manufacturer","Journal of Operations ManagementVolume 31, Issue 6"
mobile_issue,"The enamels of the first (soft-paste) European blue-and-white porcelains: Rouen, Saint-Cloud and Paris factories: Complementarity of Raman and X-ray fluorescence analyses with mobile instruments to identify the cobalt ore","Journal of Raman SpectroscopyVolume 52, Issue 12"
mobile_issue,Issue Information - Notes for Contributors,"Journal of Management StudiesVolume 55, Issue 1"
mobile_issue,"Issue Information - Issues In Progress, Editorial Board, Past Editors","Journal of Social IssuesVolume 72, Issue 4"
mobile_issue,Mobile phone text messaging to improve knowledge and practice of diabetic foot care in a developing country: Feasibility and outcomes,"International Journal of Nursing PracticeVolume 23, Issue S1"
mobile_issue,Mobile phone text messaging to improve knowledge and practice of diabetic foot care in a developing country: Feasibility and outcomes,"International Journal of Nursing PracticeVolume 23, Issue S1"
mobile_issue,Improving the quality and quantity of functional and non-functional requirements obtained during requirements elicitation stage for the development of e-commerce mobile applications: an alternative reference process model,"IET SoftwareVolume 14, Issue 2"
mobile_issue,Mobility Issues,Treatment and Care of the Geriatric Veterinary Patient
mobile_issue,"Quality of life before and after surgery: mobility issues, the fear of surgery, inpatient recovery and outpatient rehabilitation","HaemophiliaVolume 11, Issue s1"
mobile_issue,"Labour Mobility in the Asia-Pacific Region: dynamics, issues and a new APEC agenda – Edited by Graeme Hugo and Soogil Young","Asian-Pacific Economic LiteratureVolume 24, Issue 1"
mobile_issue,Transfer-friendly institutions: The complex issues of student mobility,"New Directions for Teaching and LearningVolume 2022, Issue 171"
mobile_issue,Children as Research Collaborators: Issues and Reflections from a Mobility Study in Sub-Saharan Africa,"American Journal of Community PsychologyVolume 46, Issue 1-2"
mobile_issue,"Human migration and mobility—demographic, environmental, and evolutionary issues","American Journal of Human BiologyVolume 16, Issue 4"
mobile_issue,Geographic mobility among older people and their adult children: The role of parents' health issues and family ties,"Population, Space and PlaceVolume 26, Issue 8"
mobile_issue,"Peter H. Rossi, ","Journal of Social IssuesVolume 38, Issue 3"
mobile_issue,Affordable home visits for owners with mobility issues,"Veterinary RecordVolume 181, Issue 17"
mobile_issue,Patient mobility across the EU: issues and challenges,"European Diabetes NursingVolume 2, Issue 1"
mobile_issue,W. A. V. CLARK,"Tijdschrift voor economische en sociale geografieVolume 77, Issue 5"
mobile_issue,Human mobility in the context of environmental and climate change: Recent data collection tools from the International Organization for Migration to address key methodological and conceptual issues,"International MigrationVolume 61, Issue 5"
mobile_issue,Personal and service mobility in ubiquitous computing environments,"Wireless Communications and Mobile ComputingVolume 4, Issue 6"
mobile_issue,"Call for Papers: Special Issue on “Architectures and Protocols for Wireless Mesh, Ad Hoc, and Sensor Networks”","Wireless Communications and Mobile ComputingVolume 9, Issue 4"
mobile_issue,Study of the TCP upstream/downstream unfairness issue with per-flow queuing over infrastructure-mode WLANs,"Wireless Communications and Mobile ComputingVolume 5, Issue 4"
mobile_issue,List of People Who Reviewed for this Special Issue,"Journal of Management StudiesVolume 55, Issue 1"
mobile_issue,"Mobilizing hospitality: the ethics of social relations in a mobile world by Jennie Germann Molz and Sarah Gibson (eds), Ashgate Publishing, Aldershot, UK, 2007. No. of pages: 232 including index. ISBN 978-0-7546-7015-5","International Journal of Tourism ResearchVolume 10, Issue 3"
mobile_issue,Research Needed to Resolve the Plant Nutrient-Water Quality Issue,"Nutrient Mobility in Soils: Accumulation and Losses, Volume 4"
mobile_issue,Special issue on security in ad hoc networks and pervasive computing,"Wireless Communications and Mobile ComputingVolume 8, Issue 3"
mobile_issue,Integration of authentication and mobility management in third generation and WLAN data networks,"Wireless Communications and Mobile ComputingVolume 5, Issue 6"
mobile_issue,Mobility in Publish/Subscribe Systems,Mobile Intelligence
mobile_issue,A SIP-based mobility management platform for WLAN location-aware broadcasting and multicasting applications,"Wireless Communications and Mobile ComputingVolume 5, Issue 6"
mobile_issue,"Rural Melting-pots, Mobilities and Fragilities: Reflections on the Spanish Case","Sociologia RuralisVolume 50, Issue 3"
mobile_issue,Mobility Demands and Participation in Remote Rural Areas,"Sociologia RuralisVolume 50, Issue 3"
mobile_issue,Mobilities and Ruralities: An Introduction,"Sociologia RuralisVolume 50, Issue 3"
mobile_issue,Resilient botany: Innovation in the face of limited mobility and resources,"Applications in Plant SciencesVolume 12, Issue 2"
mobile_issue,The Quest for More and More Education: Implications for Social Mobility,"Fiscal StudiesVolume 33, Issue 2"
mobile_issue,The Role of Education and Skills in Driving Social Mobility,"Fiscal StudiesVolume 33, Issue 2"
mobile_issue,High mobility group box-1 serves a pathogenic role in spinal cord injury via the promotion of pro-inflammatory cytokines,"Journal of Leukocyte BiologyVolume 110, Issue 6"
mobile_issue,Arrival Infrastructures: Migration and Urban Social Mobilities,"Tijdschrift voor economische en sociale geografieVolume 110, Issue 5"
mobile_issue,What Do We Know So Far about Multigenerational Mobility?,"The Economic JournalVolume 128, Issue 612"
mobile_issue,Is the Simple Law of Mobility Really a Law? Testing Clark's Hypothesis,"The Economic JournalVolume 128, Issue 612"
mobile_issue,Correlating Social Mobility and Economic Outcomes,"The Economic JournalVolume 128, Issue 612"
mobile_issue,"Grandfathers Matter(ed): Occupational Mobility Across Three Generations in the US and Britain, 1850–1911","The Economic JournalVolume 128, Issue 612"
mobile_issue,Multiple Measures of Historical Intergenerational Mobility: Iowa 1915 to 1940,"The Economic JournalVolume 128, Issue 612"
mobile_issue,Intergenerational Wealth Mobility and the Role of Inheritance: Evidence from Multiple Generations,"The Economic JournalVolume 128, Issue 612"
mobile_issue,Canada’s Temporary Foreign Worker and International Mobility Programs: Charting Change and Continuity Among Source Countries,"International MigrationVolume 59, Issue 2"
mobile_issue,On China’s Domestic Capital Mobility and the Role of the Government: Empirical Evidence Over 1970–2006,"The World EconomyVolume 34, Issue 7"
mobile_issue,Acceleration of absolute negative mobility,"Journal of Separation ScienceVolume 30, Issue 10"
mobile_issue,"Cosmologies of credit: transnational mobility and the politics of destination in China by Chu, Julie","Social AnthropologyVolume 20, Issue 4"
mobile_issue,On China’s Domestic Capital Mobility and the Role of the Government: Empirical Evidence Over 1970–2006,"The World EconomyVolume 34, Issue 7"
mobile_issue,Geographical mobility of general practitioners in rural Australia,"Medical Journal of AustraliaVolume 203, Issue 2"
mobile_issue,The herbicide glyphosate and related molecules: physicochemical and structural factors determining their mobility in phloem,"Pest Management ScienceVolume 56, Issue 4"
mobile_issue,Flagpoling: Inter-provincial Mobility of International Migrants within Canada’s Temporary Foreign Worker Program,"International MigrationVolume 59, Issue 2"
mobile_issue,Emerging China–Africa relations in the context of increasing mobility – The Chinese presence in Africa from a historical and current perspective,"International MigrationVolume 59, Issue 2"
mobile_issue,Development of an item bank for measuring prosthetic mobility in people with lower limb amputation: The Prosthetic Limb Users Survey of Mobility (PLUS-M),"PM&RVolume 15, Issue 4"
mobile_issue,"Quantitative analysis of benzene, toluene, and m-xylene with the use of a UV–ion mobility spectrometer","Field Analytical Chemistry & TechnologyVolume 4, Issue 4"
mobile_issue,A Pseudo-Junction Barrier Schottky Diode in p-GaN/AlGaN/GaN High Electron Mobility Transistor Epitaxial Layers,"physica status solidi (a)Volume 221, Issue 13"
mobile_issue,The intergenerational transmission of income mobility between mothers and their young adult daughters: The mediating role of their daughters' educational attainment,"Social Policy & AdministrationVolume 54, Issue 6"
mobile_issue,Computational tools and algorithms for ion mobility spectrometry-mass spectrometry,"PROTEOMICSVolume 24, Issue 12-13"
mobile_issue,Transcription factor binding study by capillary zone electrophoretic mobility shift assay,"ELECTROPHORESISVolume 24, Issue 1-2"
mobile_issue,Analysis of N- and O-linked site-specific glycosylation by ion mobility mass spectrometry: State of the art and future directions,"PROTEOMICSVolume 24, Issue 12-13"
mobile_issue,Obedience in the Labour Market and Social Mobility: A Socioeconomic Approach,"EconomicaVolume 89, Issue S1"
mobile_issue,Nucleosome mobility and the regulation of gene expression: Insights from single-molecule studies,"Protein ScienceVolume 26, Issue 7"
mobile_issue,Effects of the COVID-19 pandemic on the Colombian labour market: Disentangling the effect of sector-specific mobility restrictions,"Canadian Journal of Economics/Revue canadienne d'économiqueVolume 55, Issue S1"
mobile_issue,Role of high-mobility group box 1 and its modulation by thrombomodulin/thrombin axis in neuropathic and inflammatory pain,"British Journal of PharmacologyVolume 178, Issue 4"
mobile_issue,Reliability Instability Assessment with Interfacial Trapping Analysis for the Optimization of Al Composition in AlxGa1−xN/GaN High Electron Mobility Transistors,"physica status solidi (a)Volume 221, Issue 13"
mobile_issue,Ferroelectric-Gated HfZrO2/AlGaN/GaN High-Electron-Mobility Transistors with Regrown Contacts for Radio Frequency and Millimeter-Wave Switch Applications,"physica status solidi (a)Volume 221, Issue 13"
mobile_issue,"Structural characterization of iron azadiethylthiolate complexes: Insights from NMR, crystallography, and ion mobility-mass spectroscopy","Journal of the Chinese Chemical SocietyVolume 71, Issue 8"
mobile_issue,Techniques for characterization of charge carrier mobility in organic semiconductors,"Journal of Polymer Science Part B: Polymer PhysicsVolume 50, Issue 15"
mobile_issue,High-resolution ion mobility spectrometry-mass spectrometry of isomeric/isobaric ribonucleotide variants,"Journal of Mass SpectrometryVolume 55, Issue 2"
mobile_issue,Gas-phase structure of polymer ions: Tying together theoretical approaches and ion mobility spectrometry,"Mass Spectrometry ReviewsVolume 42, Issue 4"
mobile_issue,Structural studies of supramolecular complexes and assemblies by ion mobility mass spectrometry,"Mass Spectrometry ReviewsVolume 43, Issue 3"
mobile_issue,The separation of cyclic diadenosine diphosphorothioate and the diastereomers of its difluorinated derivative and the estimation of the binding constants and ionic mobilities of their complexes with 2-hydroxypropyl-β-cyclodextrin by affinity capillary electrophoresis,"ELECTROPHORESISVolume 45, Issue 11-12"
mobile_issue,Ion mobility-mass spectrometry for the separation and analysis of procyanidins,"Journal of Mass SpectrometryVolume 55, Issue 2"
mobile_issue,Role of testosterone in cognition and mobility of aging men,"AndrologyVolume 8, Issue 6"
mobile_issue,Training and Low-pay Mobility: The Case of the UK and the Netherlands,"LABOURVolume 23, Issue s1"
mobile_issue,"Frequency, composition and mobility of Escherichia coli-derived transposable elements in holdings of plasmid repositories","Microbial BiotechnologyVolume 15, Issue 2"
mobile_issue,The mobility of mitochondria: Intercellular trafficking in health and disease,"Clinical and Experimental Pharmacology and PhysiologyVolume 44, Issue S1"
mobile_issue,Let Tiebout pick up the tab: Pricing out externalities with free mobility,"International Journal of Economic TheoryVolume 13, Issue 1"
mobile_issue,E-Mobility and the Energy Transition,"Angewandte Chemie International EditionVolume 56, Issue 37"
mobile_issue,Structural insights into interactions between ubiquitin specific protease 5 and its polyubiquitin substrates by mass spectrometry and ion mobility spectrometry,"Protein ScienceVolume 24, Issue 8"
mobile_issue,The Mime Vademecum: Mobility And Inclusion In Multilingual Europe,"Journal of SociolinguisticsVolume 23, Issue 5"
mobile_issue,"A Korean Picture Bride as an Immigrant Woman Entrepreneur: Gender, Mobility, and Hawaii's Lodging Businesses","Pacific FocusVolume 39, Issue 1"
mobile_issue,"Quality of life, satisfaction with life, and functional mobility of young adults with arthrogryposis after leaving pediatric care","American Journal of Medical Genetics Part C: Seminars in Medical GeneticsVolume 181, Issue 3"
mobile_issue,"An integrative approach combining ion mobility mass spectrometry, X-ray crystallography, and nuclear magnetic resonance spectroscopy to study the conformational dynamics of α1-antitrypsin upon ligand binding","Protein ScienceVolume 24, Issue 8"
mobile_issue,"Transculturality, Anti-Asian Racism and Student Mobility: A Case Study of Chinese International Student Experiences during the COVID-19 Pandemic","Sociological InquiryVolume 94, Issue 2"
mobile_issue,Ultra-Shallow All-Epitaxial Aluminum Gate GaAs/AlxGa1−xAs Transistors with High Electron Mobility,"Advanced Functional MaterialsVolume 32, Issue 3"
mobile_issue,Effects of oxidant fluid properties on the mobility of water droplets in the channels of PEM fuel cell,"International Journal of Energy ResearchVolume 29, Issue 12"
mobile_issue,"Native mass spectrometry and ion mobility characterization of trastuzumab emtansine, a lysine-linked antibody drug conjugate","Protein ScienceVolume 24, Issue 8"
mobile_issue,Electric Vehicle Virtual Power Plant Dilemma: Grid Balancing Versus Customer Mobility,"Production and Operations ManagementVolume 27, Issue 11"
mobile_issue,"Transport Geographies: Mobilities, Flows and Spaces - Edited by Richard Knowles, Jon Shaw and Iain Docherty","Geographical JournalVolume 175, Issue 2"
mobile_issue,Delphi consensus study and clinical practice guideline development for functional electrical stimulation to support upright mobility in people with an upper motor neuron lesion,"Artificial OrgansVolume 48, Issue 3"
mobile_issue,P-158L: Late-News Poster: Development of A Silicon Process with Device Mobility >500 Cm2/V-Sec Suitable for a Large-Area Display Backplane Using Embedded Single-Crystal Silicon Particles,"SID Symposium Digest of Technical PapersVolume 46, Issue 1"
mobile_issue,1-1: Oxide Semiconductor Thin-Film Transistors with High Mobility and Stability,"SID Symposium Digest of Technical PapersVolume 55, Issue S1"
mobile_issue,P-1.4: Synergistic Enhancement of Stability and Mobility in ZrO2-Doped ITZO TFTs with MLO Passivation,"SID Symposium Digest of Technical PapersVolume 55, Issue S1"
mobile_issue,"Sociolinguistic Perspectives on Migration Control: Language Policy, Identity and Belonging, Markus Rheindorf, Ruth Wodak (Eds.) Language, Mobility and Institutions. Bristol, Blue Ridge Summit: Multilingual Matters. 2020. viii + 172 pp. Hb (9781788924672) £89.95, Pb (9781788924665) £24.95, Ebook (9781788924689) £15.00","Journal of SociolinguisticsVolume 24, Issue 5"
mobile_issue,69-2: Oxide-TFT Mobility Limits and CMOS Feasibility,"SID Symposium Digest of Technical PapersVolume 47, Issue 1"
mobile_issue,P-143: Fabrication of 5.5-inch 4K2K Liquid Crystal panel using High-mobility IGZO Material,"SID Symposium Digest of Technical PapersVolume 47, Issue 1"
mobile_issue,"30.2: Invited Paper: Universal Description of FET Mobility of TFTs in Terms of Debye Length, Accumulation Layer Thickness and Film Thickness","SID Symposium Digest of Technical PapersVolume 54, Issue S1"
mobile_issue,35-4: High-Mobility and High-Negative Bias Illumination Stress Stability Based on ITZO/IGZO Bilayer Thin Film Transistors,"SID Symposium Digest of Technical PapersVolume 55, Issue S1"
mobile_issue,Electron-capture dissociation and ion mobility mass spectrometry for characterization of the hemoglobin protein assembly,"Protein ScienceVolume 24, Issue 8"
mobile_issue,Mobility at the Heart of a Nation: Patterns and Meanings of Cape Verdean Migration,"International MigrationVolume 47, Issue 3"
mobile_issue,53.5: Low IR Drop 480×540RGB Mini-LED Display Based on High Mobility Ln-IZO TFT,"SID Symposium Digest of Technical PapersVolume 53, Issue S1"
mobile_issue,9.3: High Mobility and Stability Indium Oxide Thin-film Transistor with Praseodymium and Hetero-valence Tungsten Doping,"SID Symposium Digest of Technical PapersVolume 54, Issue S1"
mobile_issue,57-2: Invited Paper: Flexible Electrophoretic Displays with Novel Drive Schemes for Wearables and Mobiles,"SID Symposium Digest of Technical PapersVolume 47, Issue 1"
mobile_issue,64-2: New Organic Semiconductors for Improved Processing — Direct Photo-Patterning and High Mobility Materials for Flexible TFTs,"SID Symposium Digest of Technical PapersVolume 47, Issue 1"
mobile_issue,P-35: New Voltage-Programmed AMOLED Pixel Circuit Employing In-Pixel Compensation Scheme for Mobility Variation,"SID Symposium Digest of Technical PapersVolume 47, Issue 1"
mobile_issue,64-2: New Organic Semiconductors for Improved Processing — Direct Photo-Patterning and High Mobility Materials for Flexible TFTs,"SID Symposium Digest of Technical PapersVolume 47, Issue 1"
mobile_issue,P-35: New Voltage-Programmed AMOLED Pixel Circuit Employing In-Pixel Compensation Scheme for Mobility Variation,"SID Symposium Digest of Technical PapersVolume 47, Issue 1"
mobile_issue,51.3: A Mobility Enhancing Method Adopting A Multi-Active Layer Structure in Thin Film Transistors,"SID Symposium Digest of Technical PapersVolume 46, Issue 1"
mobile_issue,Electrical model of organic diodes with field-dependent carrier mobility in the presence of an electric field at the injection interface,"International Journal of Numerical Modelling: Electronic Networks, Devices and FieldsVolume 23, Issue 4-5"
mobile_issue,Mobility of single DNA chain under electric field during its transient contact with solid surfaces,"Journal of Polymer Science Part B: Polymer PhysicsVolume 47, Issue 24"
mobile_issue,P-1.2: Hot Carrier Effect in Self-Aligned In-Ga-Zn-Sn-O High Mobility Thin Film Transisitors,"SID Symposium Digest of Technical PapersVolume 55, Issue S1"
mobile_issue,53.5: Low IR Drop 480×540RGB Mini-LED Display Based on High Mobility Ln-IZO TFT,"SID Symposium Digest of Technical PapersVolume 53, Issue S1"
mobile_issue,9.3: High Mobility and Stability Indium Oxide Thin-film Transistor with Praseodymium and Hetero-valence Tungsten Doping,"SID Symposium Digest of Technical PapersVolume 54, Issue S1"
mobile_issue,37.1: Invited Paper: Nanosheet High Mobility SnO2-SnO Complementary TFTs for System-on-Display and Monolithic Three-Dimensional Integrated Circuit,"SID Symposium Digest of Technical PapersVolume 53, Issue S1"
mobile_issue,9-1: Heterojunction-boosted mobility in InZnO bilayer thin-film transistor,"SID Symposium Digest of Technical PapersVolume 55, Issue S1"
mobile_issue,P-1.11: High-mobility ZnO thin-film transistors with HfO2/Al2O3 bilayer dielectric,"SID Symposium Digest of Technical PapersVolume 53, Issue S1"
mobile_issue,"Introduction: Sociolinguistics and tourism – mobilities, markets, multilingualism","Journal of SociolinguisticsVolume 18, Issue 4"
mobile_issue,Atomistic analysis of B clustering and mobility degradation in highly B-doped junctions,"International Journal of Numerical Modelling: Electronic Networks, Devices and FieldsVolume 23, Issue 4-5"
mobile_issue,"Life events, social conditions and residential mobility among older adults","Population, Space and PlaceVolume 30, Issue 3"
mobile_issue,Review of Morphology Dependent Charge Carrier Mobility in MEH-PPV,"Journal of the Chinese Chemical SocietyVolume 57, Issue 3B"
mobile_issue,Frontline Science: Targeted expression of a dominant-negative high mobility group A1 transgene improves outcome in sepsis,"Journal of Leukocyte BiologyVolume 104, Issue 4"
mobile_issue,Life-space mobility and social support in elderly adults with orthopaedic disorders,"International Journal of Nursing PracticeVolume 20, Issue S1"
mobile_issue,P-17: High Mobility ITZO BCE Type TFTs for AMOLED Applications,"SID Symposium Digest of Technical PapersVolume 46, Issue 1"
mobile_issue,51.1: Amorphous Indium-Gallium-Zinc-Tin-Oxide TFTs with High Mobility and Reliability,"SID Symposium Digest of Technical PapersVolume 46, Issue 1"
mobile_issue,51.2: The Development of a High Mobility Zinc Oxynitride TFT for AMOLED,"SID Symposium Digest of Technical PapersVolume 46, Issue 1"
mobile_issue,47-4: Invited Paper: Flexible AMOLED based on Oxide TFT with High Mobility,"SID Symposium Digest of Technical PapersVolume 47, Issue 1"
mobile_issue,P-2: Novel High Mobility Oxide TFT with Self-Aligned S/D Regions Formed by Wet-etch process,"SID Symposium Digest of Technical PapersVolume 47, Issue 1"
mobile_issue,P-190L: Late-News Poster: Device Mobility >300 cm2/V·S Using Planarized Single-Crystal Silicon Spheres for Large Area Display Backplanes,"SID Symposium Digest of Technical PapersVolume 47, Issue 1"
mobile_issue,P-1.8: Energy-Band-Dependent Mobility in Heterojunction Amorphous Oxide Semiconductor Thin-Film Transistors,"SID Symposium Digest of Technical PapersVolume 54, Issue S1"
mobile_issue,T cell adhesion mechanisms revealed by receptor lateral mobility,"BiopolymersVolume 89, Issue 5"
mobile_issue,THE IMS PARADOX: A PERSPECTIVE ON STRUCTURAL ION MOBILITY-MASS SPECTROMETRY,"Mass Spectrometry ReviewsVolume 40, Issue 3"
mobile_issue,Evaluating the Eco-Efficiency of Urban Air Mobility: Understanding Environmental and Social Impacts for Informed Passenger Choices,"INCOSE International SymposiumVolume 34, Issue 1"
