keyword,title,publication
mobile_performance,Optimizing Storage Performance for VM-Based Mobile Computing,"ACM Transactions on Computer Systems (TOCS), Volume 31, Issue 2"
mobile_performance,Assessment of the performance and efficiency of public services being delivered through mobile seva,ICEGOV '14: Proceedings of the 8th International Conference on Theory and Practice of Electronic Governance
mobile_performance,On-device objective-C application optimization framework for high-performance mobile processors,"DATE '14: Proceedings of the conference on Design, Automation & Test in Europe"
mobile_performance,Impact on Inter-Vehicular Communication Performance on Different Traffic Mobility Model: A Case Study of Ad Hoc On-Demand Distance Vector Routing Protocol,ICCES '17: Proceedings of the International Conference on Computing for Engineering and Sciences
mobile_performance,"Millimeter Wave Mobile Communications for 5G: Propagation, System Design and Performance",mmNets '17: Proceedings of the 1st ACM Workshop on Millimeter-Wave Networks and Sensing Systems 2017
mobile_performance,Performance evaluation of mobile IPv6 over 6LoWPAN,"PE-WASUN '12: Proceedings of the 9th ACM symposium on Performance evaluation of wireless ad hoc, sensor, and ubiquitous networks"
mobile_performance,"Exploiting Multi-Cell Battery for Mobile Devices: Design, Management, and Performance",SenSys '17: Proceedings of the 15th ACM Conference on Embedded Network Sensor Systems
mobile_performance,High-performance computing in mobile services,SIGMETRICS '12: Proceedings of the 12th ACM SIGMETRICS/PERFORMANCE joint international conference on Measurement and Modeling of Computer Systems
mobile_performance,Performance Evaluation of a Wireless Network using a VoIP Traffic Generator on a Mobile Device,SAICSIT '14: Proceedings of the Southern African Institute for Computer Scientist and Information Technologists Annual Conference 2014 on SAICSIT 2014 Empowered by Technology
mobile_performance,Mobile-Health Tool Use and Community Health Worker Performance in the Kenyan Context: A Task-Technology Fit Perspective,SAICSIT '14: Proceedings of the Southern African Institute for Computer Scientist and Information Technologists Annual Conference 2014 on SAICSIT 2014 Empowered by Technology
mobile_performance,Effect of FEC mechanisms in the performance of low bit rate codecs in lossy mobile environments,"IPTComm '14: Proceedings of the Conference on Principles, Systems and Applications of IP Telecommunications"
mobile_performance,Session details: Performance of wireless and mobile networks,HP-MOSys '12: Proceedings of the 1st ACM workshop on High performance mobile opportunistic systems
mobile_performance,On the Impact of Mobile Network Delays on Connection Establishment Performance of a Carrier Grade NAT Device,AINTEC '14: Proceedings of the 10th Asian Internet Engineering Conference
mobile_performance,Performance and precision: mobile solutions for high quality engineering drawings,SIGGRAPH '15: ACM SIGGRAPH 2015 Talks
mobile_performance,Performance and precision: mobile solutions for high quality engineering drawings,SIGGRAPH '15: ACM SIGGRAPH 2015 Posters
mobile_performance,High-performance imaging subsystems and their integration in mobile devices,"DATE '13: Proceedings of the Conference on Design, Automation and Test in Europe"
mobile_performance,Comparative performance of human and mobile robotic assistants in collaborative fetch-and-deliver tasks,HRI '14: Proceedings of the 2014 ACM/IEEE international conference on Human-robot interaction
mobile_performance,Examining storage performance on mobile devices,"MobiHeld '11: Proceedings of the 3rd ACM SOSP Workshop on Networking, Systems, and Applications on Mobile Handhelds"
mobile_performance,"Understanding performance of eyes-free, absolute position control on touchable mobile phones",MobileHCI '13: Proceedings of the 15th international conference on Human-computer interaction with mobile devices and services
mobile_performance,Modular performance modelling for mobile applications,ICPE '11: Proceedings of the 2nd ACM/SPEC International Conference on Performance engineering
mobile_performance,Future of mobile software for smartphones and drones: energy and performance,MOBILESoft '17: Proceedings of the 4th International Conference on Mobile Software Engineering and Systems
mobile_performance,Understanding performance modeling for modular mobile-cloud applications,ICPE '12: Proceedings of the 3rd ACM/SPEC International Conference on Performance Engineering
mobile_performance,AppSpeedXray: a mobile application performance measurement tool,SAC '20: Proceedings of the 35th Annual ACM Symposium on Applied Computing
mobile_performance,Mobile network performance evaluation using the radio frequency network channel emulation simulation tool(RFnest™),MobiCom '13: Proceedings of the 19th annual international conference on Mobile computing & networking
mobile_performance,Empirical performance models for P2P and two hops multi-hop cellular networks with mobile relays,PM2HW2N '13: Proceedings of the 8th ACM workshop on Performance monitoring and measurement of heterogeneous wireless and wired networks
mobile_performance,Modular performance modelling for mobile applications (abstracts only),"ACM SIGMETRICS Performance Evaluation Review (SIGMETRICS), Volume 39, Issue 3"
mobile_performance,Network performance of smart mobile handhelds in a university campus WiFi network,IMC '12: Proceedings of the 2012 Internet Measurement Conference
mobile_performance,PAQSIM: Fast Performance Model for Graphics Workload on Mobile GPUs,"LCTES '20: The 21st ACM SIGPLAN/SIGBED Conference on Languages, Compilers, and Tools for Embedded Systems"
mobile_performance,Boosting mobile GPU performance with a decoupled access/execute fragment processor,ISCA '12: Proceedings of the 39th Annual International Symposium on Computer Architecture
mobile_performance,Differentiating Higher and Lower Job Performers in the Workplace Using Mobile Sensing,"Proceedings of the ACM on Interactive, Mobile, Wearable and Ubiquitous Technologies (IMWUT), Volume 3, Issue 2"
mobile_performance,Classification and Performance Analysis of Intra-domain Mobility Management Schemes for Wireless Mesh Network,ICTCS '16: Proceedings of the Second International Conference on Information and Communication Technology for Competitive Strategies
mobile_performance,Performance analysis of certain topology based routing protocols of mobile ad hoc network,RACS '12: Proceedings of the 2012 ACM Research in Applied Computation Symposium
mobile_performance,Performance property prediction supporting variability for adaptive mobile systems,"SPLC '11: Proceedings of the 15th International Software Product Line Conference, Volume 2"
mobile_performance,The performance analysis of ARM NEON technology for mobile platforms,RACS '11: Proceedings of the 2011 ACM Symposium on Research in Applied Computation
mobile_performance,Compute for mobile devices: performance-focused APIs tutorial,SIGGRAPH '15: SIGGRAPH 2015: Studio
mobile_performance,Impact of Traffic and Mobility Patterns on Network Performance in Disaster Scenarios,CHANTS '15: Proceedings of the 10th ACM MobiCom Workshop on Challenged Networks
mobile_performance,Impact of correlated mobility on delay-throughput performance in mobile ad hoc networks,"IEEE/ACM Transactions on Networking (TON), Volume 19, Issue 6"
mobile_performance,Performance evaluation of data intensive mobile healthcare test-bed in a 4G environment,MobileHealth '12: Proceedings of the 2nd ACM international workshop on Pervasive Wireless Healthcare
mobile_performance,Subgoal-labeled instructional material improves performance and transfer in learning to develop mobile applications,ICER '12: Proceedings of the ninth annual international conference on International computing education research
mobile_performance,Performance evaluation of scalable video streaming in multihomed mobile networks,"ACM SIGMETRICS Performance Evaluation Review (SIGMETRICS), Volume 39, Issue 2"
mobile_performance,Performance analysis of dynamic mobility management for proxy mobile IPv6 networks,ICUIMC '11: Proceedings of the 5th International Conference on Ubiquitous Information Management and Communication
mobile_performance,Automatic estimation of performance requirements for software tasks of mobile devices,ICPE '11: Proceedings of the 2nd ACM/SPEC International Conference on Performance engineering
mobile_performance,Performance comparisons of spatial data processing techniques for a large scale mobile phone dataset,COM.Geo '12: Proceedings of the 3rd International Conference on Computing for Geospatial Research and Applications
mobile_performance,Performance Characterization on Mobile Phones for Collaborative Augmented Reality (CAR) Applications,DS-RT '11: Proceedings of the 2011 IEEE/ACM 15th International Symposium on Distributed Simulation and Real Time Applications
mobile_performance,Automatic estimation of performance requirements for software tasks of mobile devices (abstracts only),"ACM SIGMETRICS Performance Evaluation Review (SIGMETRICS), Volume 39, Issue 3"
mobile_performance,"Human Centric Design in Smartcity Technologies: Implications for the Governance, Control and Performance Evaluation of Mobility Ecosystems",WWW '22: Companion Proceedings of the Web Conference 2022
mobile_performance,Revisiting Network Energy Efficiency of Mobile Apps: Performance in the Wild,IMC '15: Proceedings of the 2015 Internet Measurement Conference
mobile_performance,Low-power and high-performance technologies for mobile SoC in LTE era,ISLPED '11: Proceedings of the 17th IEEE/ACM international symposium on Low-power electronics and design
mobile_performance,Performance analysis of a highly available home agent in mobile networks,CNS '11: Proceedings of the 14th Communications and Networking Symposium
mobile_performance,Performance measures of agility for mobile robots,PerMIS '09: Proceedings of the 9th Workshop on Performance Metrics for Intelligent Systems
mobile_performance,Performance analysis of CDMA network for mobile communication,ICWET '10: Proceedings of the International Conference and Workshop on Emerging Trends in Technology
mobile_performance,Mobile microrobot characterization through performance-based competitions,PerMIS '09: Proceedings of the 9th Workshop on Performance Metrics for Intelligent Systems
mobile_performance,Handover performance in the IEEE 802.16 mobile networks,SIMUTools '10: Proceedings of the 3rd International ICST Conference on Simulation Tools and Techniques
mobile_performance,High performance mobile 3D GIS- IVJ/WWJ on Android,COM.Geo '10: Proceedings of the 1st International Conference and Exhibition on Computing for Geospatial Research & Application
mobile_performance,Compute for mobile devices: performance-focused hands-on tutorial,SA '14: SIGGRAPH Asia 2014 Mobile Graphics and Interactive Applications
mobile_performance,Performance analysis of a multicarrier CDMA technique for 4G mobile communication systems,ICWET '11: Proceedings of the International Conference & Workshop on Emerging Trends in Technology
mobile_performance,Empirical performance evaluation of IETF mobile IPv6 and proxy mobile IPv6,"Mobility '08: Proceedings of the International Conference on Mobile Technology, Applications, and Systems"
mobile_performance,Investigating selection and reading performance on a mobile phone while walking,MobileHCI '10: Proceedings of the 12th international conference on Human computer interaction with mobile devices and services
mobile_performance,Comprehensive standard test suites for the performance evaluation of mobile robots,PerMIS '10: Proceedings of the 10th Performance Metrics for Intelligent Systems Workshop
mobile_performance,Mobile projectors versus mobile displays: an assessment of task performance,SAP '12: Proceedings of the ACM Symposium on Applied Perception
mobile_performance,BER performance of OFDM systems in mobile multi-hop relaying channels,IWCMC '10: Proceedings of the 6th International Wireless Communications and Mobile Computing Conference
mobile_performance,DeltaVR: achieving high-performance mobile VR dynamics through pixel reuse,IPSN '19: Proceedings of the 18th International Conference on Information Processing in Sensor Networks
mobile_performance,Mobile phone performance analysis for camera based visual interactions,SAICSIT '09: Proceedings of the 2009 Annual Research Conference of the South African Institute of Computer Scientists and Information Technologists
mobile_performance,Development of low power and high performance application processor (T6G) for multimedia mobile applications,ASPDAC '11: Proceedings of the 16th Asia and South Pacific Design Automation Conference
mobile_performance,Design and performance evaluation of an energy-aware scheduling framework for mobile WiMAX,"MSWIM '10: Proceedings of the 13th ACM international conference on Modeling, analysis, and simulation of wireless and mobile systems"
mobile_performance,"PerfProbe: a systematic, cross-layer performance diagnosis framework for mobile platforms",MOBILESoft '19: Proceedings of the 6th International Conference on Mobile Software Engineering and Systems
mobile_performance,Improving the performance and usability for visual menu interface on mobile computers,AVI '10: Proceedings of the International Conference on Advanced Visual Interfaces
mobile_performance,"Making the Mobile Web Faster: Mobile performance issues? Fix the back end, not just the client.","Queue (QUEUE), Volume 11, Issue 1"
mobile_performance,Session details: Performance modeling and analysis and upper layer design (mobile computing symposium),IWCMC '10: Proceedings of the 6th International Wireless Communications and Mobile Computing Conference
mobile_performance,Performance analysis of dynamic source routing protocol in mobile ad hoc network,ICWET '10: Proceedings of the International Conference and Workshop on Emerging Trends in Technology
mobile_performance,Delay-throughput performance in mobile ad-hoc networks with heterogeneous nodes,"MSWiM '09: Proceedings of the 12th ACM international conference on Modeling, analysis and simulation of wireless and mobile systems"
mobile_performance,Code size and performance optimization for mobile JavaScript just-in-time compiler,INTERACT-14: Proceedings of the 2010 Workshop on Interaction between Compilers and Computer Architecture
mobile_performance,An experimental performance comparison for indexing mobile objects on the plane,MEDES '09: Proceedings of the International Conference on Management of Emergent Digital EcoSystems
mobile_performance,Performance tradeoffs in mobile computing: to fetch or not to fetch?,MobiWac '07: Proceedings of the 5th ACM international workshop on Mobility management and wireless access
mobile_performance,Performance testing based on test-driven development for mobile applications,ICUIMC '09: Proceedings of the 3rd International Conference on Ubiquitous Information Management and Communication
mobile_performance,Mobile robotic surveying performance for planetary surface site characterization,PerMIS '08: Proceedings of the 8th Workshop on Performance Metrics for Intelligent Systems
mobile_performance,Hyper Typer: A Serious Game for Measuring Mobile Text Entry Performance in the Wild,CHI EA '19: Extended Abstracts of the 2019 CHI Conference on Human Factors in Computing Systems
mobile_performance,Measuring the impact of attacks on the performance of mobile ad hoc networks,"PE-WASUN '09: Proceedings of the 6th ACM symposium on Performance evaluation of wireless ad hoc, sensor, and ubiquitous networks"
mobile_performance,Performance modeling of slotted MACA-BI MAC protocol for mobile ad hoc networks,"ICIS '09: Proceedings of the 2nd International Conference on Interaction Sciences: Information Technology, Culture and Human"
mobile_performance,Mobile email as a business performance driver in everyday knowledge work: a diary and interview study,MindTrek '09: Proceedings of the 13th International MindTrek Conference: Everyday Life in the Ubiquitous Era
mobile_performance,Performance analysis of mobile agents tracking,WOSP '07: Proceedings of the 6th international workshop on Software and performance
mobile_performance,Performance enhancement of mobile ad hoc networks using nodal cooperation,WICON '08: Proceedings of the 4th Annual International Conference on Wireless Internet
mobile_performance,Performance assertions for mobile devices,ISSTA '06: Proceedings of the 2006 international symposium on Software testing and analysis
mobile_performance,HAMPER: high-performance adaptive mobile security enhancement against malicious speech and image recognition,ASPDAC '19: Proceedings of the 24th Asia and South Pacific Design Automation Conference
mobile_performance,System-level power/performance evaluation of 3D stacked DRAMs for mobile applications,"DATE '09: Proceedings of the Conference on Design, Automation and Test in Europe"
mobile_performance,Enabling low bitrate mobile visual recognition: a performance versus bandwidth evaluation,MM '13: Proceedings of the 21st ACM international conference on Multimedia
mobile_performance,"Design, development and performance evaluation of reconfigured mobile Android phone for people who are blind or visually impaired",SIGDOC '10: Proceedings of the 28th ACM International Conference on Design of Communication
mobile_performance,Performance analysis of prioritized and non prioritized handoff call queuing schemes in mobile cellular networks,FIT '09: Proceedings of the 7th International Conference on Frontiers of Information Technology
mobile_performance,Performance analysis of game world partitioning methods for multiplayer mobile gaming,NetGames '08: Proceedings of the 7th ACM SIGCOMM Workshop on Network and System Support for Games
mobile_performance,Type I HARQ performance modeling and evaluation of mobile WiMAX for network simulators,IWCMC '09: Proceedings of the 2009 International Conference on Wireless Communications and Mobile Computing: Connecting the World Wirelessly
mobile_performance,Performance evaluation of multi-guard channel schemes in broadband mobile networks,"Mobility '08: Proceedings of the International Conference on Mobile Technology, Applications, and Systems"
mobile_performance,Not Just Privacy: Improving Performance of Private Deep Learning in Mobile Cloud,KDD '18: Proceedings of the 24th ACM SIGKDD International Conference on Knowledge Discovery & Data Mining
mobile_performance,Accurate system-level performance modeling and workload characterization for mobile internet devices,"MEDEA '08: Proceedings of the 9th workshop on MEmory performance: DEaling with Applications, systems and architecture"
mobile_performance,Performance analysis and prediction of physically mobile systems,WOSP '07: Proceedings of the 6th international workshop on Software and performance
mobile_performance,Experimental evaluation of read performance for RFID-based mobile sensor data gathering applications,MUM '08: Proceedings of the 7th International Conference on Mobile and Ubiquitous Multimedia
mobile_performance,ZIPT: Zero-Integration Performance Testing of Mobile App Designs,UIST '17: Proceedings of the 30th Annual ACM Symposium on User Interface Software and Technology
mobile_performance,Mobile pointing task in the physical world: balancing focus and performance while disambiguating,MobileHCI '13: Proceedings of the 15th international conference on Human-computer interaction with mobile devices and services
mobile_performance,Performance study of IMS authentication procedures in mobile 3G networks,IWCMC '07: Proceedings of the 2007 international conference on Wireless communications and mobile computing
mobile_performance,Generalization performance of vision based controllers for mobile robots evolved with genetic programming,GECCO '08: Proceedings of the 10th annual conference on Genetic and evolutionary computation
mobile_performance,Loss network models and multiple metric performance sensitivity analysis for mobile wireless multi-hop networks,WICON '08: Proceedings of the 4th Annual International Conference on Wireless Internet
mobile_performance,"Everything We Do, Everything We Press: Data-Driven Remote Performance Management in a Mobile Workplace",CHI '18: Proceedings of the 2018 CHI Conference on Human Factors in Computing Systems
mobile_performance,An active anycast approach to improve roaming mobile IPv6 client performance in multi-server environment,"Mobility '08: Proceedings of the International Conference on Mobile Technology, Applications, and Systems"
mobile_performance,Performance evaluation of chord in mobile ad hoc networks,MobiShare '06: Proceedings of the 1st international workshop on Decentralized resource sharing in mobile computing and networking
mobile_performance,The effect of user mobility on the traffic performance of mobile WiMAX for multimedia services over the planned cells,"Mobility '08: Proceedings of the International Conference on Mobile Technology, Applications, and Systems"
mobile_performance,Performance evaluation of key exchange using integrity regions in different mobility models,ACWR '11: Proceedings of the 1st International Conference on Wireless Technologies for Humanitarian Relief
mobile_performance,A comparative performance evaluation of inter-domain network-based IP mobility solutions,AINTEC '11: Proceedings of the 7th Asian Internet Engineering Conference
mobile_performance,Performance evaluation and optimization of dual-port SDRAM architecture for mobile embedded systems,"CASES '07: Proceedings of the 2007 international conference on Compilers, architecture, and synthesis for embedded systems"
mobile_performance,Performance evaluation of a DVB-H enabled mobile device system model,WOSP '07: Proceedings of the 6th international workshop on Software and performance
mobile_performance,Ongoing efforts on performance comparison of mobile routers,CoNEXT '05: Proceedings of the 2005 ACM conference on Emerging network experiment and technology
mobile_performance,Tuning query performance in mobile sensor databases,MDM '05: Proceedings of the 6th international conference on Mobile data management
mobile_performance,Crowdsourcing GO: Effect of Worker Situation on Mobile Crowdsourcing Performance,CHI '17: Proceedings of the 2017 CHI Conference on Human Factors in Computing Systems
mobile_performance,Capturing the effects of context on human performance in mobile computing systems,"Personal and Ubiquitous Computing (PUC), Volume 11, Issue 2"
mobile_performance,Improving mobile ad-hoc streaming performance through adaptive layer selection with scalable video coding,MM '07: Proceedings of the 15th ACM international conference on Multimedia
mobile_performance,"Versatile sensing for mobile devices: cost, performance and hardware prototypes",CoRoNet '11: Proceedings of the 3rd ACM workshop on Cognitive radio networks
mobile_performance,SmartSwap: High-Performance and User Experience Friendly Swapping in Mobile Systems,DAC '17: Proceedings of the 54th Annual Design Automation Conference 2017
mobile_performance,A benchmark on soap's transport protocols performance for mobile applications,SAC '06: Proceedings of the 2006 ACM symposium on Applied computing
mobile_performance,The Back End is Only One Part of the Picture: Mobile-Aware Application Performance Monitoring and Problem Diagnosis,VALUETOOLS 2017: Proceedings of the 11th EAI International Conference on Performance Evaluation Methodologies and Tools
mobile_performance,Modeling and performance analysis for wireless mobile networks: a new analytical approach,"IEEE/ACM Transactions on Networking (TON), Volume 13, Issue 5"
mobile_performance,Performance measures of a call admission control in mobile networks using SWN,valuetools '06: Proceedings of the 1st international conference on Performance evaluation methodolgies and tools
mobile_performance,Session details: Mobility modeling and performance evaluation (MoMoPE workshop),IWCMC '10: Proceedings of the 6th International Wireless Communications and Mobile Computing Conference
mobile_performance,"A performance comparison of Mobile IPv6, Hierarchical Mobile IPv6, fast handovers for Mobile IPv6 and their combination","ACM SIGMOBILE Mobile Computing and Communications Review (SIGMOBILE), Volume 7, Issue 4"
mobile_performance,Poster: Application-Layer Optimization of Performance vs Energy in Mobile Network I/O,"MobiSys '17: Proceedings of the 15th Annual International Conference on Mobile Systems, Applications, and Services"
mobile_performance,"mSelf: Using Mobile Sensors to Self-monitor and Improve Health, Wellness, and Performance",WearSys '17: Proceedings of the 2017 Workshop on Wearable Systems and Applications
mobile_performance,Performance analysis of untraceability protocols for mobile agents using an adaptable framework,AAMAS '06: Proceedings of the fifth international joint conference on Autonomous agents and multiagent systems
mobile_performance,Building Cognition-Aware Systems: A Mobile Toolkit for Extracting Time-of-Day Fluctuations of Cognitive Performance,"Proceedings of the ACM on Interactive, Mobile, Wearable and Ubiquitous Technologies (IMWUT), Volume 1, Issue 3"
mobile_performance,Software architecture exploration for high-performance security processing on a multiprocessor mobile SoC,DAC '06: Proceedings of the 43rd annual Design Automation Conference
mobile_performance,A performance analysis of a cache-based file prediction protocol for mobile file systems,"PM2HW2N '06: Proceedings of the ACM international workshop on Performance monitoring, measurement, and evaluation of heterogeneous wireless and wired networks"
mobile_performance,Performance analysis of the mobile IP fast authentication protocol,"MSWiM '04: Proceedings of the 7th ACM international symposium on Modeling, analysis and simulation of wireless and mobile systems"
