keyword,title,publication
mobile_performance,Trinity: High-Performance and Reliable Mobile Emulation through Graphics Projection,"ACM Transactions on Computer Systems (TOCS), Volume 42, Issue 3-4"
mobile_performance,Management And Performance of Multiple Video Decoder Instances in Mobile Devices,MMSys '24: Proceedings of the 15th ACM Multimedia Systems Conference
mobile_performance,Performance Optimization of Mobile Automated Biometric Identification System (MABIS) for Philippine Law Enforcement Agency,ICCDE '24: Proceedings of the 2024 10th International Conference on Computing and Data Engineering
mobile_performance,Evolution of Mobile Networks from 4G to 5G: Architectural Transformations New Services and Enhancement of Key Performance Indicators,"NISS '24: Proceedings of the 7th International Conference on Networking, Intelligent Systems and Security"
mobile_performance,An Empirical Study on the Impact of CSS Prefixes on the Energy Consumption and Performance of Mobile Web Apps,MOBILESoft '24: Proceedings of the IEEE/ACM 11th International Conference on Mobile Software Engineering and Systems
mobile_performance,Mediating Place as Staging Time in “Setting”: Sonic Interactive Mobile Technology as an Art Performance,DIS '23 Companion: Companion Publication of the 2023 ACM Designing Interactive Systems Conference
mobile_performance,Causal impact of Android go on mobile web performance,IMC '22: Proceedings of the 22nd ACM Internet Measurement Conference
mobile_performance,Octopus: Exploiting the Edge Intelligence for Accessible 5G Mobile Performance Enhancement,"IEEE/ACM Transactions on Networking (TON), Volume 31, Issue 6"
mobile_performance,End-to-End Delay Performance for Mobile Cyber-Physical Systems with Edge Computing,"ICNCC '22: Proceedings of the 2022 11th International Conference on Networks, Communication and Computing"
mobile_performance,A City-level High-performance Spatio-temporal Mobility Simulation System,SuMob '23: Proceedings of the 1st ACM SIGSPATIAL International Workshop on Sustainable Mobility
mobile_performance,Mobile WiMAX Network Optimization and Performance Analysis,ICEMIS'21: The 7th International Conference on Engineering & MIS 2021
mobile_performance,Reining in mobile web performance with document and permission policies,HotMobile '22: Proceedings of the 23rd Annual International Workshop on Mobile Computing Systems and Applications
mobile_performance,“Inconsistent Performance”: Understanding Concerns of Real-World Users on Smart Mobile Health Applications Through Analyzing App Reviews,UIST '22 Adjunct: Adjunct Proceedings of the 35th Annual ACM Symposium on User Interface Software and Technology
mobile_performance,Mobile Task Offloading Under Unreliable Edge Performance,"ACM SIGMETRICS Performance Evaluation Review (SIGMETRICS), Volume 48, Issue 4"
mobile_performance,Performance Monitoring for Exercise Movements using Mobile Cameras,BodySys'21: Proceedings of the Workshop on Body-Centric Computing Systems
mobile_performance,Analysis of Performance Improvements and Bias Associated with the Use of Human Mobility Data in COVID-19 Case Prediction Models,"ACM Journal on Computing and Sustainable Societies (ACMJCSS), Volume 1, Issue 2"
mobile_performance,On the Impact of the Critical CSS Technique on the Performance and Energy Consumption of Mobile Browsers,EASE '22: Proceedings of the 26th International Conference on Evaluation and Assessment in Software Engineering
mobile_performance,Towards a Performance Optimization of Mobile Automated Fingerprint Identification System (MAFIS) for the Philippine National Police,ICCAI '22: Proceedings of the 8th International Conference on Computing and Artificial Intelligence
mobile_performance,Police Office Model Performance and Security Evaluation in a Simulated Group of Mobile Robots,ICFNDS '21: Proceedings of the 5th International Conference on Future Networks and Distributed Systems
mobile_performance,On the Impact of Competitive Gameplay on Text Entry Performance - A Study Based on a Mobile Typing Game,CHI EA '22: Extended Abstracts of the 2022 CHI Conference on Human Factors in Computing Systems
mobile_performance,Performance Analysis and Evaluation of Routing Protocols for Mobile Adhoc Networks,IC3-2021: Proceedings of the 2021 Thirteenth International Conference on Contemporary Computing
mobile_performance,Secure Computational Offloading with gRPC: A Performance Evaluation in a Mobile Cloud Computing Environment,DIVANet '21: Proceedings of the 11th ACM Symposium on Design and Analysis of Intelligent Vehicular Networks and Applications
mobile_performance,A Performance Study on MIMO-Beamforming in Railway Environments with In-Band Mobile Relay Node,"CMAAE 2021: 2021 International Conference on Mechanical, Aerospace and Automotive Engineering"
mobile_performance,Performance bottlenecks identification in cloudified mobile networks,MobiCom '20: Proceedings of the 26th Annual International Conference on Mobile Computing and Networking
mobile_performance,"FingerText: Exploring and Optimizing Performance for Wearable, Mobile and One-Handed Typing",CHI '21: Proceedings of the 2021 CHI Conference on Human Factors in Computing Systems
mobile_performance,Timecourses showing mind wandering and heuristic strategies interact complexly to affect SART performance rapidly,ECCE '24: Proceedings of the European Conference on Cognitive Ergonomics 2024
mobile_performance,Online Mobile App Usage as an Indicator of Sleep Behavior and Job Performance,WWW '21: Proceedings of the Web Conference 2021
mobile_performance,QIHE: Quantifying the Importance of Hardware Events with Respect to Performance of Mobile Processors,ICBDC '21: Proceedings of the 6th International Conference on Big Data and Computing
mobile_performance,Effects of activity breakpoints on mobile crowdsourcing task performance,UbiComp/ISWC '20 Adjunct: Adjunct Proceedings of the 2020 ACM International Joint Conference on Pervasive and Ubiquitous Computing and Proceedings of the 2020 ACM International Symposium on Wearable Computers
mobile_performance,Performance of Mobile Users on Side Drawer and Bottom Drawer Menus,MobileHCI '20: 22nd International Conference on Human-Computer Interaction with Mobile Devices and Services
mobile_performance,Robert: An Automated Tool to Perform Mobile Application Test,ICCTA '24: Proceedings of the 2024 10th International Conference on Computer Technology Applications
mobile_performance,Beyond technocentrism: Improving Lower-Achiever's English Listening Performance by Using Mobile-Assisted Language Learning on University of Technology students,ICICM '21: Proceedings of the 11th International Conference on Information Communication and Management
mobile_performance,Outlook of device and assembly technologies enabling high-performance mobile computing: IRDS view (invited),SLIP '20: Proceedings of the Workshop on System-Level Interconnect: Problems and Pathfinding Workshop
mobile_performance,Performance Testing in Mobile Application: a Systematic Literature Map,SBQS '19: Proceedings of the XVIII Brazilian Symposium on Software Quality
mobile_performance,Mobile Network Performance during the COVID-19 Outbreak from a Testbed Perspective,"WiNTECH '20: Proceedings of the 14th International Workshop on Wireless Network Testbeds, Experimental evaluation & Characterization"
mobile_performance,"Global mobile network aggregators: taxonomy, roaming performance and optimization","MobiSys '22: Proceedings of the 20th Annual International Conference on Mobile Systems, Applications and Services"
mobile_performance,Touch-dynamics based Behavioural Biometrics on Mobile Devices – A Review from a Usability and Performance Perspective,"ACM Computing Surveys (CSUR), Volume 53, Issue 6"
mobile_performance,Performance Analysis of Two Different Models with Central Policy of Tracking Area List in Mobile Telecommunication,ICCIP '20: Proceedings of the 6th International Conference on Communication and Information Processing
mobile_performance,Investigating the Correlation between Performance Scores and Energy Consumption of Mobile Web Apps,EASE '20: Proceedings of the 24th International Conference on Evaluation and Assessment in Software Engineering
mobile_performance,Development of mobile academic information system (AIS) UIN Syarif Hidayatullah Jakarta based on Android with performance evaluation based on ISO/ IEC 25010,MoMM '20: Proceedings of the 18th International Conference on Advances in Mobile Computing & Multimedia
mobile_performance,A performance analysis of a mobile parallel mechanism with multi-motion mode,"RICAI '19: Proceedings of the 2019 International Conference on Robotics, Intelligent Control and Artificial Intelligence"
mobile_performance,Measuring mobile text entry performance and behaviour in the wild with a serious game,MUM '19: Proceedings of the 18th International Conference on Mobile and Ubiquitous Multimedia
mobile_performance,Impact of Device Performance on Mobile Internet QoE,IMC '18: Proceedings of the Internet Measurement Conference 2018
mobile_performance,Tortoise or Hare? Quantifying the Effects of Performance on Mobile App Retention,WWW '19: The World Wide Web Conference
mobile_performance,An empirical study of mobile network behavior and application performance in the wild,IWQoS '19: Proceedings of the International Symposium on Quality of Service
mobile_performance,Exploring performance of thumb input for pointing and dragging tasks on mobile device,AsianHCI '19: Proceedings of Asian CHI Symposium 2019: Emerging HCI Research Collection
mobile_performance,Using Computer Simulations to Investigate the Potential Performance of ‘A to B’ Routing Systems for People with Mobility Impairments,MobileHCI '21: Proceedings of the 23rd International Conference on Mobile Human-Computer Interaction
mobile_performance,Optimal performance of the opportunistic scheduling in new generation mobile systems,ICSDE'18: Proceedings of the 2nd International Conference on Smart Digital Environment
mobile_performance,Analysis of Performance and Energy Consumption of Wearable Devices and Mobile Gateways in IoT Applications,COINS '19: Proceedings of the International Conference on Omni-Layer Intelligent Systems
mobile_performance,An In-depth Analysis of the Impact of Battery Usage Patterns on Performance of Task Allocation Algorithms in Sparse Mobile Crowdsensing,"MSWIM '19: Proceedings of the 22nd International ACM Conference on Modeling, Analysis and Simulation of Wireless and Mobile Systems"
mobile_performance,An In-depth Analysis of the Impact of Battery Usage Patterns on Performance of Task Allocation Algorithms in Sparse Mobile Crowdsensing,"MSWIM '19: Proceedings of the 22nd International ACM Conference on Modeling, Analysis and Simulation of Wireless and Mobile Systems"
mobile_performance,A performance evaluation of cross-platform mobile application development approaches,MOBILESoft '18: Proceedings of the 5th International Conference on Mobile Software Engineering and Systems
mobile_performance,Analysis and Modeling of Grid Performance on Touchscreen Mobile Devices,CHI '18: Proceedings of the 2018 CHI Conference on Human Factors in Computing Systems
mobile_performance,A Performance Evaluation of Time-Series Mobility Prediction for Connected Vehicular Networks,Q2SWinet '20: Proceedings of the 16th ACM Symposium on QoS and Security for Wireless and Mobile Networks
mobile_performance,Predicting the performance of virtual reality video streaming in mobile networks,MMSys '18: Proceedings of the 9th ACM Multimedia Systems Conference
mobile_performance,Context-Aware Hierarchical Online Learning for Performance Maximization in Mobile Crowdsourcing,"IEEE/ACM Transactions on Networking (TON), Volume 26, Issue 3"
mobile_performance,ABT: Mobile Solution for Computer Assisted Boxing Training.: Using smartphones to measure and track boxers’ performance while training.,ICSIE '21: Proceedings of the 10th International Conference on Software and Information Engineering
mobile_performance,Analyzing the Relationship between Cognitive Performance and Time to Find Intended Mobile App,UbiComp '18: Proceedings of the 2018 ACM International Joint Conference and 2018 International Symposium on Pervasive and Ubiquitous Computing and Wearable Computers
mobile_performance,Session details: PAPER SESSION 8: Mobile Performance,"MobiSys '17: Proceedings of the 15th Annual International Conference on Mobile Systems, Applications, and Services"
mobile_performance,Exploring the effects of ad schemes on the performance cost of mobile phones,A-Mobile 2018: Proceedings of the 1st International Workshop on Advances in Mobile App Analysis
mobile_performance,A Mobile Network Performance Evaluation Method Based on Multivariate Time Series Clustering with Auto-Encoder,ICTCE '18: Proceedings of the 2nd International Conference on Telecommunications and Communication Engineering
mobile_performance,Performance Evaluation of OLSR and AODV Routing Protocols with different Parameters in Mobile Ad-hoc Networks using NS2 Simulator,ICCTA '19: Proceedings of the 2019 5th International Conference on Computer and Technology Applications
mobile_performance,"Performance Modeling, Analysis, and Optimization of Delayed Mobile Data Offloading for Mobile Users","IEEE/ACM Transactions on Networking (TON), Volume 25, Issue 1"
mobile_performance,Diagnosis of Privacy and Performance Problems in the Context of Mobile Applications,ICPE '18: Companion of the 2018 ACM/SPEC International Conference on Performance Engineering
mobile_performance,Performance-based guidelines for energy efficient mobile applications,MOBILESoft '17: Proceedings of the 4th International Conference on Mobile Software Engineering and Systems
mobile_performance,Influence of the use of educational apps on smart mobile devices in the academic performance of students,ICETC '18: Proceedings of the 10th International Conference on Education Technology and Computers
mobile_performance,Performance Analysis of Game Engines on Mobile and Fixed Devices,"ACM Transactions on Multimedia Computing, Communications, and Applications (TOMM), Volume 13, Issue 4"
mobile_performance,"Communications-based Formation Control of Mobile Robots: Modeling, Analysis and Performance Evaluation","MSWiM '20: Proceedings of the 23rd International ACM Conference on Modeling, Analysis and Simulation of Wireless and Mobile Systems"
mobile_performance,End-to-End Millimeter-Wave Network Performance and Mobility Management Overhead in Urban Cellular Deployments with Realistic Pedestrian Traffic and Blockages,MobiWac '20: Proceedings of the 18th ACM Symposium on Mobility Management and Wireless Access
mobile_performance,Improved Mobile Robot Programming Performance through Real-time Program Assessment,ITiCSE '17: Proceedings of the 2017 ACM Conference on Innovation and Technology in Computer Science Education
mobile_performance,DAPPER: Label-Free Performance Estimation after Personalization for Heterogeneous Mobile Sensing,"Proceedings of the ACM on Interactive, Mobile, Wearable and Ubiquitous Technologies (IMWUT), Volume 7, Issue 2"
mobile_performance,Optimization of Webpage Downloading Performance with Content-aware Mobile Edge Computing,MECOMM '17: Proceedings of the Workshop on Mobile Edge Communications
mobile_performance,Energy and Performance Efficient Computation Offloading for Deep Neural Networks in a Mobile Cloud Computing Environment,GLSVLSI '18: Proceedings of the 2018 Great Lakes Symposium on VLSI
mobile_performance,Characterization and Evaluation of Mobile CrowdSensing Performance and Energy Indicators,"ACM SIGMETRICS Performance Evaluation Review (SIGMETRICS), Volume 44, Issue 4"
mobile_performance,"A Method and a Tool for Commercial Performance Evaluation of a Company: The case of a ""Mobile Telephony Operator""",ICIST '20: Proceedings of the 10th International Conference on Information Systems and Technologies
mobile_performance,Providing Sustainable Performance in Thermally Constrained Mobile Devices,ESTIMedia'16: Proceedings of the 14th ACM/IEEE Symposium on Embedded Systems for Real-Time Multimedia
mobile_performance,Session details: Fresh Insights and Directions for Mobile Performance Testing,HotMobile '17: Proceedings of the 18th International Workshop on Mobile Computing Systems and Applications
mobile_performance,Performance of Decision Feedback Differential Detection for ADQAM-OFDM in High Mobility Environments,ICITEE '19: Proceedings of the 2nd International Conference on Information Technologies and Electrical Engineering
mobile_performance,Differences in Crowdsourced vs. Lab-based Mobile and Desktop Input Performance Data,CHI '17: Proceedings of the 2017 CHI Conference on Human Factors in Computing Systems
mobile_performance,Comparing performance parameters of mobile app development strategies,MOBILESoft '16: Proceedings of the International Conference on Mobile Software Engineering and Systems
mobile_performance,Exploring Heterogeneous-ISA Core Architectures for High-Performance and Energy-Efficient Mobile SoCs,GLSVLSI '17: Proceedings of the Great Lakes Symposium on VLSI 2017
mobile_performance,An In-depth Study of Mobile Browser Performance,WWW '16: Proceedings of the 25th International Conference on World Wide Web
mobile_performance,Performance Assessment of an Extremely Challenged Mobile Infrastructure Network over the Oceans,ICDCN '17: Proceedings of the 18th International Conference on Distributed Computing and Networking
mobile_performance,Session details: Mobile performance,UbiComp '14: Proceedings of the 2014 ACM International Joint Conference on Pervasive and Ubiquitous Computing
mobile_performance,Improving mobile gaming performance through cooperative CPU-GPU thermal management,DAC '16: Proceedings of the 53rd Annual Design Automation Conference
mobile_performance,Romou: rapidly generate high-performance tensor kernels for mobile GPUs,MobiCom '22: Proceedings of the 28th Annual International Conference on Mobile Computing And Networking
mobile_performance,Impact of mobile tangible slider design and its reachability on pointing performance,IHM '16: Actes de la 28ième conference francophone sur l'Interaction Homme-Machine
mobile_performance,An anatomy of mobile web performance over multipath TCP,CoNEXT '15: Proceedings of the 11th ACM Conference on Emerging Networking Experiments and Technologies
mobile_performance,Die Neukoms. Local streamed live-performance with mobile devices.,AM '15: Proceedings of the Audio Mostly 2015 on Interaction With Sound
mobile_performance,Measurement and Analysis of Mobile Web Cache Performance,WWW '15: Proceedings of the 24th International Conference on World Wide Web
mobile_performance,Improving the Performance of Mobile Phone Crowdsourcing Applications,AAMAS '15: Proceedings of the 2015 International Conference on Autonomous Agents and Multiagent Systems
mobile_performance,Muzeel: assessing the impact of JavaScript dead code elimination on mobile web performance,IMC '22: Proceedings of the 22nd ACM Internet Measurement Conference
mobile_performance,Performance and Cost Effectiveness of Caching in Mobile Access Networks,ACM-ICN '15: Proceedings of the 2nd ACM Conference on Information-Centric Networking
mobile_performance,Performance study of cloud computing back-end solutions for mobile applications,UCC '15: Proceedings of the 8th International Conference on Utility and Cloud Computing
mobile_performance,Rethinking Energy-Performance Trade-Off in Mobile Web Page Loading,MobiCom '15: Proceedings of the 21st Annual International Conference on Mobile Computing and Networking
mobile_performance,"Extending Urban Air Quality Maps Beyond the Coverage of a Mobile Sensor Network: Data Sources, Methods, and Performance Evaluation",EWSN ’17: Proceedings of the 2017 International Conference on Embedded Wireless Systems and Networks
mobile_performance,Mobile devices as interfaces for steering cloud-based high-performance computations,MobileDeLi 2015: Proceedings of the 3rd International Workshop on Mobile Development Lifecycle
mobile_performance,Augmenting live performance dance through mobile technology,"BCS-HCI '14: Proceedings of the 28th International BCS Human Computer Interaction Conference on HCI 2014 - Sand, Sea and Sky - Holiday HCI"
mobile_performance,OpenCV Performance Measurements on Mobile Devices,ICMR '14: Proceedings of International Conference on Multimedia Retrieval
mobile_performance,Power-Performance Modelling of Mobile Gaming Workloads on Heterogeneous MPSoCs,DAC '15: Proceedings of the 52nd Annual Design Automation Conference
mobile_performance,Investigating mobile crowdsensing application performance,DIVANet '13: Proceedings of the third ACM international symposium on Design and analysis of intelligent vehicular networks and applications
mobile_performance,Effects of Different Types of Feedback of a Mobile Assisted Learning Application on Linear Equations on Students' Mathematics Performance,MoMM '16: Proceedings of the 14th International Conference on Advances in Mobile Computing and Multi Media
mobile_performance,"Performance-optimized pages' architecture, navigation and images techniques for JQuery mobile sites",PCI '15: Proceedings of the 19th Panhellenic Conference on Informatics
mobile_performance,Rules for mobile performance optimization,"Communications of the ACM (CACM), Volume 56, Issue 8"
mobile_performance,Development of chair with improved mobility performance,i-CREATe '17: Proceedings of the 11th International Convention on Rehabilitation Engineering and Assistive Technology
mobile_performance,Session details: Mobile performance,IMC '12: Proceedings of the 2012 Internet Measurement Conference
mobile_performance,Towards understanding TCP performance on LTE/EPC mobile networks,"AllThingsCellular '14: Proceedings of the 4th workshop on All things cellular: operations, applications, & challenges"
mobile_performance,Designing a high-performance mobile cloud web browser,WWW '14 Companion: Proceedings of the 23rd International Conference on World Wide Web
mobile_performance,A First Look at Performance in Mobile Virtual Network Operators,IMC '14: Proceedings of the 2014 Conference on Internet Measurement Conference
mobile_performance,POSTER: Performance signatures of mobile phone browsers,CCS '13: Proceedings of the 2013 ACM SIGSAC conference on Computer & communications security
mobile_performance,Performance Comparison of MANET Routing Protocol based on RandomWaypoint Mobility Model,CSAI '17: Proceedings of the 2017 International Conference on Computer Science and Artificial Intelligence
mobile_performance,Measuring the client performance and energy consumption in mobile cloud gaming,NetGames '14: Proceedings of the 13th Annual Workshop on Network and Systems Support for Games
mobile_performance,Reasoning about mobile malware using high performance computing based population scale models,WSC '14: Proceedings of the 2014 Winter Simulation Conference
mobile_performance,Leveraging diversity to optimize performance in mobile networks,CoNEXT Student Workhop '13: Proceedings of the 2013 workshop on Student workhop
mobile_performance,An assistive mobile platform for delivering knowledge of performance feedback,PervasiveHealth '14: Proceedings of the 8th International Conference on Pervasive Computing Technologies for Healthcare
mobile_performance,Using a mobile app to improve performance of management of services orders and teams processes,CompSysTech '15: Proceedings of the 16th International Conference on Computer Systems and Technologies
mobile_performance,Improving Performance of Rural Supply Chains Using Mobile Phones: Reducing Information Asymmetry to Improve Stock Availability in Low-resource Environments,ACM DEV-5 '14: Proceedings of the Fifth ACM Symposium on Computing for Development
mobile_performance,Power-efficient and high-performance block I/O framework for mobile virtualization systems,IMCOM '15: Proceedings of the 9th International Conference on Ubiquitous Information Management and Communication
mobile_performance,Rules for Mobile Performance Optimization: An overview of techniques to speed page loading,"Queue (QUEUE), Volume 11, Issue 6"
mobile_performance,Evaluating mobile web search performance by taking good abandonment into account,SIGIR '14: Proceedings of the 37th international ACM SIGIR conference on Research & development in information retrieval
mobile_performance,Performance analysis with dynamic beam control using millimeter-wave band on 5G mobile communications,IMCOM '15: Proceedings of the 9th International Conference on Ubiquitous Information Management and Communication
mobile_performance,Session details: Performance of wireless and mobile opportunistic networks,HP-MOSys '13: Proceedings of the 2nd ACM workshop on High performance mobile opportunistic systems
mobile_performance,Performance Evaluation Considering the Capture Effect in Ad hoc Networks on User Cooperative Mobility for QoS Improvement,IMCOM '18: Proceedings of the 12th International Conference on Ubiquitous Information Management and Communication
mobile_performance,WebOptProfiler: Providing performance clarity for Mobile Webpage Optimizations,HotMobile '21: Proceedings of the 22nd International Workshop on Mobile Computing Systems and Applications
mobile_performance,Performance Evaluation of the VB-TDMA Protocol for Long-term Tracking and Monitoring of Mobile Entities in the Outdoors,Q2SWinet '15: Proceedings of the 11th ACM Symposium on QoS and Security for Wireless and Mobile Networks
mobile_performance,Orchestrating mobile application execution for performance and energy efficiency,"SPLASH '13: Proceedings of the 2013 companion publication for conference on Systems, programming, & applications: software for humanity"
mobile_performance,Network Performance Measurement Framework for Real-Time Multiplayer Mobile Games,NetGames '13: Proceedings of Annual Workshop on Network and Systems Support for Games
