keyword,title,publication
smartphone_launch,Smartphone application launch with smarter scheduling,UbiComp '14 Adjunct: Proceedings of the 2014 ACM International Joint Conference on Pervasive and Ubiquitous Computing: Adjunct Publication
smartphone_launch,Improving Application Launch Performance in Smartphones Using Recurrent Neural Network,ICMLT '18: Proceedings of the 2018 International Conference on Machine Learning Technologies
smartphone_launch,Establishing Smartphone User Behavior Model Based on Energy Consumption Data,"ACM Transactions on Knowledge Discovery from Data (TKDD), Volume 16, Issue 2"
smartphone_launch,MagAttack: Guessing Application Launching and Operation via Smartphone,Asia CCS '19: Proceedings of the 2019 ACM Asia Conference on Computer and Communications Security
smartphone_launch,Use octopus launcher like your hands: joystick-based smartphone control solution for motor impaired people in electric wheelchairs,CHI EA '14: CHI '14 Extended Abstracts on Human Factors in Computing Systems
smartphone_launch,Lost and Found!: associating target persons in camera surveillance footage with smartphone identifiers,"MobiSys '21: Proceedings of the 19th Annual International Conference on Mobile Systems, Applications, and Services"
smartphone_launch,"Oh app, where art thou?: on app launching habits of smartphone users",MobileHCI '13: Proceedings of the 15th international conference on Human-computer interaction with mobile devices and services
