keyword,title,publication
android_latency,A Survey on Real-Time Application Latency Based on Android OS,2018 Fourth International Conference on Computing Communication Control and Automation (ICCUBEA)
android_latency,Reducing latency for an Android-based VoIP phone,2018 7th International Symposium on Next Generation Electronics (ISNE)
android_latency,ShuffleDog: Characterizing and Adapting User-Perceived Latency of Android Apps,IEEE Transactions on Mobile Computing
android_latency,Low latency live video streaming on android devices using web-socket,"2017 8th International Conference on Computing, Communication and Networking Technologies (ICCCNT)"
android_latency,Latency Reduction in Real-time GPS tracking in Android and the Web-based GPS Monitoring System,"2022 12th International Conference on Dependable Systems, Services and Technologies (DESSERT)"
