keyword,title,publication
mobile_memory,"Mantis: Efficient Predictions of Execution Time, Energy Usage, Memory Usage and Network Usage on Smart Mobile Devices",IEEE Transactions on Mobile Computing
mobile_memory,Digital Memories Based Mobile User Authentication for IoT,"2015 IEEE International Conference on Computer and Information Technology; Ubiquitous Computing and Communications; Dependable, Autonomic and Secure Computing; Pervasive Intelligence and Computing"
mobile_memory,DABC-NV: A buffer cache architecture for mobile systems with heterogeneous flash memories,IEEE Transactions on Consumer Electronics
mobile_memory,A Spiking Neural Network with dynamic memory for a real autonomous mobile robot in dynamic environment,2008 IEEE International Joint Conference on Neural Networks (IEEE World Congress on Computational Intelligence)
mobile_memory,Offline Mobile Instance Retrieval with a Small Memory Footprint,2013 IEEE International Conference on Computer Vision
mobile_memory,Virtual memory partitioning for enhancing application performance in mobile platforms,IEEE Transactions on Consumer Electronics
mobile_memory,Characterization of process-induced mobile ions on the data retention in flash memory,IEEE Transactions on Electron Devices
mobile_memory,Unified embedded non-volatile memory for emerging mobile markets,2014 IEEE/ACM International Symposium on Low Power Electronics and Design (ISLPED)
mobile_memory,Memory-aware cooperative CPU-GPU DVFS governor for mobile games,2015 13th IEEE Symposium on Embedded Systems For Real-time Multimedia (ESTIMedia)
mobile_memory,Morphable Resistive Memory Optimization for Mobile Virtualization,IEEE Transactions on Computer-Aided Design of Integrated Circuits and Systems
mobile_memory,A Reconfigurable SIMT Processor for Mobile Ray Tracing With Contention Reduction in Shared Memory,IEEE Transactions on Circuits and Systems I: Regular Papers
mobile_memory,An energy and memory-efficient key management scheme for mobile heterogeneous sensor networks,2011 6th International Conference on Risks and Security of Internet and Systems (CRiSIS)
mobile_memory,Improved Nonlinear Finite-Memory Estimation Approach for Mobile Robot Localization,IEEE/ASME Transactions on Mechatronics
mobile_memory,An In-Memory Analog Computing Co-Processor for Energy-Efficient CNN Inference on Mobile Devices,2021 IEEE Computer Society Annual Symposium on VLSI (ISVLSI)
mobile_memory,Experimental Results on the Impact of Memory in Neural Networks for Spectrum Prediction in Land Mobile Radio Bands,IEEE Transactions on Cognitive Communications and Networking
mobile_memory,Viewer-Aware Intelligent Efficient Mobile Video Embedded Memory,IEEE Transactions on Very Large Scale Integration (VLSI) Systems
mobile_memory,Active Disturbance Rejection Controller for a Flexible Walking Bioinspired Inchworm Mobile Robot Actuated With Shape Memory Alloy Devices,IEEE Transactions on Control Systems Technology
mobile_memory,SPIDER: Sizing-Priority-Based Application-Driven Memory for Mobile Video Applications,IEEE Transactions on Very Large Scale Integration (VLSI) Systems
mobile_memory,OpenMem: Hardware/Software Cooperative Management for Mobile Memory System,2021 58th ACM/IEEE Design Automation Conference (DAC)
mobile_memory,Implications of Short Term Memory Research for the Design of Spaced Repetition Based Mobile Learning Games,2015 IEEE International Symposium on Multimedia (ISM)
mobile_memory,Content-Adaptive Memory for Viewer-Aware Energy-Quality Scalable Mobile Video Systems,IEEE Access
mobile_memory,Mobile Robot Path Planners With Memory for Mobility Diversity Algorithms,IEEE Transactions on Robotics
mobile_memory,Mocktails: Capturing the Memory Behaviour of Proprietary Mobile Architectures,2020 ACM/IEEE 47th Annual International Symposium on Computer Architecture (ISCA)
mobile_memory,On-Chip Memory Technology Design Space Explorations for Mobile Deep Neural Network Accelerators,2019 56th ACM/IEEE Design Automation Conference (DAC)
mobile_memory,Energy-Efficient Control of Mobile Processors Based on Long Short-Term Memory,IEEE Access
mobile_memory,Capturing and sharing human digital memories with the aid of ubiquitous Peer-to-Peer mobile services,2012 IEEE International Conference on Pervasive Computing and Communications Workshops
mobile_memory,3DICT: A Reliable and QoS Capable Mobile Process-In-Memory Architecture for Lookup-based CNNs in 3D XPoint ReRAMs,2018 IEEE/ACM International Conference on Computer-Aided Design (ICCAD)
mobile_memory,Wheeled mobile robots navigation from a visual memory using wide field of view cameras,2010 IEEE/RSJ International Conference on Intelligent Robots and Systems
mobile_memory,FSLRU: a page cache algorithm for mobile devices with hybrid memory architecture,IEEE Transactions on Consumer Electronics
mobile_memory,A 22-nm 1-Mb 1024-b Read Data-Protected STT-MRAM Macro With Near-Memory Shift-and-Rotate Functionality and 42.6-GB/s Read Bandwidth for Security-Aware Mobile Device,IEEE Journal of Solid-State Circuits
mobile_memory,"Co-Optimizing CPU Voltage, Memory Placement, and Task Offloading for Energy-Efficient Mobile Systems",IEEE Internet of Things Journal
mobile_memory,Memory-Aware Active Learning in Mobile Sensing Systems,IEEE Transactions on Mobile Computing
mobile_memory,Balloonfish: Utilizing morphable resistive memory in mobile virtualization,The 20th Asia and South Pacific Design Automation Conference
mobile_memory,In-memory write-ahead logging for mobile smart devices with NVRAM,IEEE Transactions on Consumer Electronics
mobile_memory,Coping with limited on-board memory and communication bandwidth in mobile-robot systems,"IEEE Transactions on Systems, Man, and Cybernetics"
mobile_memory,Recognition of 3D dynamic environments for mobile robot by selective memory intake and release of data from 2D sensors,2012 IEEE/SICE International Symposium on System Integration (SII)
mobile_memory,DIPLOMA: Consistent and coherent shared memory over mobile phones,2012 IEEE 30th International Conference on Computer Design (ICCD)
mobile_memory,Repetitive memorization mobile application development for elderly memory recall,"2014 IEEE Conference on e-Learning, e-Management and e-Services (IC3e)"
mobile_memory,Optimizing low memory killers for mobile devices using reinforcement learning,2017 13th International Wireless Communications and Mobile Computing Conference (IWCMC)
mobile_memory,A 512 Mb Two-Channel Mobile DRAM (OneDRAM) With Shared Memory Array,IEEE Journal of Solid-State Circuits
mobile_memory,Buffer Sizes Reduction for Memory-efficient CNN Inference on Mobile and Embedded Devices,2020 23rd Euromicro Conference on Digital System Design (DSD)
mobile_memory,MELOC: Memory and Location Optimized Caching Model for Small Mobile Ad Hoc Networks,2012 IEEE 13th International Conference on Mobile Data Management
mobile_memory,WAM: Wear wear-out-aware memory management for SCRAM-based low power mobile systems,IEEE Transactions on Consumer Electronics
mobile_memory,A Differentiating Receiver With a Transition-Detecting DFE for Dual-Rank Mobile Memory Interface,IEEE Access
mobile_memory,MobileSwap: Cross-Device Memory Swapping for Mobile Devices,2021 58th ACM/IEEE Design Automation Conference (DAC)
mobile_memory,A 10 Gb/s/pin Single-Ended Transmitter With Reflection-Aided Duobinary Modulation for Dual-Rank Mobile Memory Interfaces,IEEE Transactions on Circuits and Systems I: Regular Papers
mobile_memory,Tarmac: a language system substrate based on mobile memory,"Proceedings.,10th International Conference on Distributed Computing Systems"
mobile_memory,H-BILSTM: A Novel Bidirectional Long Short Term Memory Network Based Intelligent Early Warning Scheme in Mobile Edge Computing (MEC),IEEE Transactions on Emerging Topics in Computing
mobile_memory,"Modeling of an Efficient Low Cost, Tree Based Data Service Quality Management for Mobile Operators Using in-Memory Big Data Processing and Business Intelligence use Cases","2018 International Conference on Advances in Big Data, Computing and Data Communication Systems (icABCD)"
mobile_memory,Impacts of Memory Address Mapping Scheme on Reducing DRAM Self-Refresh Power for Mobile Computing Devices,IEEE Access
mobile_memory,CNNP-v2: A Memory-Centric Architecture for Low-Power CNN Processor on Domain-Specific Mobile Devices,IEEE Journal on Emerging and Selected Topics in Circuits and Systems
mobile_memory,FruitVegCNN: Power- and Memory-Efficient Classification of Fruits & Vegetables Using CNN in Mobile MPSoC,2020 IEEE 17th India Council International Conference (INDICON)
mobile_memory,On mobile Java memory consumption,"14th Euromicro International Conference on Parallel, Distributed, and Network-Based Processing (PDP'06)"
mobile_memory,A Thread-Oriented Memory Resource Management Framework for Mobile Edge Computing,IEEE Access
mobile_memory,Link level ARQ for satellite-mobile communications over blockage channels with memory,"IEEE MILCOM 2004. Military Communications Conference, 2004."
mobile_memory,C-RAM: Breaking Mobile Device Memory Barriers Using the Cloud,IEEE Transactions on Mobile Computing
mobile_memory,Enhanced Air Quality Inference via Multi-View Learning With Mobile Sensing Memory,IEEE Access
mobile_memory,Associative memory for modified Petri-net based monitoring of mobile robot navigation,2012 First International Conference on Innovative Engineering Systems
mobile_memory,Efficient reuse of local regions in memory-limited mobile devices,IEEE Transactions on Consumer Electronics
mobile_memory,MEC-DA: Memory-Efficient Collaborative Domain Adaptation for Mobile Edge Devices,IEEE Transactions on Mobile Computing
mobile_memory,Enabling Grassroots Communication: A Memory-Aided Broadcast Mechanism for a Community Radio Service on an Ad hoc Device-to-Device Mobile Network,IEEE Transactions on Communications
mobile_memory,Approximating Memory-bound Applications on Mobile GPUs,2019 International Conference on High Performance Computing & Simulation (HPCS)
mobile_memory,In-memory file system with efficient swap support for mobile smart devices,IEEE Transactions on Consumer Electronics
mobile_memory,Energy Efficient Mobile Service Computing With Differential Spintronic-C-Elements: A Logic-in-Memory Asynchronous Computing Paradigm,IEEE Access
mobile_memory,Distributed Frobenius-Norm Finite Memory Interacting Multiple Model Estimation for Mobile Robot Localization,IEEE Access
mobile_memory,Mobile Memory Systems,2015 Mobile Systems Technologies Workshop (MST)
mobile_memory,Experimental analysis of energy consumption by MobileDDR memory for mobile applications,2008 IEEE International Symposium on Industrial Electronics
mobile_memory,Hardware/Software Co-Design of Memory Page Translation for Mobile Virtualization,IEEE Transactions on Computers
mobile_memory,Self-stabilized Flocking of a Group of Mobile Robots under Memory Corruption,2009 International Conference on Network-Based Information Systems
mobile_memory,Towards context-aware mobile services through the use of Hierarchical Temporal Memory,"2013 21st International Conference on Software, Telecommunications and Computer Networks - (SoftCOM 2013)"
mobile_memory,Designing a mobile augmented memory system for people with Traumatic Brain Injuries,2014 5th IEEE Conference on Cognitive Infocommunications (CogInfoCom)
mobile_memory,Efficient Processing of MLPerf Mobile Workloads Using Digital Compute-In-Memory Macros,IEEE Transactions on Computer-Aided Design of Integrated Circuits and Systems
mobile_memory,Remote AppBus - Enabling Seamless Access to Short Term Memory on Mobile Devices,2009 6th IEEE Consumer Communications and Networking Conference
mobile_memory,Flexible and Efficient Memory Swapping Across Mobile Devices With LegoSwap,IEEE Transactions on Parallel and Distributed Systems
mobile_memory,Memory Efficient Local Features Descriptor for Identity Document Detection on Mobile and Embedded Devices,IEEE Access
mobile_memory,Memory Training Interface for Elderly based on Mobile APP,2022 International Conference and Exposition on Electrical And Power Engineering (EPE)
mobile_memory,Foldable Dual-Band Monopole Antenna Using Nitinol Memory Alloy and Flexible Substrate for Satellite Mobile Terminals and Walkie-Talkies,IEEE Transactions on Antennas and Propagation
mobile_memory,Secure Event-Triggered Distributed Finite-Memory Localization for Multiple Mobile Robots Under Cyberattacks,IEEE Transactions on Industrial Electronics
mobile_memory,ShuffleVITNet: Mobile-Friendly Vision Transformer With Less-Memory,2024 International Joint Conference on Neural Networks (IJCNN)
mobile_memory,Mobile-Subjective Programming for massively multithreaded shared memory applications,2010 IEEE International Conference On Cluster Computing Workshops and Posters (CLUSTER WORKSHOPS)
mobile_memory,A Behavioural Decision-Making Model of Learning and Memory for Mobile Robot Triggered by Curiosity,IEEE Transactions on Cognitive and Developmental Systems
mobile_memory,Cognitive Navigation for Intelligent Mobile Robots: A Learning-Based Approach with Topological Memory Configuration,IEEE/CAA Journal of Automatica Sinica
mobile_memory,A statecharts — Based software development process for implementing atomic read/ write shared memory in mobile ad hoc network,2010 The 7th International Conference on Informatics and Systems (INFOS)
mobile_memory,A Low-memory Mobile Phone Continuous Authentication Scheme Based on Multimodal Biometric Information,"2024 2nd International Conference On Mobile Internet, Cloud Computing and Information Security (MICCIS)"
mobile_memory,Transparently Exploiting Device-Reserved Memory for Application Performance in Mobile Systems,IEEE Transactions on Mobile Computing
mobile_memory,Recognizing Video Resolution by Monitoring Memory Metrics in Mobile Clients,2019 Fourth International Conference on Fog and Mobile Edge Computing (FMEC)
mobile_memory,Quantifying Daily Evolution of Mobile Software Based on Memory Allocator Churn,2022 IEEE/ACM 9th International Conference on Mobile Software Engineering and Systems (MobileSoft)
mobile_memory,Implementation of a platform-agnostic working memory span task using mobile device technology,2016 IEEE Wireless Health (WH)
mobile_memory,Enabling Mobile Device Coordination over Distributed Shared Memory,2016 IEEE 22nd International Conference on Parallel and Distributed Systems (ICPADS)
mobile_memory,Modified Long Short Term Memory-Puzzle Optimization Algorithm for Task Offloading Prediction in Mobile Edge Computing,2023 9th International Conference on Smart Structures and Systems (ICSSS)
mobile_memory,"A context aware, mobile system providing memory support for ageing people",2011 Proceedings of the 34th International Convention MIPRO
mobile_memory,Mobi-PMFS: An Efficient and Durable In-Memory File System for Mobile Devices,"2020 IEEE 44th Annual Computers, Software, and Applications Conference (COMPSAC)"
mobile_memory,Static memory management for efficient mobile sensing applications,2015 International Conference on Embedded Software (EMSOFT)
mobile_memory,A Memory and Computation Efficient Local Stereo Algorithm Suited for Mobile Robot Applications,"2020 IEEE International Conference on Signal Processing, Communications and Computing (ICSPCC)"
mobile_memory,An Effective Sensor Filtering Model for Mobile Devices Based on Long Short-Term Memory Technique in Sensor Archives,2023 International Conference on Artificial Intelligence and Knowledge Discovery in Concurrent Engineering (ICECONF)
mobile_memory,Memory Technologies for Mobile Era,2005 IEEE Asian Solid-State Circuits Conference
mobile_memory,"Cool Chips, Mobile Devices, Memory, and IEEE Micro Going Digital",Erik R. Altman
