keyword,title,publication
smartphone_performance,Tapping Task Performance on Smartphones in Cold Temperature,Interacting with Computers
smartphone_performance,Are smartphones suited for DTN networking? A methodological teardown of smartphones' WiFi performance,"2015 13th International Symposium on Modeling and Optimization in Mobile, Ad Hoc, and Wireless Networks (WiOpt)"
smartphone_performance,GNSS Precise Point Positioning with Android Smartphones and Comparison with High Performance Receivers,"2019 IEEE International Conference on Signal, Information and Data Processing (ICSIDP)"
smartphone_performance,23.3 A highly integrated smartphone SoC featuring a 2.5GHz octa-core CPU with advanced high-performance and low-power techniques,2015 IEEE International Solid-State Circuits Conference - (ISSCC) Digest of Technical Papers
smartphone_performance,A Case Study of Automating User Experience-Oriented Performance Testing on Smartphones,"2013 IEEE Sixth International Conference on Software Testing, Verification and Validation"
smartphone_performance,Implementation and performance analysis of smartphone-based 3D PDR system with hybrid motion and heading classifier,"2014 IEEE/ION Position, Location and Navigation Symposium - PLANS 2014"
smartphone_performance,Differential performance of automatic speech-based depression classification across smartphones,2017 Seventh International Conference on Affective Computing and Intelligent Interaction Workshops and Demos (ACIIW)
smartphone_performance,2.5 A 7nm FinFET 2.5GHz/2.0GHz Dual-Gear Octa-Core CPU Subsystem with Power/Performance Enhancements for a Fully Integrated 5G Smartphone SoC,2020 IEEE International Solid-State Circuits Conference - (ISSCC)
smartphone_performance,Format effects of Traditional Chinese character size and font style on reading performance when using smartphones,2017 International Conference on Applied System Innovation (ICASI)
smartphone_performance,Low-Band MIMO Antenna for Smartphones With Robust Performance to User Interaction,IEEE Antennas and Wireless Propagation Letters
smartphone_performance,$4 \times 4$ MIMO Performance of Two Conjoined Dual Wideband Antennas Including the Feedline Effects for 5G Smartphones,2019 IEEE Asia-Pacific Microwave Conference (APMC)
smartphone_performance,Smartphone GNSS positioning performance improvements through utilisation of Google location API,"2018 41st International Convention on Information and Communication Technology, Electronics and Microelectronics (MIPRO)"
smartphone_performance,GNSS Reflectometry from Smartphones: Testing Performance of In-Built Antennas and GNSS Chips,IGARSS 2020 - 2020 IEEE International Geoscience and Remote Sensing Symposium
smartphone_performance,Fatigue Detection Method Based on Smartphone Text Entry Performance Metrics,2016 9th International Conference on Developments in eSystems Engineering (DeSE)
smartphone_performance,Performance comparison of smartphones and a wearable motion sensor for patient m-assessment,2018 16th Biennial Baltic Electronics Conference (BEC)
smartphone_performance,Impact of Chipset Configuration on Thermal Performance of Smartphones,2018 17th IEEE Intersociety Conference on Thermal and Thermomechanical Phenomena in Electronic Systems (ITherm)
smartphone_performance,Experiment-Based Smartphone Traffic Modeling and Power Saving Performance Analysis for LTE DRX Mechanism,"2014 IEEE International Conference on Internet of Things (iThings), and IEEE Green Computing and Communications (GreenCom) and IEEE Cyber, Physical and Social Computing (CPSCom)"
smartphone_performance,Performance analysis of ubiquitous web systems for SmartPhones,2011 International Symposium on Performance Evaluation of Computer & Telecommunication Systems
smartphone_performance,Response time performance estimation in smartphones applying dynamic voltage & frequency scaling and completely fair scheduler,The 18th IEEE International Symposium on Consumer Electronics (ISCE 2014)
smartphone_performance,Performance Evaluation of Indoor Positioning Systems based on Smartphone and Wearable Device,2020 5th International Conference on Smart and Sustainable Technologies (SpliTech)
smartphone_performance,Slot Antenna Performance and Signal Quality in a Smartphone Prototype,IEEE Antennas and Wireless Propagation Letters
smartphone_performance,Connected Smartphones and High-Performance Servers for Remote Object Detection,"2014 IEEE International Conference on Cyber-Physical Systems, Networks, and Applications"
smartphone_performance,Optimizing Performance of Real Time Multiplayer 3D Games on Smartphone Using Unsupervised Learning (K-Means),2019 Fourth International Conference on Informatics and Computing (ICIC)
smartphone_performance,Near Real-time Performance of Population-based Nature-Inspired Algorithms on Cheaper and Older Smartphones,2018 5th International Conference on Soft Computing & Machine Intelligence (ISCMI)
smartphone_performance,Performance testing of PDR using common sensors on a smartphone,2013 International Conference on Advanced Computer Science and Information Systems (ICACSIS)
smartphone_performance,Performance characterization of aspheric polymer lens formed by gravity and surface tension: A high magnification portable microscope for smartphone and tablet,2016 9th Biomedical Engineering International Conference (BMEiCON)
smartphone_performance,Performance analysis of intrusion detection systems for Smartphone security enhancements,International Conference on Mobile IT Convergence
smartphone_performance,Smartphone–controlled industrial robots: Design and user performance evaluation,"2022 IEEE 22nd International Symposium on Computational Intelligence and Informatics and 8th IEEE International Conference on Recent Achievements in Mechatronics, Automation, Computer Science and Robotics (CINTI-MACRo)"
smartphone_performance,Oppo Reno5pro Smartphone Single-frequency GNSS Positioning Performance Evaluation,2022 IEEE International Conference on Unmanned Systems (ICUS)
smartphone_performance,Interactive audio-visual performance system controlled by smartphone based on arm movements,2016 International Conference on Advanced Materials for Science and Engineering (ICAMSE)
smartphone_performance,Performance Anomalies of Smartphone-based Mobile Wi-Fi Hotspots,"2019 3rd International Conference on Recent Advances in Signal Processing, Telecommunications & Computing (SigTelCom)"
smartphone_performance,Real-World Performance Evaluations of Low-Band 5G NR/4G LTE 4×4 MIMO on Commercial Smartphones,2024 IEEE Wireless Communications and Networking Conference (WCNC)
smartphone_performance,Performance and power consumption evaluation in smartphone based image processing for medical applications,2018 IEEE International Conference on Imaging Systems and Techniques (IST)
smartphone_performance,From Finger Gesture to Finger Choreography: Enabling 3D Live Performances on Smartphones,2014 18th International Conference on Information Visualisation
smartphone_performance,Comparison of Smartphone Sensors Performance Using Participatory Sensing and Cloud Application,"2015 International Conference on Identification, Information, and Knowledge in the Internet of Things (IIKI)"
smartphone_performance,Survey of non-visual identification performance by using a tactile compass in smartphones,2017 International Conference on Applied System Innovation (ICASI)
smartphone_performance,Development of a Smartphone-Based Educational Robot with Cloud Architecture and Evaluation of Its Performance,"2018 Latin American Robotic Symposium, 2018 Brazilian Symposium on Robotics (SBR) and 2018 Workshop on Robotics in Education (WRE)"
smartphone_performance,A performance study on context-aware real-time multimedia transmission between smartphone and cloud,2012 International Symposium on Intelligent Signal Processing and Communications Systems
smartphone_performance,Performance Evaluation of “SmartSource” a Distributed Database System Using Smartphone in Cellular Network,2018 4th International Conference on Computing Communication and Automation (ICCCA)
smartphone_performance,Estimating Cognitive Performance Changes Based on Psychophysiological Sensor in the Smartphone: A Proposed Model,2019 11th International Conference on Information Technology and Electrical Engineering (ICITEE)
smartphone_performance,Temperature-aware Over Current Protection in Smartphone PMIC for System Performance Enhancement,"2022 37th International Technical Conference on Circuits/Systems, Computers and Communications (ITC-CSCC)"
smartphone_performance,Low Profile Reconfigurable MIMO Antenna with High Isolation and Wideband Performance for 5G Smartphone,2022 IEEE 10th Asia-Pacific Conference on Antennas and Propagation (APCAP)
smartphone_performance,Pointing Performance Evaluation Experiment of Smartphone-based Operation Methods for Real-World Clicker,2023 IEEE International Conference on Robotics and Biomimetics (ROBIO)
smartphone_performance,LTE HetNet Mobility Performance through Emulation with Commercial Smartphones,2014 IEEE 79th Vehicular Technology Conference (VTC Spring)
smartphone_performance,Performance Analysis of Smartphone-based Mobile Wi-Fi Hotspots Operating in a Congested Environment,"2019 6th International Conference on Electrical Engineering, Computer Science and Informatics (EECSI)"
smartphone_performance,Design and Performance Evaluation of MIMO Antenna for 5G Smartphones,"2023 IEEE 3rd International Conference on Applied Electromagnetics, Signal Processing, & Communication (AESPC)"
smartphone_performance,Performance Analysis of Smartphone-Sensor Behavior for Human Activity Recognition,IEEE Access
smartphone_performance,Performance Analysis of Multi-Motion Sensor Behavior for Active Smartphone Authentication,IEEE Transactions on Information Forensics and Security
smartphone_performance,Orthogonally Polarized Dual Antenna Pair With High Isolation and Balanced High Performance for 5G MIMO Smartphone,IEEE Transactions on Antennas and Propagation
smartphone_performance,Performance Analysis of Touch-Interaction Behavior for Active Smartphone Authentication,IEEE Transactions on Information Forensics and Security
smartphone_performance,Performance Analysis of Sensor Fusion Techniques for Heading Estimation Using Smartphone Sensors,IEEE Sensors Journal
smartphone_performance,Secure Outsourced Biometric Authentication With Performance Evaluation on Smartphones,IEEE Transactions on Information Forensics and Security
smartphone_performance,Improving smartphone user experience by balancing performance and energy with probabilistic QoS guarantee,2016 IEEE International Symposium on High Performance Computer Architecture (HPCA)
smartphone_performance,Building high-performance smartphones via non-volatile memory: The swap approach,2014 International Conference on Embedded Software (EMSOFT)
smartphone_performance,Improving the storage performance of smartphones through journaling in non-volatile memory,IEEE Transactions on Consumer Electronics
smartphone_performance,"Positioning Performance Assessment of Geodetic, Automotive, and Smartphone GNSS Receivers in Standardized Road Scenarios",IEEE Access
smartphone_performance,Unsupervised driving performance assessment using free-positioned smartphones in vehicles,2016 IEEE 19th International Conference on Intelligent Transportation Systems (ITSC)
smartphone_performance,Smartphone sensor platform to study traffic conditions and assess driving performance,17th International IEEE Conference on Intelligent Transportation Systems (ITSC)
smartphone_performance,Enhancing tracking performance in a smartphone-based navigation system for visually impaired people,2016 24th Mediterranean Conference on Control and Automation (MED)
smartphone_performance,DORA: Optimizing Smartphone Energy Efficiency and Web Browser Performance under Interference,2018 IEEE International Symposium on Performance Analysis of Systems and Software (ISPASS)
smartphone_performance,Performance and Evaluation of Smartphone Based Wireless Blood Pressure Monitoring System Using Bluetooth,IEEE Sensors Journal
smartphone_performance,Performance Assessment of the Android Smartphone’s IMU in a GNSS/INS Coupled Navigation Model,IEEE Access
smartphone_performance,Security and performance aspects of Bytewalla: A Delay Tolerant Network on smartphones,"2011 IEEE 7th International Conference on Wireless and Mobile Computing, Networking and Communications (WiMob)"
smartphone_performance,Performance Analysis of LTE Smartphones-Based Vehicle-to-Infrastrcuture Communication,2012 9th International Conference on Ubiquitous Intelligence and Computing and 9th International Conference on Autonomic and Trusted Computing
smartphone_performance,Future of Mobile Software for Smartphones and Drones: Energy and Performance,2017 IEEE/ACM 4th International Conference on Mobile Software Engineering and Systems (MOBILESoft)
smartphone_performance,A Hybrid Swapping Scheme Based On Per-Process Reclaim for Performance Improvement of Android Smartphones (August 2018),IEEE Access
smartphone_performance,Improving Flash Memory Performance and Reliability for Smartphones With I/O Deduplication,IEEE Transactions on Computer-Aided Design of Integrated Circuits and Systems
smartphone_performance,Practical Indoor Localization via Smartphone Sensor Data Fusion Techniques: A Performance Study,2019 16th IEEE Annual Consumer Communications & Networking Conference (CCNC)
smartphone_performance,A methodology for energy performance testing of smartphone applications,2012 7th International Workshop on Automation of Software Test (AST)
smartphone_performance,Performance Comparison of Dynamic Time Warping (DTW) and a Maximum Likelihood (ML) Classifier in Measuring Driver Behavior with Smartphones,2015 IEEE Symposium Series on Computational Intelligence
smartphone_performance,Assessment and Optimization of the Circadian Performance of Smartphone-Based Virtual Reality Displays,IEEE Journal of the Electron Devices Society
smartphone_performance,Performance Improvement of Linux CPU Scheduler Using Policy Gradient Reinforcement Learning for Android Smartphones,IEEE Access
smartphone_performance,PerfLoc (Part 2): Performance Evaluation of the Smartphone Indoor Localization Apps,2018 International Conference on Indoor Positioning and Indoor Navigation (IPIN)
smartphone_performance,Robot-assisted smartphone performance testing,2015 IEEE International Conference on Technologies for Practical Robot Applications (TePRA)
smartphone_performance,Whom to Blame? Automatic Diagnosis of Performance Bottlenecks on Smartphones,IEEE Transactions on Mobile Computing
smartphone_performance,Smartphone-based measurements of LTE network performance,2017 IEEE International Instrumentation and Measurement Technology Conference (I2MTC)
smartphone_performance,Can HTTP/2 Really Help Web Performance on Smartphones?,2016 IEEE International Conference on Services Computing (SCC)
smartphone_performance,Performance improvement of offline phase for indoor positioning systems using Asus Xtion and smartphone sensors,Journal of Communications and Networks
smartphone_performance,E,"Proceeding of IEEE International Symposium on a World of Wireless, Mobile and Multimedia Networks 2014"
smartphone_performance,AI Tax in Mobile SoCs: End-to-end Performance Analysis of Machine Learning in Smartphones,2021 IEEE International Symposium on Performance Analysis of Systems and Software (ISPASS)
smartphone_performance,Smartphone Distractions and its Effect on Driving Performance using Vehicular Lifelog Dataset,"2019 International Conference on Electrical, Communication, and Computer Engineering (ICECCE)"
smartphone_performance,"Advancements in Package-on-Package (PoP) technology, delivering performance, form factor & cost benefits in next generation Smartphone processors",2013 IEEE 63rd Electronic Components and Technology Conference
smartphone_performance,Performance Evaluation of Multi-pattern Matching Algorithms on Smartphone,"2012 Seventh International Conference on Broadband, Wireless Computing, Communication and Applications"
smartphone_performance,Performance comparison of a probabilistic fingerprint-based indoor positioning system over different smartphones,2013 International Symposium on Performance Evaluation of Computer and Telecommunication Systems (SPECTS)
smartphone_performance,A performance comparison of elliptic curve scalar multiplication algorithms on smartphones,"CONIELECOMP 2013, 23rd International Conference on Electronics, Communications and Computing"
smartphone_performance,Application Prioritization Engine for Enhancing Real-Time Performance in Smartphones,IEEE Transactions on Network and Service Management
smartphone_performance,Graceful Performance Adaption through Hardware-Software Interaction for Autonomous Battery Management of Multicore Smartphones,2018 Ninth International Green and Sustainable Computing Conference (IGSC)
smartphone_performance,Evaluation of feature points descriptors' performance for visual finger printing localization of smartphones,"2018 IEEE/ION Position, Location and Navigation Symposium (PLANS)"
smartphone_performance,Performance evaluation of application layer joint coding for video transmission with smartphones over terrestrial/satellite emergency networks,2014 IEEE International Conference on Communications (ICC)
smartphone_performance,Wearable Indoor UWB Localization Performance in Smartphone Carrying Contexts: An Investigative Study,2023 32nd IEEE International Conference on Robot and Human Interactive Communication (RO-MAN)
smartphone_performance,Effects of smartphone usage on driver safety level performance in urban road conditions,"2014 11th International Conference on Electrical Engineering/Electronics, Computer, Telecommunications and Information Technology (ECTI-CON)"
smartphone_performance,Detecting and diagnosing performance impact of smartphone software upgrades,2016 12th International Conference on Network and Service Management (CNSM)
smartphone_performance,Performance Analysis of GNSS + 5G Hybrid Positioning Algorithms for Smartphones in Urban Environments,IEEE Transactions on Instrumentation and Measurement
smartphone_performance,APPS: Accelerating Performance and Power Saving in Smartphones Using Code Offload,2016 IEEE 6th International Conference on Advanced Computing (IACC)
smartphone_performance,Improving smartphone downlink performance and energy efficiency with 3-antenna receive diversity,"2014 International Conference on Computing, Networking and Communications (ICNC)"
smartphone_performance,Development of statistical approach for estimating key competitive performance measures of smartphone applications,2016 Sixteenth International Conference on Advances in ICT for Emerging Regions (ICTer)
smartphone_performance,Text Entry Performance and Situation Awareness of a Joint Optical See-Through Head-Mounted Display and Smartphone System,IEEE Transactions on Visualization and Computer Graphics
smartphone_performance,Performance Analysis of Intrusion Detection Systems for Smartphone Security Enhancements,2021 2nd International Conference on Smart Computing and Electronic Enterprise (ICSCEE)
smartphone_performance,Architecture and Performance of XML-Based Componentization of the Symbian Smartphone Platform,32nd EUROMICRO Conference on Software Engineering and Advanced Applications (EUROMICRO'06)
smartphone_performance,Clinical Programming Software to Evaluate Auditory Performance in Cochlear Implant Patients using Smartphone,2018 IEEE 8th International Advance Computing Conference (IACC)
smartphone_performance,Performance and reliability of a 5G smartphone RF-antenna system: Influence of temperature field,"2018 34th Thermal Measurement, Modeling & Management Symposium (SEMI-THERM)"
smartphone_performance,Smartphone Performance,HSPA+ Evolution to Release 12: Performance and Optimization
smartphone_performance,Antenna Performance Over-the-Air Testing of 5G Commercial Smartphones,IEEE Transactions on Instrumentation and Measurement
